Company Name,Overall Rating,Review Date,Review Title,Job Title,Job Details,Location,Pros,Cons
Splunk,5.0,"Jan 11, 2024",Great pay and benefits,Regional Sales Manager,"Current Employee, more than 1 year","Plano, TX","The people are great, good $, great product","Like any other tech company, there’s layoffs and unclear direction post acquisition by Cisco"
Splunk,4.0,"Jan 11, 2024",Changing Culture but Overall Good Place to Work,Regional Sales Manager,Current Employee,,Has a strong product. Recognizable company,New leadership cutting costs. Company culture transitioning from a laid-back tech company to an uptight more strict business
Splunk,3.0,"Jan 15, 2024",okay at best,Regional Sales Manager,"Current Employee, more than 3 years","Washington, DC",company is doing well at this time but the notice of the acquisition has people worried about the future,acquisition by Cisco has decreased some morale
Splunk,4.0,"Jan 18, 2024",OK for the money,Director of Product Management,"Current Employee, less than 1 year","California, MD","good comp package, relatively good product",recently acquired so not sure what the future brings
Splunk,5.0,"Jan 8, 2024",good firm to work at,Software Engineer,"Current Employee, more than 1 year","Seattle, WA","great culture, web and comp and flexibility",there is limited PTO. they give many official holidays but not enough PTO
Splunk,4.0,"Jan 22, 2024",Splunk,Backend Engineer,Current Employee,"Fremont, CA","good benefits- lunch, transport, stay",bad atmosphere and not helping employees
Splunk,5.0,"Dec 22, 2023",Great Company Support,Professional Services Consultant,"Current Employee, more than 5 years","Washington, DC",Training and support given to consultants is top notch. Great depth within company channels to get assistance to just about any technical questions. Company works hard to keep employees informed.,Company is still working on knocking down the silos that exist in just about any large organization.
Splunk,2.0,"Jan 19, 2024",New leadership sucks,Software Engineer,Current Employee,,Culture in certain orgs *used* to be fun,"New leadership is pretty extraordinarily bad
Layoffs"
Splunk,5.0,"Jan 8, 2024",Good company,Software Engineer,"Former Employee, more than 1 year","San Jose, CA","Great benefits, opportunity for professional growth, education incentives, very smart people","Demanding schedule, high pressure, all hands meetings were kinda fluffy"
Splunk,3.0,"Jan 16, 2024",Could be better,Staff Accountnat,Current Employee,,"Salary, benefits, stock, and experience",Work load is unreasonable and hiring additional headcount takes too long
Splunk,2.0,"Jan 15, 2024",Management needs improvement,"Manager, Compliance","Current Employee, more than 3 years","Seattle, WA","Flexible work, generous time off and decent pay",Management at all levels is terrible
Splunk,2.0,"Jan 15, 2024","Very Bureaucratic, very unorganized, explains acquisition ",Sales Engineer,"Former Employee, more than 1 year","Dallas, TX","Good team, chill management, great pay + perks",Extremely manipulative on ways to grow
Splunk,4.0,"Jan 10, 2024",Cost cutting mode,Principal Software Engineer,"Former Employee, more than 1 year","San Jose, CA","Technical challenges, Tech stack (Kubernetes, golang)","squeezing employees, not enough resources, lot of work"
Splunk,5.0,"Jan 8, 2024",Great place to work,ISR- Inside Sales Representative,"Current Employee, more than 1 year","Tysons Corner, VA",great product and company is very sales oriented,being acquired in next 6-12 months - promotions are limited at the time being
Splunk,5.0,"Jan 15, 2024",Great place to work,Anonymous Employee,Current Employee,,Incredible and flexible work environment,Acquisition causing lots of changes
Splunk,3.0,"Jan 17, 2024",it's alright,ISR- Inside Sales Representative,Current Employee,"Tysons Corner, VA",Pay is better than others,extremely political with Cisco buyout
Splunk,3.0,"Jan 9, 2024",easy place to get stuck,Gscc Operator,Former Employee,"McLean, VA",I enjoyed the people/ teams I worked with closely.,"Poor management
It's not what you know it's who you know
overworked, underpaid"
Splunk,2.0,"Nov 13, 2023",Riding the vapors of a once great product,Anonymous Employee,"Current Employee, more than 1 year",,Strong enough product history to keep chugging along but better will come along. People stay for the aggressive pay & benefits but that is slowly ending.,"Investor push for cost reductions will slowly gut the place of talent and Cisco will finish the job. Most poorly run company with noticeably bad internal structure. ""What got you here won't get you there"" is something SPLUNK needs to figure out."
Splunk,3.0,"Nov 28, 2023",under pay internal hires,RSM,Current Employee,"Austin, TX",You'll work with smart people,"There's a lot of double work. I was promoted and everyone on my team makes significantly more than I do who was an external hire doing the same role. There's too many resources (people, overflow of redundant tools) that in the end don't aid in making the work day better or aid in a sale and many ""yes"" men in mid-level leadership."
Splunk,4.0,"Jan 9, 2024",Splunk - great company,Operations Associate,"Former Employee, more than 1 year","San Jose, CA",CEO is very involved and holds weekly town hall meetings. Great Benefits.,I can't think of any.
Splunk,4.0,"Jan 5, 2024",Senior software engineer,Senior Software Engineer,Current Employee,"Austin, TX",Work life balance is great,Horrible management is really bad
Splunk,5.0,"Jun 7, 2023",Optimistic with where Splunk is going forward,Anonymous,"Current Employee, more than 1 year",,"- working with talented and smart people - DEIB (diversity, equity, inclusion and belonging) program: very thoughtful and important initiative for the company; you don't see this everywhere and I genuinely appreciate how Splunk prioritizes this. - great compensation - decent work / life balance - Clear message around 3 year company strategy set by the leadership team and how that impacts the work we're doing/focusing on - it took a while but there is finally a formal goal setting/career development and planning program.","- A lot of leadership churn in the last year (expected with new CEO ) but I think this change is good and at times necessary as we're evolving as a company - When I joined last year, I was surprised with the lack of processes and tools in place, and it made our jobs a lot more difficult to get things done. The good news is that with the overwhelming feedback from across the company around tech debt and lack of operational efficiency, the leadership team took that feedback and rolled out new process and tools to address this. There's a lot of change management through this and the transition has not been easy or seamless but I'm optimistic that this will set the team up for success and scalability in the long term."
Splunk,3.0,"Dec 28, 2023",Splunk has changed ,Senior UX/UI Designer,"Former Employee, more than 3 years","Santa Clara, CA",Great peers to work with. Good office location (San Jose).,Executive leadership is out of touch with employees. Cisco acquisition has changed the focus of the company.
Splunk,4.0,"Jan 5, 2024",Great Place To Work,Regional Sales Manager,"Current Employee, more than 3 years","Seattle, WA","Great culture 
Solid benefits
Great technology stack",Unsure of the future with the Cisco acquisition
Splunk,5.0,"Jan 3, 2024",Great Company!,"Sr. Manager, Operations","Current Employee, more than 3 years","Los Angeles, CA",Great company great community and culture.,Bottom line for the company impacts raises and bonuses too often
Splunk,1.0,"Jan 15, 2024",Avoid ,Sodftware Engineer,"Former Employee, more than 1 year",,"Good leave, ok pay. Wlb","No direction, lack of career movement and opportunity. Everyone is just looking to keep their own job"
Splunk,2.0,"Nov 28, 2023",Running on fumes,Software Engineer,"Former Employee, more than 1 year","Seattle, WA","Lots of opportunities to have impact, due to high level of technical debt accumulated over the years. If you can figure out how to navigate the core codebase and get features launched, you'll be treated well.",Codebase and processes make it very hard to make progress. You have to be able to deal with frustration well.
Splunk,4.0,"Dec 28, 2023",4/5,Regional Sales Manager,"Current Employee, more than 5 years","Dallas, TX","flexible work-life balance, all remote for the most part",acquired by cisco so bear that in mind
Splunk,4.0,"Jan 2, 2024",Good to be here,Software Development Engineer (SDE),"Current Employee, more than 1 year","San Jose, CA","1. Culture
2. Pay
3. Env","1. Direction
2. Management
3. aqu"
Splunk,2.0,"Jul 18, 2023",New Leadership Is Horrendous,Principal Recruiter,"Former Employee, more than 5 years","Palo Alto, CA",- Pay - Benefits - Work Life Balance,- Zero opportunities for promotion. - Internal opportunities are limited. - New leadership and ELT are clueless and don't care. - The talent acquisition leadership is absolutely tone deaf. They took a great org and demolished it. They implemented new tools and processes that are horribly time consuming and make no sense. The VP and TA Director have no idea how to recruit. They are very cutthroat and will throw you out the door if you don't agree with them and play the politics game. They have no interest in getting to know you or defend you. They will constantly call you out and take the business's word over yours so document everything!!
Splunk,4.0,"Dec 21, 2023",Good place to work,RSM,"Current Employee, more than 5 years","Plano, TX",They offer a great product,There are a lot of other individual offerings out there that you compete with
Splunk,1.0,"Nov 18, 2023","Not what it used to be, just another employee number now, all company values out the window",Anonymous Employee,Former Employee,,Decent pay is the only pro,"Since acquisition news and even prior the company has gutted out multiple teams in prep for cisco, only to save money, lots of highly tenured employees were termed to move the role overseas"
Splunk,5.0,"Dec 18, 2023",Great Company,ISR- Inside Sales Representative,"Current Employee, more than 1 year","McLean, VA","Amazing work culture, diverse pay structure, great growth opportunities.",Company has had layoffs to non revenue generating roles.
Splunk,5.0,"Dec 15, 2023",Good rest and vest place,Director,"Former Employee, more than 3 years","San Jose, CA","Great pay and benefits, good tech","Nepotism, no cloud strategy, bad execution"
Splunk,1.0,"Dec 2, 2023",Stay away - completely changed ,Professional Services Consultant,"Former Employee, more than 3 years",,flexibility - no accountability - remote work,no accountability. Management at all levels is horrible and so embedded with each other they protect each other and do nothing. They want confusion to protect their own jobs.
Splunk,5.0,"Dec 18, 2023",Great benefits,Anonymous Employee,"Current Employee, more than 3 years",,Great benefits for all employees.,Nothing bad to say. I enjoy the benefits.
Splunk,4.0,"Nov 30, 2023",Generally positive,Sales Engineer,"Current Employee, more than 1 year","Phoenix, AZ",Good company culture and generous benefits.,Lots of recent turnover and the Cisco acquisition has created lots of uncertainty about the future.
Splunk,5.0,"Dec 7, 2023",Managment is great,Customer Success Manager,"Former Employee, more than 1 year","San Francisco, CA",Managment is very supportive and willing to support the development of your career,Layoffs have taken place each year since I've been here.
Splunk,5.0,"Dec 18, 2023",Awesome,Anonymous Employee,"Current Employee, more than 3 years",,Amazing amazing amazing amazing cool,There are no cons bro
Splunk,4.0,"Dec 8, 2023",Good company but lots of exec churn,Director of Engineering,"Former Employee, more than 1 year","San Francisco, CA","People focused, great team of smart engineers",Different teams are very siloed. Cloud native strategy is flawed.
Splunk,4.0,"Nov 30, 2023",Competitive Pay at Splunk,Director,"Former Employee, more than 3 years","San Jose, CA",You get to use your computer science principles in depth. Amazing enterprise product.,"Very political, unless you know someone at the top, it is very hard to get promoted."
Splunk,2.0,"Oct 24, 2023",You'll be gotten rid of if they find someone better,Sales Engineer,"Former Employee, less than 1 year","Washington, DC","All the free Splunk Certs you can pass, decent pay and comp structure.","Management will get rid of you without warning if they think someone can do a better job than you. If someone else is joining your team, I'd make sure they're doing something from you. This place is also super woke, and heavy on the virtue signaling."
