Company Name,Overall Rating,Review Date,Review Title,Job Title,Job Details,Location,Pros,Cons
BMC Software,4.0,"Aug 17, 2023",Top Notch - Leadership that trust and enable,Software Engineer,"Former Employee, more than 3 years","London, England",Salary expectations met and after time even exceeded inline with merit performance policy. Leadership are approachable for such a large company. Trust from senior management - able to push new idea's and be heard.,"Working in office policy needs some adjusting, most positions can be done remotely and at max hybrid yet there is a general push to be present in office which for the long commuters ain't enjoyable, need to get with the times and employee experience."
BMC Software,5.0,"Sep 3, 2023",Best Work Culture,Associate Product Developer,"Current Employee, more than 1 year",Pune,Everything is perfect in this company,"Growth rate is minimal, good for those who work for only money."
BMC Software,3.0,"Jul 11, 2023",Success is not being evenly distributed...,Software Developer,"Current Employee, more than 8 years","London, England",The work is interesting and BMC is going places without a doubt. The business is booming with amazing sales and products others would die for. ServiceNow is being left in the dust.,"Stagnant wages and a workforce looking for the door. There is already a 50% staff attrition in sales annually, so most of the sales team don't know anything about the products. Staff get well below inflation wage rises(so that is a wage cut)."
BMC Software,5.0,"Aug 29, 2023",Great Place To Work,Principal Software Developer,"Current Employee, more than 10 years","Houston, TX",Remote work Flexible Working Hours Respect for the Individual,Shrinking pool of Mainframe Experts due to retirement
BMC Software,5.0,"Jul 11, 2023",Great place to work at,Software Engineer,"Former Employee, more than 5 years",Tel Aviv-Yafo,"- Working with the latest and most popular technologies. - Teams are very independent, very involve in product decisions and have the freedom to develop new features. - Great work environment and great people. - Good work-life balance. - Hybrid - They put a lot of thought on the employee's welfare.",Can't think of any cons...
