Company Name,Overall Rating,Review Date,Review Title,Job Title,Job Details,Location,Pros,Cons
Unisys,5.0,"Nov 18, 2023",Very very good place to work,Software Engineer,"Current Employee, more than 1 year",Hyderābād,You get good worklife balance and I recommend Unisys as my best working company until now,I believe I don't have any to share
Unisys,4.0,"Oct 31, 2023","Great company, loyal, but not always the best at marketing",Sales Executive,"Former Employee, more than 5 years","Charlotte, NC","Treats everyone great, concerned about individual success, provides resources to help (if an employee takes advantage of them)","Not the most aggressive marketing, relies on customer relationships too much vs. competitive wins"
Unisys,3.0,"Nov 8, 2023",Good Job But Low Pay,IT Field Engineer,"Current Employee, more than 1 year",Sydney,Flexible and work-life balance. Opportunity to learn and meet new people each day. Access to courses and resources to study and gather new credentials.,"Low pay and expect to do more work. There are no proper conversations between management and employees which leads to miscommunication and low morale in employees, and soon they leave due to this attitude towards them."
Unisys,1.0,"Jan 27, 2024",Worst WLB,Senior Cyber Security Analyst,"Former Employee, more than 3 years",Bangalore Rural,I wish i have something to mention here.,"Worst WLB, No Growth, Pity Internal Politics"
Unisys,2.0,"Jan 2, 2024",Low pay,Tech Support Tier 1,"Current Employee, more than 1 year","Indianapolis, IN",Good online education resources (skillsoft},"Management is not great, pay is low, we always are understaffed"
Unisys,5.0,"Nov 17, 2023",One of the best places to work,Software Engineer,"Current Employee, more than 3 years",Bengaluru,"Opportunities to work in cutting-edge technologies.
Supportive and collaborative seniors.",Good opportunities but slightly low compensation.
Unisys,4.0,"Nov 14, 2023",nice place to work with great fellows,Junior Software Engineer Trainee,Former Employee,"Bogotá, Bogota",Good work-life balance Good fellows,Low compensation There are not high possiblities to have a big career
Unisys,2.0,"Jan 8, 2024",Low Salary,Knowledge Manager,"Former Employee, more than 3 years","Manila, Manila",Cannot think of any pros,"Low Salary
More work less life"
Unisys,5.0,"Nov 17, 2023",Good positive environment and work-life balance,Anonymous Employee,"Current Employee, more than 8 years",,Good positive environment and work-life balance,Nothing to report from my perspective
Unisys,4.0,"Nov 12, 2023",Unisys Experience,Technical Intern,"Former Employee, less than 1 year","Eagan, MN",-Not very stressful -Coworkers are nice and helpful,-Have to learn their OS -Doesn't work with machine learning or AI much -Boring
Unisys,5.0,"Nov 14, 2023",Software Developer At Unisys India Pvt Ltd,Software Developer,"Former Employee, more than 3 years",Bengaluru,"Great company to work, good work environment","Nothing to say, great place to work"
