Company Name,Overall Rating,Review Date,Review Title,Job Title,Job Details,Location,Pros,Cons
Samsung SDS,1.0,"Oct 27, 2017",Glassdoor wouldn't let me give less than 1 star,Anonymous Employee,"Former Employee, more than 5 years",,"Great benefits
Worked with great people","-Staff is very underpaid
-Seems like the company has been hanging on by a thread for years
-For an IT company all the internal systems we use are very outdated
-The Korean culture clashes with the American culture
-Meetings are almost always in Korean even if you do not speak it
-Americans feel like outcasts
-The work day ends at 6pm but if you leave at 6pm you will get dirty looks for leaving on time
-Most of management talks down to its employees and treats them like 2nd rate
-The management style is micro-management
-The company is retroactive to issues it faces instead of proactive
-There are constant rumors of sexual harassment between Korean dispatchers and staff level employees and the company doesn't seem to do anything more than slap them on the hand"
Samsung SDS,1.0,"Apr 21, 2016",Worst Company I Have Ever Worked At,Applications Developer,"Former Employee, less than 1 year","San Diego, CA",Not much other than health benefits,"After working here, then eventually experiencing what it's like to work at a good company, it's like night and day.  Every single day would feel physically sick about working here.  I would walk to the front door then imagine if that door had the word, ""HELL"" printed on it.  People come and go like the wind here.  A lot of the Directors are absolute control freaks who probably have not taken a leadership class in their lives.

Everything here is based on fear, not enthusiasm.  Bosses will use fear against you by only complaining/putting you down/only talking about every thing bad, without saying one good word about you.  Say something wrong during a meeting that might ""embarrass"" your boss, then they will make you ""relive"" their experience ten fold."
Samsung SDS,3.0,"Sep 2, 2014",Great Learning experience,Web Developer,"Current Employee, more than 3 years","Ridgefield Park, NJ","Good benefits, health insurance and dental, and PTO available.
There is ample opportunity to learn, though mostly through trial by fire.","Bonus is dismal.  ""Cheaping out"" is a common theme.  Especially when it comes to storage for the systems that are maintained.  Projects and systems show obvious signs of minimal testing, lack of QA, and strict enforcement of tight deadlines to save money.  Resources are stretched to the extreme."
Samsung SDS,2.0,"Aug 20, 2015",They Abuse you and use you,Anonymous Employee,"Former Employee, more than 1 year","Moonachie, NJ","Good benefits, learn a lot in one year, sr. Hr manager is wonderful and a huge help.","Instead of asking the employee what else they would like to be involved in, they go ahead and just force them into certain roles and tasks without any conversation. 
The Korean culture does not work in America. Need to change that mentality. 
There is no team work. It is like the Americans and Koreans are fighting against one another. The Koreans don't want to hear the ideas of the Americans which makes no sense since it would help the business tremendously. 
Their systems are pointless and not helpful. Need to upgrade their outlook system so scheduling can be easier to manage. 
SDS is very outdated compared to other companies."
Samsung SDS,2.0,"Feb 21, 2018",Only good to have the Samsung name on the resume,Logistics Coordinator,"Current Employee, more than 3 years","San Diego, CA","If you actually get hired,  you can say you actually worked for Samsung and everyone would be impressed.

Benefits are good, they give lunch money, and pay is just okay","You will sell your soul for working at Samsung.  SDS is the bottom feeder of all Samsung companies.  If you're Korean and not in management, be prepared to work long hours and prepare tons of reports. 

There's too many layers of management and most are unreasonable.  Everyone will start out as a contractor and you'll be lucky if you get hired within a year.   If you want to move up in your career, be prepared to relocate and work long hours.

Not worth the time."
Samsung SDS,4.0,"Feb 20, 2015",Overall Quite Satisfied (4.5 star),Senior Engineer,"Current Employee, less than 1 year","San Jose, CA","In my group I get to work on very cutting edge technologies. We have some really good engineers here.
Health insurance is great, probably the best you'll find anywhere.
Diverse work areas / projects.  It's a conglomerate, so SDS has access to a range of internal and external clients.
Stable relative to startups, or financial firms.
Can get nice gadgets.","There has been a push to be more innovative, and flexible.  Some parts of the firm will really feel like a 'big firm', but other parts will feel start-up like.  The spectrum is wide.
I think the overall experience may depend on which group you work in. e.g. traditional vs. new.
Some offices are kind of drab looking.
401k matching not great. Small percentage of the IRS max."
Samsung SDS,3.0,"May 26, 2020","Good Benefits, The Work Has Its Ups and Downs",Project Manager,"Former Employee, more than 3 years","Ridgefield Park, NJ","Good medical and 401k match
Nice coworkers(even management), subsidized cafeteria lunch, fun activities (Halloween party, ping pong & other Korean game tournaments, volunteer days)
Christmas gift ($400 Samsung gift card or choose from preselected Samsung products)
It’s a pleasure to work with the IT teams on the second floor.","B2B projects are all very unprofitable and mostly a waste of time. They mostly resell low margin Samsung devices.
Too dependent on business from Samsung Electronics and that business continues to decline.
Management has the best intentions but is unable to build the right products with the right features the market needs."
Samsung SDS,1.0,"Feb 28, 2018",SDSRA - bad place for your career,Anonymous Employee,Former Employee,"San Jose, CA","High quality problems to work on (but not enough quantity). Good work/life balance and good facilities (gym, nice office, nice cafe, etc). Good place to get 2 years of experience, but terrible place to stay longer than that",Low pay - 6% bonuses and 2% raises each year regardless of how well you do. Also no stock and no promotions except for a couple people who know which butts to kiss and how to kiss them. HR is completely out of touch with reality of keeping good people around in Silicon Valley. More than half the team left in the past year and more will leave soon because getting an offer somewhere else is guarantees to be higher pay
Samsung SDS,3.0,"Apr 26, 2015",business development,Anonymous Employee,Former Employee,,"Worked with some of the smartest and brightest people in the IT services industry.  Also a huge focus on teamwork, and a dedication by everyone to do whatever it takes to get the work done.","Senior executives really don't have a deep understanding of the specific functional areas and lack the industry knowledge to drive business.  Samsung is an organization that develops and nurtures managers that are generalists and more focused on administration and management.  In order to succeed, it needs to invest more in bringing quality talent from within specific industry sectors, especially at the higher levels of the organization."
Samsung SDS,5.0,"Mar 28, 2018",good,Anonymous Employee,Former Employee,,"best work environment and working condition. The building was equipped with full amenities like cafeteria, restaurant, shops, and gyms (in a separate building) and colleges were the best.","Busy times, you needed to work over night for weeks. Not very diversified in terms of employees. Uses its own word system which can by annoying sometimes."
Samsung SDS,1.0,"Aug 19, 2017",ROCK Star Employees WORST NIGHTMARE,Human Resources Representative,"Former Employee, more than 1 year","Ridgefield Park, NJ",Prestigious Name / Brand and food.,Stiff Culture | Low morale | Employee high turn over - 80-90% of the time Contractual Positions. ZERO growth. System is Old School / Primitive for being in the I.T. Industry - Ridiculous
Samsung SDS,3.0,"Feb 13, 2019",Limited Opportunities Unless Native Korean,Anonymous Employee,"Current Employee, more than 3 years",,"The physical amenities of the campus are very nice. Lovely space, good cafeteria (though trending downward), good gym, plenty of nooks to work privately. Opportunities to travel domestically and to Korea. 

Colleagues are friendly. Work-life balance (compared to the other offices in Seoul) is good, but be prepared to drop your life/cancel your vacation/work for 48 hours straight if an executive comes to town at the last minute.  

The Samsung name opens a lot of doors and looks very good on the resume.","There are exceptionally limited opportunities to move up or succeed unless you are a native born Korea. It's unclear who has it worse, Korean Americans or non-Koreans in terms of being taken seriously, getting put on good projects, or even just your colleagues in Korea being willing to work with you.  Pay for expensive areas to live like Silicon Valley and Seattle is very low. 

Annual reorganizations completely ruin any long-term planning for team. Extreme focus on P&L can make investment efforts that will pay off in a couple years but require initial work to gain traction are killed before they are given a chance. 

HQ is very opaque and it is hard for regional offices to understand strategy and direction for the year. Additionally, the Seoul Office has the final say in absolutely everything. If a product is developed in Samsung SDS America, HQ will take over the project/source code from the regional office. This leaves the individuals in the regional offices demotivated in their work. All initiatives must have a sponsor in the Korean office as well, even if it is a regional initiative.  But if you're not from the Korean office (ie you have prior personal connections) you can't even find who is the right person to talk to about sponsoring."
Samsung SDS,4.0,"Sep 12, 2015","Cutting edge technology, rapidly growing team",Anonymous Employee,"Current Employee, less than 1 year","San Jose, CA","Cutting edge technology, such as Spark distributed computing framework and Scala programming language. Co-workers are good at their fields. Potential access to interesting data.","HQ is in Korea, so you may get the occasional email with snippets in Korean that you don't understand (day-to-day work is completely in English). Like with any rapidly growing team, projects change, so you have to be flexible."
