Company Name,Overall Rating,Review Date,Review Title,Job Title,Job Details,Location,Pros,Cons
NCR,5.0,"Jan 25, 2024",Great company ,Chargeback Analyst,"Former Employee, more than 1 year","Dallas, TX",Work from home and great management,I have no complaints about my time there
NCR,4.0,"Feb 8, 2024",Good teams trying to save aging tech,SMB Account Manager,"Current Employee, more than 5 years",,"NCR is a great place to get corporate experience. Working in SMB Hospitality, the teams really cared about restaurants and did their best. Managers were open to feedback and very supportive. Restaurant technology is a fun industry.","The biggest challenge for the NCR SMB Hospitality is aging technology. NCR Aloha was the clear market leader a decade ago but the resources were not invested to keep it current. This is resulting in much of the SMB market going to Toast.

Also, the support and billing were moved overseas. These people are nice but often aren't properly trained. This leads to very angry customers over long support holds and duplicate billing. They are trying to make NCR Silver (Aloha Cloud) the future but it needs much more investment to catch up with competitors (like Toast & Square).

All that being said, I enjoyed my time at NCR because of the people. There is still a place for NCR in larger chains. If you only have restaurant experience and want to get a corporate business job, this is a great place to start."
NCR,1.0,"Mar 7, 2024",Terrible,Customer Service Technician,"Former Employee, more than 1 year","Manchester, NH","Training is pretty decent for entry level. If you have to work here, volunteer for as much training as you can, and then leave. 

That's about it.","The hours in my area were variable. Sometimes you started at 730am, and this would ruin until 530pm. Yes, the standard day is 10 hours, but you only get paid for 8. First and last 30 minutes of travel are unpaid, and there's a mandatory 1 hour (unpaid) lunch that you have to take. They're obviously hoping you just work through it, which happens to most techs I've met. Pretty scummy behavior, but it gets worse.

When I submitted my 2 weeks notice, I asked my boss if NCR paid out unused PTO he said that they did. He said that so I wouldn't ask for some of the time of my 2 weeks notice off, because I'm my state they do NOT do that.

On my last day, I submitted my last expense report on my company card. I thought everything was settled. They never contacted me at all after that. They never paid the last set of expenses despite my documentation, and just let my AMEX go to collections. Their turnover is also crazy. My brother had 4 managers in 2.5 years, because again, terrible place."
NCR,2.0,"Feb 5, 2024","Sales-Focused, not Execution Focused",Account Support Manager,"Current Employee, more than 8 years","Raleigh, NC",Many great coworkers and friends I’ve made over the years. First line management is also generally pretty good and grounded.,"This company is run by people who are career salesmen. And sales is all that they care about. This is reflected in almost all levels of the culture. Sales teams are often (and exclusively even) given the best perks and benefits, and are almost always the only ones being recognized by executive leadership on the all-hands calls. 

Meanwhile NCR invests laughably little (about 3%) into innovating the vast array of legacy products it constantly misrepresents as being cutting edge, and the actual newer products are also often years ahead of being working and viable solutions, but are sold anyways.

Execution and delivering on promises to customers is a distant second priority. That is until this rush to the sale’s finish line mantra complicates another sales opportunity, and leadership will then throw all hands on deck to (temporarily) fix said problem to keep the customer on the sales hook.

You will constantly hear executive leadership saying “the customers are first”. It’s all nonsense. What they really mean is “the sales pipeline is first”. And these aren’t just my words, at least three high level customer contacts (c-suite and director) have told me this same thing over the years."
NCR,5.0,"Mar 5, 2024",Work culture and career growth,Senior Software Engineer,"Current Employee, more than 3 years","Atlanta, GA","- Work culture is amazing
 - Reward for performace",Constant change in leadership makes hard to align with annual goals
NCR,4.0,"Mar 5, 2024",Average,Solution Owner,"Current Employee, more than 5 years","Atlanta, GA",People are amazing and collaborative,Pay and growth is not the best
NCR,1.0,"Jan 13, 2024",My advice is to look elsewhere,Product Owner III,"Former Employee, more than 1 year","Omaha, NE",Good benefits and good pay if you’re coming from outside the company. They are some truly awesome people in Omaha that you trauma bond with.,"The leadership within Omaha leaves much to be desired. It’s very top down and many people have left the company because of one leader in particular, yet nothing will change because the leadership group goes way back prior to D3. They have very unrealistic expectations of Product Owners, and don’t clearly communicate those expectations until it’s a problem. I left because the work life balance was not good, the leadership said you should be a full SME within 3-6 months, but would change the span of ownership every over month. It was very hectic and if they felt you weren’t keeping up or asked too many questions, you were labeled as incompetent by one leader and she made sure you were aware of it. 
This leader also disregarded any type of Covid restriction the company put in place because she was vocally anti-vax."
NCR,5.0,"Feb 19, 2024",Good Experience,Systems Engineer,"Current Employee, more than 3 years","Atlanta, GA",Lots of experience around. Many people have worked at the company for decades. There is a focus on technology and moving forward old systems.,Not the most competitive pay and not a lot of (visible) desire to grow internal talent for promotion.
NCR,5.0,"Feb 25, 2024",Room for improvement,Project Manager,"Former Employee, more than 3 years","Atlanta, GA","remote options , great office buildings",none at the present moment.
NCR,1.0,"Feb 12, 2024",Dishonest and poor management,Customer Engineer II,"Former Employee, more than 1 year","Chicago, IL",You are provided with a fleet vehicle almost feels as if you're running your own business with inventory and break/fix calls.,Dishonest management very disrespectful when you are asking for something as simple as weekends off. A specific person on the management team made sexually abusive remarks and was not fired or reprimanded at all. Management was covering up for this person and nothing ever happened. I felt as I was forced to quit I couldn't even listen to the sound of his voice when we called meetings. What kind of business are they running?
NCR,5.0,"Feb 22, 2024",Great company to work as a professional,VP-Technology,"Former Employee, more than 10 years","Atlanta, GA",Challenges and progression that drives opportunities,Work life balance must be managed by employee
NCR,5.0,"Feb 24, 2024",Good,PS Software Engineer II,Current Employee,,"Good Job
Great Work Location",Not much to share cons
NCR,4.0,"Jan 25, 2024",Professional Devlopment,Product Manager,"Former Employee, more than 1 year","Atlanta, GA","Great work place environment with the opportunity to meet new co workers in different divisions of the company,",Inconsistent management and lack of assistance in trying to help you grow.
NCR,5.0,"Feb 21, 2024",good,Anonymous Employee,Former Employee,,"good nice, wonderful , very secure",No cons I have seen
NCR,4.0,"Feb 18, 2024",Good place to work for,Tech Lead,Current Employee,"Unity, NH","Good Mgmt
Comfort Environment
Stable","High work load
none else"
NCR,4.0,"Feb 1, 2024",Great Company to work for,Executive Director,"Former Employee, more than 8 years","Atlanta, GA",Excellent career opportunities around the world. Fair treatment to all employees,"The company has just been divided into two different companies, not sure this will greatly help for future employees"
NCR,4.0,"Jan 19, 2024",Good Place to Start Career in Softare,Software Engineer II,"Current Employee, more than 3 years","Atlanta, GA","A lot of new projects they are getting off the ground.
Several legacy products that provide a baseline of funding (good for overall company stability).
Lots of young people.
Good work-life balance.","Not much Paid Time Off (2 weeks, 3 weeks after 5 years).
Constant need to maintain legacy products slows growth of new products."
NCR,3.0,"Feb 23, 2024",3 years employed,Account Manager,"Current Employee, more than 1 year",,People are great to work with and supportive.,Merger with NCR ruined a lot of things that made Cardtronics nice to work at. A lot of internal changes occurring all the time but teams don't always communicate it causing issues down the road.
NCR,3.0,"Feb 27, 2024","Great job, no employee appreciation",Supply Chain Analyst,"Current Employee, more than 8 years","Mount Juliet, TN","Great pay, benefits, 401K, work environment",They will drop you so fast regardless of your situation or years of service
NCR,5.0,"Jan 22, 2024",No complaints from me,Field Service Technician,"Current Employee, more than 1 year","Tidewater, VA","I've had good experiences so far. My team is solid, managers are involved and work with us. All around positive place for me.","A few minor bumps and growing pains from the recent Voyix/Atleos split, but no big cons come to mind"
NCR,1.0,"Dec 5, 2023","Set up for failure, so you fail",Software Engineer,"Former Employee, more than 8 years","Atlanta, GA","Met some nice people. Learned a lot from people around me. Was able to pass along my knowledge to others.

We all did our best despite the workload becoming more and more as people get let go and no backfill. 

There is quite the building of comradery as we suffer together.","This company sets you up for failure. It is sink or swim here, and it is most common for people to be drowning. Terrible communication, zero training, and no documentation.

I stupidly worked extremely long hours because it was urgent. Nothing is ever urgent when everything is urgent.

I had very inadequate managers, project managers, and coworkers. Most of my team was abroad. They were absolutely incompetent and liars. There were a few star developers sprinkled in. Many had no idea what they were doing and constantly pushed out bad code. They didn't like when I pointed out their problems. It meant they had eyes on them. I've experienced them lying about them doing work. They couldn't possibly do work if their lab wasn't up and connected.

I feel bad for the good ones who worked long hours and weekends."
NCR,4.0,"Oct 30, 2023",NCR,Executive Director,"Former Employee, more than 8 years","Atlanta, GA","Working at NCR Corporation in the Professional Services department provides a unique blend of positive experiences and challenges. The company offers a dynamic work environment, encouraging personal and professional growth, and fostering a culture of collaboration. Employees often find themselves surrounded by talented colleagues, enabling knowledge sharing and skill development. NCR's Professional Services division is an exciting place for those who enjoy a fast-paced and ever-evolving industry. The projects are engaging and the opportunities to work with a diverse clientele are enriching.","However, some may find that the company's organizational structure can be somewhat disorganized. The fast-paced nature of the work often requires adaptability and a certain level of self-direction. Yet, it can sometimes pose challenges for those who thrive in more structured environments. This aspect might not suit everyone, but for those who appreciate flexibility and can navigate amidst ambiguity, NCR Corporation remains an excellent place to learn and grow in the realm of professional services."
NCR,3.0,"Feb 29, 2024",Company Review,Software Engineer,"Current Employee, more than 3 years",,Work life balance is good,Salary does not match market
NCR,1.0,"Jan 8, 2024",Great Pay but miserable life.  ,Sales Representative,"Former Employee, more than 3 years",,Work from home. Base pay and commissions are good. Benefits are solid.,You'll be getting texts and calls from their unhappy customers after 5 p.m. and on weekends. Worst company I've ever worked for in regards to management. In just 3 years I've gone through 3 VP's of Sales and 3 Sales Managers. Over 200% turnover on my team of 20 people and to date nobody is still employed that I worked with. I was literally the Last of the Mohicans. NCR does not have their stuff together and the recently just outsourced (1.5 years ago) all of their internal processes and sales support to other countries like Siberia. It takes over a week to get quotes approved and management has no idea what their doing. Stay away from NCR unless you really like having extra doses of stress.
NCR,4.0,"Jan 30, 2024",Good company,Master Field Service Technician,"Current Employee, more than 8 years","Chicago, IL","No micromanaging 
Company van
Descent pay","Dispatchers are not on same page with techs
Bad techs don’t get held accountable"
NCR,1.0,"Feb 15, 2024",1.2 % annual raises,Implementation Specialist,"Former Employee, more than 8 years","Atlanta, GA","decent vacation package as one ages with the company.
health insurance discount incentives program-Wellness credits","Hospitality customers do not receive the service they need from NCR. To properly service these customers who pay for maintenance contracts the company must hire more field techs, help desk employees, account managers, project managers and implementation specialists. these hires are crucial to keeping the current client base adequately serviced and and not fleeing to other POS providers."
NCR,5.0,"Oct 19, 2023",Very Good if your in the NY/NJ area (unionized),Customer Engineer II,Current Employee,,"Very good working conditions. You operate with very little supervision. They train you fully and give you all the tools/equipment you will need. Very good union contract which guarantees you generous sick days, vacation time, overtime, and many other quality-of-life perks.","The base pay, while certainly not bad, isnt great either. With overtime you will make a lot but when overtime is slow you wont make as much. Also, if you are in a non-unionized area you will have very little say over how many hours you work each day and will have no contract protections. Also, if not in the union areas there is ""pay for performance"" which basically means you get a 1% raise every few years because the metrics they use to measure your performance are totally rigged. Wouldnt recommend working in the company unless its in the NY/NJ area."
NCR,4.0,"Jan 22, 2024",Good Starting Position,Customer Engineer,"Current Employee, more than 1 year","Milwaukee, WI",Decent pay for the entry level position.,Much of the job is dependent on driving for hours to the work site.
NCR,5.0,"Jan 24, 2024",Great place to work ,Media Relations Manager,"Former Employee, more than 5 years","Dayton, OH","Lots a opportunities for advancement, good salary and benefits",No cons at this time
NCR,4.0,"Jan 22, 2024",U.S. postal POS support,Callcenter Agent,"Former Employee, more than 3 years","Peachtree Cty, GA","Had medical, dental, and discount on stocks.",Lower pay wages for call center workers.
NCR,3.0,"Feb 21, 2024","Frisco, TX office",Account Support Specialist,"Current Employee, more than 5 years","Frisco, TX",Flexible depending on which team you’re on,Pay is not competitive with industry standards
NCR,4.0,"Jan 20, 2024",Good to start career post college,Data Analyst I,Current Employee,"Atlanta, GA","Good work life balance
Not too much pressure
Decent pay for first job out of college","Moving slow
Very little bonus"
NCR,2.0,"Feb 13, 2024",Lack of Focus,Product Manager,"Former Employee, more than 8 years","Los Angeles, CA","Good work/life balance and generally, the tools needed to complete work and projects were made available to employees.",Lack of clear focus for company direction from leadership hindered the performance of our teams.
NCR,5.0,"Jan 23, 2024",Caring and compassionate,Product Owner,Current Employee,,Caring and compassionate leadership. Great work/life balance,Pay is average in comparison.
NCR,3.0,"Jan 17, 2024",Great until the old culture was whitewashed in the pursuit of a new office.,Anonymous Employee,Former Employee,"Atlanta, GA",Nice new office in downtown Atlanta is a pro for some.,"Many of the employees in my division worked at a location north of the city for decades before the new office, replacing a 10ish minute commute with an hour and a half. Big company with big company problems. Employees were spread across the country and many of the management team were laid off and replaced with people on the west coast/other locations."
NCR,3.0,"Jan 12, 2024",NCR / NCR Voyix,Product Owner (PO),"Former Employee, more than 8 years","Aliso Viejo, CA",Teams and coworkers were supportive and cooperative.,"No transparency on what upper level decisions or policy changes mean to your job, product or position.

'One size fits all' process/procedure policy while attempting to use agile teams and processes."
NCR,5.0,"Jan 23, 2024",NCR,Software Engineer,Current Employee,"Atlanta, GA",Very good University Hire policy,Low advancement opportunities in carerr
NCR,3.0,"Feb 2, 2024",constant layoffs,Anonymous Employee,"Former Employee, more than 10 years","Atlanta, GA",exciting super cool high tech building in midtown Atlanta,this company has laid off employees twice a year (every year) for the 25+ years I worked there. Work/life balance is terrible and the stress and pressure is unbearable. If you don't live in the city the commute is insane.
NCR,5.0,"Jan 18, 2024",Great company,Senior Presales Engineer,"Current Employee, more than 5 years","Charlotte, NC",Great company that cares about their employees.,Can be Iong hours at times.
NCR,3.0,"Feb 13, 2024",Great First Job,Software Engineer II,"Current Employee, more than 3 years","Atlanta, GA",- Willingness to hire and train college graduates in Software Engineering,- Pay and pay increase is not very competetive
NCR,4.0,"Jan 12, 2024",Nice Employers,Software Engineer Intern,"Former Employee, less than 1 year","Atlanta, GA","Decent pay, good experience, nice office",Not a lot of development for technology
NCR,5.0,"Jan 10, 2024",Great place for work,Senior Magento Developer,Current Employee,,Using the last sofware tecnologies,"Bigger compannies, too many layoff"
NCR,3.0,"Feb 7, 2024",Good Job - Average Pay,Incident Manager,"Current Employee, more than 1 year","Atlanta, GA","Nice building
Good perks
Good culture","Average pay for heavy work load
Hard to move in different areas of the company"
NCR,4.0,"Dec 31, 2023",Such is life,Escalation Technician,Former Employee,"Syracuse, NY",Good job and health insurance is good as well,If you get laid off the do not give you advance notice
NCR,1.0,"Dec 12, 2023",Company who does not care about their employees,Anonymous Employee,"Former Employee, more than 5 years","Georgia, AL",Your coworkers are excellent human beings; those that have not been let go. No one gets fired; just RIF'd.,"Top tiers of management are careless robots. ""We"" have professional training and college degrees, but these people do not allow you to function as you would in a normal company rendering you useless or ineffective in clients eyes. You know things are bad when your top tiers of leadership sell 100% of their stock, remove all the effective leadership and move people in that are not qualified to even manage a single person. It used to be great here, it's a disaster now."
NCR,4.0,"Jan 3, 2024",Change is good,Bussiness Development Manager,Current Employee,"Atlanta, GA","Opportunity to make money, training, and great work life balance","Constant leadership changing, competition is everywhere"
NCR,3.0,"Feb 7, 2024",Decent place to work,Project Manager,"Former Employee, more than 3 years","Atlanta, GA","Large company, suggesting opportunities 
Great headquarters building in Atlanta","Matrixed org, workstreams not cohesive"
NCR,1.0,"Nov 14, 2023",No work/life balance,CE2,Current Employee,,You don't starve to death.,"Constant travel, no set schedule (if it is they will change as needed), they have so many clients you are not specialized, no transferable skills out side of plugging things up correctly, most on site time is spent waiting on software you have no control over, work w/in the financial sector has little to no actual security (no/ unreliable armed guards), metrics are based on x factors outside your control, upper leadership only paid their best field tech around 26/hr after serving for 15yrs (so their is no senior leadership in the field because no one wants to stay), call support has many language barriers (non English-speaking) and this prevents relevant info transfer and wastes time, they constantly threaten metrics and write ups to bully what employees remain until they nearly cannot cover their service area."
NCR,4.0,"Jan 4, 2024",Administrative assistant,Administrative Assistant,"Former Employee, more than 3 years","Atlanta, GA","Flexible schedule
Easy to move within company",June 19 is not observed as a holiday
NCR,5.0,"Jan 1, 2024",NCR,Software Engineer,Former Employee,"Atlanta, GA","good company and good collegues , overall is okay",slow growth and less bonus and increments
NCR,2.0,"Jan 9, 2024",Typical Global Organization,Senior Project Manager,"Former Employee, more than 3 years","Atlanta, GA","Decent health insurance, 401k, PTO, Holidays & standard benefits.","Lack of fairness in workload balancing, loyalty to outdated processes & a lack of cooperation between departments. Many roles shifted to cheaper labor forces but required more people to complete the same jobs. Layoffs in USA seemed directly correlated to expansion overseas as the internal teams became larger & more difficult to work with."
NCR,2.0,"Dec 4, 2023",Sent my position overseas in favor of paying a lower salary after 13 years,ESCALATIONS TECHNICIAN,"Former Employee, more than 8 years","Atlanta, GA","Good company culture, the people are great.","Blind upper management, low pay, impossible to get management to remember all that you have done over the course of the year. Over the course of the final 4 years, received a total of $1.25 in raises. Then without warning after 13 years, I was a victim of a reduction in force, and my position was sent to Bosnia in favor of much younger individuals with no experience, whom they could pay less than half my salary with no regard for customer service."
NCR,3.0,"Feb 5, 2024",Great stepping stone,Project Coordinator,"Current Employee, more than 1 year","Atlanta, GA",They let me work from home,The merger was a nightmare
NCR,3.0,"Nov 30, 2023",Lots of Overtime,ATM Support Specialist,"Former Employee, more than 3 years","Richmond, VA","The job was fun with the different systems that I got to work with. If you like solving puzzles, this was a good job to have as each issue could be something different that you need to figure out for the fix.","When I worked there, they were doing mandatory overtime.
I was averaging between 70-80 hours a week. Hopefully it has calmed down, but it did not seem likely when I left. If you have no life, then this could be good for you.
Unfortunately, it was not for me."
NCR,5.0,"Nov 26, 2023",Fantastic Tech Company,Customer Engineer II,"Current Employee, more than 1 year","Springfield, MO","You can plan your own routes based on active work orders, learn the ins and outs of what keeps a business running.","Demanding long hours; after familiarity of job, it may feel that you are under paid for how much work you do."
NCR,2.0,"Jan 17, 2024",Ask up front,Client Services Consultant,"Current Employee, more than 3 years","Atlanta, GA",Remote work flexibility and nothing else as a remote employee.,"Lack of leadership and accountability. Lack of training for role, and no reason for decisions made outside of money."
NCR,5.0,"Nov 21, 2023",Great place to work,Senior Software Developer,"Former Employee, more than 8 years","Atlanta, GA","The pay and benefits are competitive, and the work is software development work is interesting.

They are a stable and growing company, even through the pandemic. Good for a long-term career.

The top leadership seems competent, and they do a good job keeping everyone updated (regular town halls, Q&A, etc.).","no cons, it's a great company"
NCR,2.0,"Jan 28, 2024",Former Employee Review,Field Services Manager,"Former Employee, more than 5 years","New York, NY",Global organization with exposure to varying technologies,"Metrics driven. 
Lack of Interaction with teams and leadership.
Lack of company culture."
NCR,3.0,"Jan 29, 2024",Salary is not competitive,Software Engineer,"Former Employee, less than 1 year","Atlanta, GA",The WLB is fair relative to the salary.,Salary is not competitive for software engineers.
NCR,3.0,"Jan 29, 2024",NCR Review,Services Product Manager,"Current Employee, more than 5 years",,"Salary structure is good
Training is available
DEI friendly",Some managers are somtimes bullies
NCR,4.0,"Dec 20, 2023",Ncr,Field Service Technician,Current Employee,"Atlanta, GA","Start with 3 weeks vacation, pto days also","Scheduling, overtime that’s about it thanks"
NCR,2.0,"Jan 14, 2024","Great Tool Exposure, Poor work life balance",Incident Responder,"Current Employee, more than 1 year","Atlanta, GA","A lot of different tools to learn, and a face paced environment. Provides lots of good opportunities to learn.",Disorganized and no work life balance. Expectations of analysts are unrealistic.
NCR,4.0,"Dec 12, 2023",it a good company to work for,Data Scientist II,Current Employee,"Atlanta, GA",there are good people in the company,layoffs are frequent in the company
