Company Name,Overall Rating,Review Date,Review Title,Job Title,Job Details,Location,Pros,Cons
Skyscanner,1.0,"Aug 14, 2023",They don't know what they're doing,Senior Software Delivery Operations Manager,"Former Employee, less than 1 year","Edinburgh, Scotland",Company Culture (In some areas) Nice offices Good onboarding,"The experience of leadership in the Agile space is extremely questionable. One of the main director in this space believes Scrum Masters are Managers so that says it all really. They're also tracking progress using 'Epic Cycle Time' as their main indicator of progress and they have a 40 page software delivery handbook that everyones forced to read when they join and if you ask questions you're immediately pointed back to the handbook. Basically, they've hired people in very senior roles who have very little experience, and everyones been there for a long time so they haven't seen what it's like in other companies. You will also get fired for having a different opinion or pointing out challenges even if it is part of your role as a coach. I wouldn't apply if you're an experienced Agile Coach would be my advise as you'll be flogging a dead horse and they also don't have a strategy either. They only hire people into the role that haven't had a lot of industry exposure so they can mould them to fit Skyscanner. They also over-hired during covid and are at a stuck point for the next 4-5 years in terms of hiring roles they need to address some of their core challenges. My personal advise would be, save yourself the headache!"
Skyscanner,4.0,"Jun 9, 2023",Great place to work,Anonymous Employee,"Current Employee, more than 3 years","London, England",Great culture and great people work at Skyscanner. It strives to do the right thing with people and foster a collaborative culture of improvement across its internal processes and products.,Sometimes things can take a while to get done across areas due to the high degree of autonomy present within teams. Coordination can be hard.
Skyscanner,5.0,"Jul 10, 2023",Amazing company to work for,Software Engineer 2,"Current Employee, less than 1 year","Edinburgh, Scotland",Lots of things to learn Work life balance People friendly,"Even though they say they normalize salary for same role, there are still gaps in the pay"
Skyscanner,5.0,"Jun 18, 2023",Great culture,Software Engineer II,"Current Employee, less than 1 year","Glasgow, Scotland","Work culture is awsome. people really care about you the offices are awsome, and we have so many in-office events there is not much work pressure. encouraged to take leaves.","being less employees, it gets boring in office, especially on days, where employees generally work from home."
Skyscanner,5.0,"Jun 12, 2023",Skyscanner Review,Software Engineer-1,"Current Employee, more than 1 year","Edinburgh, Scotland",Best culture and life balance I've ever had from an employer. The atmosphere here is fantastic and work interesting and engaging.,Promotion process is heavy and demanding. Easier to get employed at a level than to be promoted to that level
Skyscanner,5.0,"Jul 19, 2023",Great place to work,Systems Engineer,"Current Employee, less than 1 year","Glasgow, Scotland",There is lot of growth opportunities,Too much meetings can be overwhelming
Skyscanner,5.0,"Jul 17, 2023",Good Work Life Balance,Software Engineer,Current Employee,"Edinburgh, Scotland",Take care of its employees,Slower progression sometimes if you're on training program
Skyscanner,3.0,"Aug 12, 2023","Good WLB, but lack of growth",Senior Data Analyst,"Current Employee, more than 1 year","Shenzhen, Guangdong","WLB is great, and lots of freedom on choosing what you’d like to work on. Managers are kind and caring.",Lack of career growth. The business doesn’t have a big potential to go to the next level. The management doesn’t have a clear vision.
Skyscanner,5.0,"Jun 13, 2023",Great place to work,Software Engineer,"Current Employee, more than 1 year","London, England","Really care about culture, lots of little day to day office life perks, committed team, excellent attention to diversity and inclusion","big, old, complicated systems that move slowly."
Skyscanner,4.0,"May 22, 2022",Very humane place to work on an interesting problem space,Senior Product Designer,"Current Employee, more than 3 years","London, England","- A lot of smart people that you can keep learning from
- Great work life balance and hybrid working is very well executed
- The company really cares about your wellbeing, your humanity is respected
- When you demonstrate ability, you're being trusted with problems/projects of ever increasing scope and impact
- Great compensation package and base compensation in product design
- New office location and set up is going to be rad!","- Pet unfriendly London office
- Lots of change in design leadership in the last couple of years
- Lots of new people come in and compromise gains and rewrite strategy just to have something to list in their resume
- Too many times the first iteration of something is the only iteration of something; some product managers love flaunting that they've shipped something, that they have run N number of experiments - and deemed experiment a failure after heavily descoping and compromising the spirit of the concept
- Lots of red tape - in terms of promotions and career growth(Senior to Principle is notoriously difficult) AND in terms of everything else (any extra curricular initiative dwindles as there's an insane amount of bureaucracy required to get it done)"
Skyscanner,3.0,"Jul 13, 2023",Low pay but nice work,Data Architect,"Former Employee, more than 1 year","Edinburgh, Scotland",Don't pay much tax due to low salaries Engineering teams are slow to build so gives you time to do nothing Engineers have little experience therefore designs don't get questioned.,Low pay Office location in Edinburgh is not good Office is looking dated Workforce is not diverse
Skyscanner,4.0,"Jun 4, 2023",Life at Skyscanner,Senior Marketing Manager,"Current Employee, more than 5 years","London, England","The benefits are pretty good, such as 5 weeks of paid time off after 5 years of service",Employee compensation is not great
Skyscanner,4.0,"Feb 27, 2023",Highly Recommend,Marketing,"Former Employee, more than 5 years","Edinburgh, Scotland","Very smart people, who are keen to share knowledge and also learn from your experiences. Willingness to experiment and take chances. Customer first approach Will listen to employees in regards to company vision and if you have a good manager will help support your career progression",Pivot frequently on strategy - often without completing prior focus.
Skyscanner,4.0,"Mar 21, 2023",A company with a vibrant culture and traveller first mentality,Anonymous Employee,Current Employee,,1) well being focused company culture 2) esteemed service that many travellers use 3) you’ll find this phrase used a lot “happy to help!” 4) very global team 5) multi-faceted feedback system,1) changes happen very suddenly often times 2) timezone differences with different teams
Skyscanner,2.0,"May 15, 2023",Not what it once was,Principal Designer,"Former Employee, more than 5 years","Edinburgh, Scotland","A lot of great people still work here. There are lots of opportunities for people willing to do whatever it takes to be the best. There are also lots of opportunities for people interested in focusing on the work, head down, and prefer to take direction.",The culture has changed dramatically since the pandemic. I no longer feel value-aligned with the company and don't feel comfortable saying more.
Skyscanner,5.0,"Jan 10, 2023",Great company to start as a grad!,Anonymous Employee,"Current Employee, less than 1 year","Edinburgh, Scotland","I find the rotation aspect of the graduate scheme very valuable as we get to explore different areas of engineering in the span of two years. Moreover, real responsibility is given to us from day 1 to make impactful change and when stuck, we can always reach out for help and everyone is always willing to help.","If you prefer to stay in a single team and don't appreciate the rotation aspect, this may not be the programme for you."
Skyscanner,5.0,"May 9, 2023",Great place,Software Engineer,Current Employee,,Great place to stay and work,Currently not have anthing to share
Skyscanner,4.0,"May 8, 2023",Salary,Performance Marketing Specialist,"Current Employee, more than 1 year","London, England","Relaxing culture, friendly team, nice office",Progression is subjective and can take a long time
Skyscanner,3.0,"Mar 19, 2023",Good employer overall. Could improve management of staff,Anonymous Employee,Current Employee,,"Bounced back from the pandemic and retained much of the staff. Staff were incentivised to stay by being given shares in the company. Pay has been really good. Opportunities to progress have been good in the past, these are a bit more limited now given the new shape the business has taken. (See below) I generally feel well cared for as an employee.","Hasn't quite mastered making innovation viable yet Since the pandemic, Skyscanner has re-focused the product development back to its core meta product. This means there isn't too much scope for any fresh, interesting projects for now. This could change in the future. The company has experimented with some innovative products in the past, but ultimately many of them have been eventually shelved. I have worked on several initiatives that were expensive and eventually turned out to be non-viable. This either because the business model was not viable, or the context of travel changed. Skyscanner could benefit by going back to its start up mindset, to test and learn faster. Management is a weakness There are a few really good managers, but their impact and contributions are not rewarded enough. I personally do not feel well managed, in terms of clear expectations being set or getting constructive feedback in a timely manner. It's a consensus across my team. Most employees are laser focused on their own career progression which can mean there is sometimes a competitive and non-cooperative vibe at times. The emphasis for career progression is on individual contributor work, which means the management focus is not quite there."
Skyscanner,5.0,"May 4, 2023",great place to work,Talent Manager,"Former Employee, more than 5 years","Edinburgh, Scotland",just a really nice place to work,"lack of career progression, specifically within internal growth"
Skyscanner,4.0,"Feb 16, 2023","Great people, great environment, great benefits",Product Designer,Former Employee,"London, England",Enjoyed working with the people. Everyone is helpful and cooperative in getting things done.,A lot of red tape affected the dev schedule. NO concrete release date for the feature since they are working agile and will release it when the item comes into the sprint. This made it hard to work around the feature.
Skyscanner,5.0,"Aug 15, 2022",Forward thinking company with strong core values,Senior Engineering Manager,"Current Employee, more than 1 year","London, England","Really is a people centric organisation where they fully support employees to develop with training and allocated time for development.
Has a really good internal recognition platform to celebrate successes but also has a fail fast culture which means they celebrate trying something new and working out quickly that it is the wrong thing to do.
A decent reward package with shared ownership being big part of Skyscanner's success.
Working towards changing travel to be sustainable. 
Really orientated to deliver for the traveler and looks for employees that have a passion for travel.
Really passionate about diversity in the workplace with various working groups driving constant improvements.",Being in travel during covid had been hit by resourcing levels due to leavers. Has however supported staff throughout the period and is recovering strongly with a new strategic direction brought in by the CEO John.
Skyscanner,3.0,"Jun 5, 2023","Potential is there, but not living up to it at the moment",Senior Marketing Manager,Current Employee,"Edinburgh, Scotland","Great benefits, great chance to build a global brand","very unorganised, mis-match of roles and responsibilities, unclear objectives, lack of responsibility given to non senior leadership team"
Skyscanner,3.0,"Mar 24, 2023","Nice social culture, bad tech",Senior Software Engineer,"Current Employee, more than 1 year","London, England",* travellers for travellers model * very receptive culture * work/life balance respected,"* how team organised creates tech constraints in solving tasks * processes ineffective - more talking about problems then trying to solve them * very slow grow perspective - had to perform on next level virtually a couple years to even consider promotion * attrition - most people around either long worked never having other job to compare, or new joiners"
Skyscanner,3.0,"Mar 6, 2023",avoid if you are neurodiverse,Anonymous Employee,"Current Employee, more than 1 year",,"friendly people, people mostly get on well together within teams to achieve a common goal","lack of understanding neurodiversity. came across a few instances of bullying and complete lack of understanding even from people who I respected in my time here. a company that prioritises being ""nice"" over being ""direct"" some people in leadership positions who follow the peter principle and have been promoted beyond their competence who bully others."
Skyscanner,4.0,"Mar 25, 2023",good wlb,Software Engineer,Current Employee,"Shenzhen, Guangdong","GOOD WLB, and female engineer friendly",not competitive compare to other ota
Skyscanner,2.0,"Apr 5, 2023",Poor product leadership,Senior Product Manager,"Current Employee, more than 1 year","London, England",Smart people at the mid senior level,Poor leadership with no vision or clear direction - trying to do everything at once but as a result achieve no progress Top down with no ability for product mangers to drive roadmaps Lack of atononmy Not agile - working like a legacy company in waterfall model
Skyscanner,4.0,"Jan 16, 2023","Good Culture, work life balance, above average salaries",Software Engineer II,"Current Employee, more than 1 year","London, England",- Great work culture - Cool life - Good tech stack - Some decent benefits,- Above average salary - Promotions are slow
Skyscanner,4.0,"Feb 20, 2022",Things are on the up!,Anonymous Employee,"Current Employee, more than 3 years","Edinburgh, Scotland","Since the development of the 2025 company strategy, the morale in the company feels as though it’s on its way up out of the gloom that has been the pandemic years. 

The move to hybrid working will be a positive one in my opinion (though some may disagree with me on this)… and it seems senior leadership have listened and are making efforts to make sure the culture of the company is still a major draw card for the current and any prospective employees.

Recent announcements have also seen some benefits that were put on hold due to the recovery mode we entered (a result of the pandemic) reinstated - and that’s certainly lifted spirits as well. I feel hopeful about the company’s future once again.",Compensation reviews can’t come soon enough - (and we’ve been told they are).
Skyscanner,5.0,"Feb 3, 2023",Great place to work,Talent Acquisition Manager,Current Employee,,Fantastic environment to grow your career.,No cons to note so far
Skyscanner,4.0,"Dec 8, 2022",Global culture even in Shenzhen office,Senior Software Engineer,"Former Employee, more than 3 years","Shenzhen, Guangdong","- Culture is attractive compared to other local Chinese internet companies (e.g. no 996, actually care people)","- Not very competitive salary compared to other local Chinese internet companies - Levels too flat, super hard to get promoted once become senior engieer"
Skyscanner,4.0,"Nov 23, 2022",Great employer,Software Engineer,"Current Employee, less than 1 year","London, England",- Experienced people that you will learn from - Mature systems and tools with interesting scaling problems and designs - Great values that make a great culture,- Difficult to get promoted (but depends on your effort ofc) - Minimum benefits - Share/Stock benefits cannot be utilised
Skyscanner,4.0,"Dec 30, 2022",Excellent culture,SE (Software Engineer),Current Employee,"London, England","Company culture is terrific, high emphasis on employee satisfaction",Pay and benefits may not be on par to what other companies offer
Skyscanner,5.0,"Apr 10, 2022",On the up again,Senior Software Engineer,"Current Employee, more than 3 years","Edinburgh, Scotland","- Travel is recovering and the company is getting back on track as it does
- Great ground level culture, with a committed diversity lead in Jenna 
- Salary ranges were reassessed in March 2022, with Scotland now competitive again 
- The focus during covid of trimming excess services and tech is starting to show a positive effect
- Great positive and proactive attitude by Office Managers. Most people still like to spend half the week at home, but the time in the office is good because of the people who put the effort in to make it so","- Too many pieces of work in progress at one time leads to slower overall progress
- A higher than healthy percentage of junior experience engineering managers leads to them having few good examples to emulate. Hiring drive in progress should help"
Skyscanner,3.0,"Aug 17, 2022",Very good at pretending to be a fair company,Senior Software Engineer,"Current Employee, more than 3 years",Barcelona,"- Mid-range salary;
- Cultural/Gender Diversity;
- Nice offices;","- The growth path is allegedly clear, but decisions about promos are made behind closed doors in ways that do not follow the process, e.g. they have a calibration process to ensure parity, but senior leadership can go around it.
- Discriminatory feedback involving mental health issues. This was raised to the people team leadership, but I've seen no outcome from it.
- Software Quality is not what they state in their values. They could have been 1st class engineering in the past, but that is not even close to the current situation."
Skyscanner,5.0,"Sep 17, 2022","Great culture, great people",Software Developer,"Current Employee, less than 1 year","Glasgow, Scotland",The people are brilliant and so very friendly. You could go to any department and they’d be more than happy to help if you had any questions or if you were just curious about what they do.,There isn’t one that is apparent yet.
Skyscanner,3.0,"Apr 18, 2023",Review,Rewards Manager,"Former Employee, less than 1 year","London, England",Good salary and benefits offering,n/a n/a n/a n/a n/a
Skyscanner,2.0,"Jul 11, 2022","Used to be good,  not any more",Software Engineer,"Current Employee, more than 3 years","Edinburgh, Scotland","There are so many smart people, no blame culture in general.
Nice offices at the price of generally low income","1) Very high attrition, which means there is so much knowledge lost.
2) Salaries are lacking behind the market, which is the main reason for the high attention. Still, Skyscanner is paying so much money on renting its offices, this doesn't make sense, why would a tech/travel company rent in best locations with very high bills when it cannot afford to raise salaries to keep up with inflation? 
3) Promotion process is chaotic, to say the least.
4) Forcing people back to office, when they know for a fact that the work can be done remotely (looks like senior management use pre-covid mindset)."
Skyscanner,3.0,"Mar 30, 2023",Salary,Data Engineer,Former Employee,"London, England",Good company to work for,Old school hierarchy that needs development
Skyscanner,5.0,"Dec 9, 2022",Great Culture,Anonymous Employee,Former Employee,"London, England",great company with a strong culture,struggled to settle through pandemic changes
Skyscanner,4.0,"Jul 20, 2022","Good place to work, but in danger of falling into mediocrity without changes",Senior Software Engineer,Former Employee,,"- The people
- Pay is ok for office-based, location dependent 
- Junior employees encouraged to grow rapidly","- Many engineering functions underfunded 
- Plenty of bureaucracy 
- Plenty of talk, not enough walk"
Skyscanner,5.0,"Jan 25, 2022",Best place I ever worked,Chief Product Officer (CPO),"Current Employee, more than 5 years","London, England","As an exec my vote should count less than others / take with enormous grain of salt! But six years in, I still love this place and I am reminded every day how lucky I am to have found it. 

Pros:
* Small team with massive WW impact - feels like a family, but gorilla-sized impact
* Great brand, loved and used by literally hundreds of millions 
* Great people - world class talent, and ""no a-holes"" policy
* Great tech - huge scale engineering solutions among the best in the industry 
* Great values, especially ""Traveller first, Partners second, Skyscanner third"" -which is used every day to make the right decisions","* Sometimes we choose ""nice"" over ""direct"", and avoid conflict
* COVID gutted international travel, causing much stress. Coming back strong but not out of it yet."
Skyscanner,4.0,"Oct 10, 2022",Great place to work that lives its values,Engineering Manager,"Former Employee, more than 5 years","Edinburgh, Scotland","Great product, really mature tech and engineering culture, the company lives its values",Progression and career growth difficult depending on team
Skyscanner,4.0,"Sep 28, 2022",A lot of work but fun and great culture,Software Engineer,"Current Employee, less than 1 year","London, England","Great culture and easy to switch teams 
Open and Transparent environment
Loads of learning opportunities for young engineers","A lot of work for little outcome
Hard to progress up the career ladder fast"
