Company Name,Overall Rating,Review Date,Review Title,Job Title,Job Details,Location,Pros,Cons
NCR,3.0,"Jan 17, 2024",Great Learning Experience,Product Analyst,"Former Employee, less than 1 year","Atlanta, GA","Made great connections
Great company for growth
My manager was fantastic","Lack of documentation across the company
Was laid off after the split with no warning"
NCR,3.0,"Jan 18, 2024",To low pay ,Customer Service Representative,"Former Employee, more than 1 year","Philadelphia, PA",Manager is not on your back,Working on. ATM alone in not so nice areas
NCR,2.0,"Jan 23, 2024",Sucks,Customer Engineer II,"Former Employee, more than 5 years","Hampton, VA",Tech knowledge you gain. Learning,MAnagement turnover. Pay is weak. Always asked to do more
NCR,4.0,"Dec 7, 2023","Good work-life balance, come later in your career",Software Engineer II,"Current Employee, more than 5 years","Atlanta, GA","Good work-life balance
Not a lot of micro-managing",Company does not invest heavily into its employees
NCR,3.0,"Jan 19, 2024",NCR,Customer Engineer 2,Former Employee,"Hickory, NC",Quite a bit of freedom,Extremely demanding and you are a number
NCR,1.0,"Feb 4, 2024",Liars,CCC Supervisor,"Current Employee, more than 8 years","Houston, TX",Working remote is a nice perk,They are a liars for sure
NCR,3.0,"Jan 20, 2024",TM at NCR,Territory Manager III,Former Employee,"Philadelphia, PA",Competitive pay. Travel reimbursement. Work from Home.,Work / life balance is non-existent
NCR,2.0,"Jan 22, 2024",A MESS,Sales Associate,"Current Employee, more than 5 years","Frisco, TX",My Coworker were very nice.,"Disorganized 
Untrained leaders
No process standards
Low pay"
NCR,5.0,"Dec 1, 2023",NCR Review,Anonymous Employee,Current Employee,,"- Good work-life balance
- Many opportunities to learn and grow","- Large corporate structure
- Better if you join the right team"
NCR,4.0,"Dec 1, 2023",Overall great company,Field Service Team Lead,"Current Employee, more than 10 years","Kansas City, MO","Lots of advancement opportunities, job security",A Constantly changing work environment
NCR,3.0,"Nov 23, 2023",Great place not so great people,Manager Finance,Current Employee,"Atlanta, GA","Cool office with gym
Most people are easy to work with
Good benefits
Fun environment","-Not enough action with discrimination/harassment scenarios, which is mind boggling because they could get sued for not taking proper action
-Has some old school wall st vibes where men can get away with anything - including severe harassment and most people just let it happen"
NCR,2.0,"Jan 4, 2024",No stability,Software Support Engineer,"Current Employee, more than 10 years","College Station, TX","Work from home.
Decent benefits.","They are outsourcing all of their support work to Bosnia due to low wages there, so there is no job security at all."
NCR,3.0,"Jan 3, 2024",Good place to get your foot in the door,Software Engineer,"Current Employee, more than 1 year","Atlanta, GA",Working remotely 2/5 days a week,"On-call shifts can be demanding, don't get paid for overtime, management is all over the place, layoffs every year"
NCR,3.0,"Jan 9, 2024",Pay should be better ,Business Operations Analyst,"Former Employee, more than 1 year","Frisco, TX",Flexible at times and office is nice,under paid and the CEO flaunts wealth
NCR,2.0,"Jan 10, 2024",No growth opportunity ,Software Support Engineer II,Former Employee,,Job security is the only pros i see. ,"No growth opportunity.
No bonus for grade 10 and below.
No visible increment. "
NCR,3.0,"Jan 9, 2024",Long Hours,Customer Service Engineer,"Former Employee, more than 3 years","Washington, DC",Company vehicle and company card was included.,"Long hours, no dedication to its employees, At the time pay was low"
NCR,3.0,"Jan 12, 2024",good company ,Database Engineer,"Former Employee, more than 1 year","Fort Worth, TX",NCR seems to really support their employees,My team had some dysfunctional elements
NCR,4.0,"Nov 28, 2023",Good place,UX Designer,Current Employee,"Atlanta, GA","Good work life balance, i like it here","We just split, very chaotic rn"
NCR,4.0,"Nov 30, 2023",Good,Marketer,Former Employee,"Atlanta, GA",Flexible in working from home,company is segmented and hard to communicate
NCR,4.0,"Nov 19, 2023",Good Company with Challenging Clients,Professional Services Consultant,"Former Employee, more than 1 year","Atlanta, GA","Flexible work schedule, nice people, cool office building",Working with banks usually mean that you are dealing with demanding clients
NCR,4.0,"Oct 7, 2023",Great people at the satellite office,Project Manager,"Former Employee, more than 1 year","Athens, GA","The people at the Athens, Ga office are good people overall. The environment is fairly laidback and the benefits are pretty good.","The salary average is fairly low for the level of complexity some of the projects require. NCR also lacks processes in much of its project management, so it feels like you are always trying to figure out what the next step is."
NCR,4.0,"Nov 27, 2023",Good work life balance,Software Engineer,Current Employee,,work life balance is great,employee benifits are comparatively less
NCR,5.0,"Jul 3, 2023",Great place to head start your career,Business Operations Analyst,Current Employee,,Great place and work environment for the people that enter the IT industry and corporate culture itself. There is a lot of opportunity for growth and forming yourself in business world. People are great and everyone are helpful.,"Salaries are below range and aren't competitive (I do hope that changes in the future) for the benefit of the company. Many people are leaving for better opportunities and that leaves less people to train the new members, therefore making onboarding difficult."
NCR,3.0,"Jan 8, 2024",Decent ,Customer Engineer II,"Former Employee, more than 5 years","Newark, NJ","Independent work, flexible, company vehicle",Raises are almost non existent.
NCR,5.0,"Nov 19, 2023",Great experience,Customer Engineer II,"Former Employee, more than 3 years","Washington, DC","Great experience, work on so many equipment and devices.","Long hours, lots of overtime"
NCR,4.0,"Nov 20, 2023",Great job ,ATM Technician,"Former Employee, more than 1 year","Conway, AR",Good pay and great team work.,I didn’t have any cons.
NCR,5.0,"Oct 14, 2023",Great place to work,Senior Recruiter,"Current Employee, more than 3 years","Atlanta, GA","Great management, lots of room for promotions, lots of exposure to senior leaders. Also the building is great with lots of amenities.",Sometimes the req loads can be pretty high but not all the time. It ebbs and flows but the job security seems to be pretty good.
NCR,5.0,"Nov 2, 2023",Great Company,Quality Engineer,Current Employee,"Germantown, MD","Great colleagues to work with, family like work environment","Bad leadership, bad managers, upper management does not listen to employees when managers fail to perform good leadership."
NCR,4.0,"Jun 5, 2023","Amazing Company, Employees, & Management...just one big flaw.",Business Development Representative (BDR),"Current Employee, more than 1 year","Saint Petersburg, FL",Work-life balance is great! Everyone you meet within the company is always willing to help you. CEO & CFO are phenomenal people. They truly care about their employees.,"Very little training and unrealistic quotas. Especially when the entire company isn't hitting their quota for the year. Will put employees into positions they don't want to be moved to, but have no choice if they want to keep their jobs with NO training at all and then will lay them off if they aren't performing the way they want within the first 4 months of being in that position. Even though, people in that same position for almost 1 year are getting by with no sales, either. Interesting."
NCR,3.0,"Sep 18, 2023",Overall Stable Work Environment with Difficult Path to Growth,Consultant,"Current Employee, more than 3 years","Atlanta, GA","I have always been able to find new opportunities at NCR. Where I demonstrate initiative and interest, I have had success and plenty of managers and leaders willing to offer up a project. Despite a large, corporate, ""gossip"" environment, overall my work is quite drama free and focused on delivering results.","The process to raises, promotions, etc. has been a pretty nebulous one. Despite managers having a pretty clear framework to work off of, the company as a whole is discombobulated in its incentive structure. Hard work oftentimes does not get recognized and even more seldom is it truly rewarded."
NCR,2.0,"Dec 7, 2023","Bad leaders, low resources to get anything done",Product Manager,"Current Employee, more than 5 years","Atlanta, GA","Good work life balance, decent people in pockets.",Trying to transition from hardware company to services company but does not invest in effort.
NCR,3.0,"Jun 7, 2023",Okay place to start your career,Software Engineer II,"Current Employee, more than 5 years",Dallas-Fort Worth,"Has a mix of both newer and older tech, and is moving toward cloud technology. There is decent amount of opportunity for someone who is driven to excel. Work-life balance is basically what you make it. Laid back culture and some pretty good, dedicated people to work with. Solid engineering management who understand technology. Good place to start a career, but be careful not to get placed on dated technology for too long.","Bad at making sure their lower level engineers get promoted beyond L2 to more senior positions. Really have to make yourself known and keep yourself relevant in order for decent raises and promotions to even be likely. Bad corporate culture when higher ups are trying to justify layoffs. Hybrid work, on which the policy has shifted from 2 to 3 days per week in office for everyone, regardless of role. Company is dead-set on RTO even when it doesn't make sense. Pay is pretty sub-par for industry standard. They will tend to make you work beyond your station for years before a promotion, if it ever even comes. Dedicated QA has been virtually wiped out in favor of automated testing, and before automated testing was able to be properly implemented."
NCR,4.0,"Nov 14, 2023",Nice,Business Consultant,"Current Employee, less than 1 year","Atlanta, GA",Hybrid work schedule and PTO,None that I can think of
NCR,4.0,"Nov 9, 2023",Great place to start,Account Executive,"Former Employee, more than 5 years","Fort Washington, PA",Great training program for new hires,Their technology and products are not cutting-edge
NCR,3.0,"Dec 25, 2023",Ok work,Firld Technician,"Former Employee, more than 1 year","Lexington-Fayette, KY",Experience and good work to get started in electromechanical field,"Culture. Pay, work life balance"
NCR,4.0,"Nov 6, 2023",Former Employee,Software Support Engineer,Former Employee,,"Good Benefits, ability for my team to work remote full-time.","Long Hours, Upper Management changed frequently."
NCR,3.0,"Dec 27, 2023",Review,Product Owner (PO),"Current Employee, more than 1 year","Israel, TX",Moving to a new building,Minimal or no yearly salary upgrades
