Company Name,Overall Rating,Review Date,Review Title,Job Title,Job Details,Location,Pros,Cons
BMC Software,5.0,"Mar 5, 2024",Good company,Scrum Master,"Current Employee, more than 3 years",Pune,BMC IS go to company for work life balance,Growth is slow as per career
BMC Software,5.0,"Feb 21, 2024",Great Company,Business Development Representative (BDR),"Former Employee, more than 1 year","Houston, TX","Great Training
Upward mobility
Fantastic culture","Low pay
Product can be a tricky sell"
BMC Software,5.0,"Feb 20, 2024",Good company,Technical Support Engineer,"Current Employee, more than 5 years",Pune,Good company for experienced people,Not that I am aware of
BMC Software,3.0,"Mar 7, 2024",Never short of something to learn,Technical Support Analyst,"Current Employee, more than 3 years","Reading, England","Great colleagues
Great support structure","Very busy
Steep learning curve, but training is provided"
BMC Software,3.0,"Feb 6, 2024",It Depends,Anonymous Employee,"Former Employee, more than 10 years",,"Company is doing well financially. This is reflected in paying out good bonuses recently. Overall, it's still a decent place to work.","There is no over-arching culture. Your experience is almost solely dictated by your department/manager. If you happen to work in a good department with a good manager, you'll probably enjoy working at BMC very much. If you're unfortunate and work in a department with a not-so-good leader, you're going to have a pretty miserable experience!"
BMC Software,5.0,"Feb 16, 2024",Good,Software Engineer,Current Employee,Bengaluru,YEs is is good company to work,No all the environment are good
BMC Software,4.0,"Feb 25, 2024",good company to be retierded ,Software Developer,"Former Employee, more than 1 year",Tel Aviv-Yafo,easy slow improvement easy if you want to work in another line of work,get lost in time and every thing around you go faster then you are stuck in this
BMC Software,4.0,"Feb 27, 2024",Good company,Devops Engineer,Current Employee,Tel Aviv-Yafo,"Good company, good people, good vibes",They pay below average than others
BMC Software,5.0,"Jan 23, 2024",I'm happy to work at BMC,Data Engineer,"Current Employee, more than 5 years","Austin, TX",I get to work on projects I enjoy and that will hopefully advance my career.,Promotion might be a challenge in my current position.
BMC Software,5.0,"Jan 17, 2024",Best company I have ever worked for!,Value Engineer,"Current Employee, more than 3 years",,"- Genuinely care about employees as individuals 
- Strong Solutions in the marketplace
- Competitive Salary","Can sometimes be difficult to break past the entry level roles, well worth it once you do."
BMC Software,5.0,"Jan 29, 2024",Good,Senior Platform Systems Administrator,Current Employee,Bengaluru,"Great Company and Culture , Employee friendly and Product based",None as of now .
BMC Software,4.0,"Feb 26, 2024",Good,Anonymous Employee,Current Employee,Chengalpattu,Working then what is the therium,Working life balanced diet for Indian
BMC Software,3.0,"Feb 25, 2024",Good Pay,Technical Support Engineer,"Current Employee, more than 3 years",Pune,Provide all types of facility great place to work,Issue with work life balance
BMC Software,5.0,"Jan 16, 2024",Wonderful working place,Business Development Representative (BDR),"Former Employee, more than 1 year",Singapore,"Clear career path for you to develop yourself.
Buddy system ensure your smooth onboarding.
You can always find helps whenever you need it.",Regional culture might differ from what you are accustomed to. You need time to adapt.
BMC Software,5.0,"Jan 24, 2024",Great company,Senior Director,"Current Employee, more than 3 years","Houston, TX","- Excellent culture of collaboration
- Great talent and excellent opportunity for growth",Would like to see more innovation
BMC Software,2.0,"Feb 22, 2024",Not great,Business Development Representative (BDR),Current Employee,"Boston, MA","Flexibility, coworkers, benefits, PTO, path to success","Salary, leadership, expectations, culture, false promises"
BMC Software,4.0,"Feb 21, 2024",good,Software Engineer,"Current Employee, less than 1 year",Bangalore Rural,good environment for starting job,real job growth is a bit lacking
BMC Software,5.0,"Jan 19, 2024",Amazing company to work at,Assoc Product Developer,"Former Employee, more than 1 year",Bengaluru,Best team. Best services and domain knowledge. Always upgrading.,None as such. Its a good company
BMC Software,2.0,"Jan 16, 2024",Laid Off to Save the Bottom Line,Project Manager,"Former Employee, more than 1 year",,"Work life balance
Great bonuses",My position was eliminated after 16 months. It was a brand new role. I am surprised they didn't try to find another place for me. I heard that the company is turning public and they were trying to make the numbers look as good as possible.
BMC Software,4.0,"Feb 18, 2024",Good company,Sr. Automation Engineer,"Current Employee, more than 5 years",Pune,Best perks and benefits with work-life balance,hybrid model with 3 days from the office
BMC Software,4.0,"Feb 12, 2024",Overall a good Company,Automation Engineer,"Former Employee, more than 3 years",Pune,All good benefits and cab facility,Some Managers are worst in behavior. Very Biased
BMC Software,5.0,"Jan 15, 2024",Great company to work for,Lead Financial Analyst,"Current Employee, more than 8 years","Houston, TX","Great pay, great management & work that continually challenges & grows you.",Advancement is a very slow process.
BMC Software,5.0,"Jan 17, 2024",Associate,Software Engineer,"Current Employee, less than 1 year","Colombo, Western",Good working environment and sallary,Bad communication and stressfull work
BMC Software,5.0,"Jan 18, 2024",Great place to work for innovators,Product Developer,"Current Employee, more than 1 year",Bengaluru,"Great management
Good work environment",I do not see any cons
BMC Software,4.0,"Feb 16, 2024",lkjljdlskf,Software Engineer,Current Employee,"Egypt, Shelby, TN","a good culture
great people 
very good","a lot of tasks 
women f
people"
BMC Software,4.0,"Feb 14, 2024",review of job position,Systems Administrator,Current Employee,"Guadalajara, Jalisco",the interview level was very systematic,the interview result took time
BMC Software,5.0,"Jan 11, 2024",Nice,Software Engineer,Former Employee,"Detroit, MI","Good people, and interesting projects",Nothing specific comes to mind
BMC Software,5.0,"May 12, 2023",Employee Empowerment and Care,SOS Specialist,"Current Employee, more than 1 year","Houston, TX","One of the reasons I love working at BMC is because they truly care about their employees. There are hundreds of programs to fit the needs of every individual and we are always encouraged to reach out when it's warranted. BMC has some of the best healthcare options I have experienced in my occupational career, and they are always willing to listen and determine the best course of action to make sure their employees have everything they need. There are also a ton of opportunities to move around the company if you wish and I have found my management to be incredibly supportive of growth in any form, so there is no backlash to ambition.","I don't have any true downsides to working with BMC, I guess I would say that the experience you have is what you make of it. The energy you put in to working at BMC is what you are going to get out of it. BMC has a net positive/neutral environment to work with, so if you give it your best to communicate and work towards your ambitions, you won't have any problems."
BMC Software,5.0,"Jan 4, 2024",Stable Company,Manager,"Current Employee, more than 1 year",Singapore,Good Culture with strong leadership.,Nothing too much to mention at the moment.
BMC Software,5.0,"Jan 5, 2024",Workplace,AVP-Sales,"Current Employee, more than 10 years","New York, NY",Amazing company to work for.,"As of today, not a single one"
BMC Software,5.0,"Jan 5, 2024",.,Senior Product Developer,Former Employee,Chennai,"Good package, flexible work timings. Technical Knowledge learning",None as of I know
BMC Software,4.0,"Feb 4, 2024",Work like balance in BMC,Application Developer,Current Employee,Pune,Good team management and good experience,Project timelines are short due to which work pressure is more
BMC Software,3.0,"Jan 9, 2024",Work Commute,Sales Order Specialist II,"Current Employee, more than 3 years","Houston, TX",Very flexible with time off,many people live close to an hour away and they still make me come in to the office. literally everything i do in the office i can do at home. is point less to come in. is costing me more money to come in that what i am making.
BMC Software,5.0,"Dec 14, 2023",Great place for long term employment,Lead Engineer,Current Employee,"Houston, TX","Unlike many tech companies, it's possible to have a 20+ year career here if you want that sort of thing.",Doesn't pay like a startup or have stock right now.
BMC Software,4.0,"Jan 25, 2024",Loved working there,Software Engineer,Former Employee,"Virginia Beach, VA",Great people. Fun office and work environment!,Hours can get a bit weird if working with people from other countries.
BMC Software,3.0,"Jan 31, 2024",Review ,Project Manager,Former Employee,"Houston, TX",Good experience opportunity for novices,Tendency to have large layoffs
BMC Software,5.0,"Dec 13, 2023",Great experience,Principal Support Account Manager,"Current Employee, more than 1 year","Guadalajara, Jalisco",Great company with great people. There is always someone willing to help.,"None so far, I am very happy working at BMC."
BMC Software,4.0,"Jan 27, 2024",Good Company culture,Staff DevOps Engineer,"Current Employee, more than 5 years",Pune,"1. Good Culture
2. Good Salary
3. Challenging work environment",1. More power in manager's hand.
BMC Software,4.0,"Jan 16, 2024",Good starting job,Software Engineer,"Former Employee, more than 3 years","Detroit, MI","Patient, good work environment, friendly teammates, a lot of opportunity to change teams and gain experience.",Work flow can be a little slow. Compensation a bit lower then other development jobs.
BMC Software,5.0,"Nov 14, 2023",Great support,SRE Engineer,"Current Employee, less than 1 year",Tel Aviv-Yafo,"As a new employee i can say that BMC is very supportive of the onboarding process. Everybody is easygoing, helpfull, and ready to contribute to my development as much as i am. Feels like a great place to work.","So far, none that i can see."
BMC Software,5.0,"Dec 12, 2023",Great company to work for,Solutions Architect,"Current Employee, more than 10 years","Laurel, MD","no micromanagement, caring manager, good benefits",Career growth in some departments is slow.
BMC Software,5.0,"Dec 15, 2023",review,Senior Software Engineer,"Current Employee, less than 1 year",Chennai,earn more in less time,time consuming and hectic for all
BMC Software,5.0,"Dec 7, 2023",Great company with the best and competitive compensation and benefits,Technical Support Analyst,"Current Employee, more than 5 years",Pune,"- Great compensation
- Bonus
- Work life balance",Not that I find any
BMC Software,1.0,"Sep 6, 2023",Very toxic place to be at,Service Desk Analyst,"Former Employee, more than 1 year",Pune,Pros are the history that this environment carries. I did not see any other pros.,No work life balance. Dirty office politics. They will pay employees high money because they don't trust their employees. Poor management threatens employees in the name of cost cutting so that they will not ask for anything else. A sense of status quo even when the market share is being lost. People are highly stressed out in their job which means the company culture is not good. They have people working in there for 10 -15 years and hence they lack the outlook of outside world. They don't hire inexperienced people and ask existing employees to check with family members and friends about what other organisations are doing. They hire contractors and treat them like second class citizens. Appraisals are sole discretion of Managers so they will raise pay for whomever they like. Management is very arrogant and won't listen to their shortcomings. And the list will go on.
BMC Software,5.0,"Dec 12, 2023",BMC SOFTWARE,Technical Support Analyst,Current Employee,,"1. Eco Friendly
2.Good workspace
3. Very good environment",Promotions are not that good
BMC Software,5.0,"Dec 7, 2023",Good company ,IT Senior Director,"Former Employee, more than 8 years","Houston, TX",Great work culture and work life balance. Lots of smart people.,Difficult to find advancement or promotion
BMC Software,4.0,"Jan 5, 2024",Good company to work,Human Resources,"Current Employee, more than 1 year",Pune,"Good work-life balance.
People around are good to work with. The manager is good to work with as well",Yearly appraisals are not great. You may or may not get it every year.
BMC Software,5.0,"Dec 7, 2023",Good company,Payroll,"Current Employee, more than 3 years",Singapore,"friendly environment and colleagues, WLB",no cons i could think about.
BMC Software,4.0,"Jan 18, 2024",Great company,Technical Support Engineer,"Former Employee, more than 3 years",Tel Aviv-Yafo,Great people and work environment,Night shifts are required in support group
BMC Software,3.0,"Jan 11, 2024",Ambivalent place to work,Sr. Manager IT,"Current Employee, more than 8 years",Bengaluru,"Great Benefits, Quality of work is good","Not many growth opportunities, workload is too much"
BMC Software,5.0,"Nov 16, 2023",Excellent Company to work with,Sr. Product Manager,"Current Employee, more than 3 years",Pune,"Very organized, well structured, supportive manager and colleague, very skilled professional work culture",Not sure about others. I didn't receive good increments year after year
BMC Software,5.0,"Nov 21, 2023",Working during war,Senior Software Engineer,"Current Employee, more than 1 year",Tel Aviv-Yafo,"We are working from home all the time, no one is required to get to the office.",WLB is affected negatively for so long working from home
BMC Software,4.0,"Jan 15, 2024",Good,Software Engineer,Current Employee,"Egypt Lake-Leto, FL",Good teams and good experience,Best qualifying and good company
BMC Software,3.0,"Jan 6, 2024",OK Place to Work,Sr SW Architect,"Current Employee, more than 5 years","Clearwater, FL",Interesting work. Plenty of opportunities for advancement.,Management is short sighted. Makes decisions based on quarterly results rather than long term strategy.
BMC Software,5.0,"Nov 29, 2023",Best place to work,Product Developer,Current Employee,,BMC work culture is good,Nothing. Everything looks like good
BMC Software,3.0,"Jan 11, 2024",Software engineer,Software Engineer,Current Employee,,Good company  I heard since years,No cons for the company
BMC Software,4.0,"Jan 9, 2024",Good to work,Staff Specialist Product Developer,Current Employee,Pune,"Work life balance
Good team members","Average appraisals
very less onsite opportunities"
BMC Software,4.0,"Dec 21, 2023",BMC have great policies for employees when compared to service based companies.,Staff Technical Support Engineer,"Current Employee, more than 5 years",Pune,BMC have great policies for employees when compared to service based companies.,We should try to maintain work life balance.
BMC Software,5.0,"Nov 19, 2023",FP&A Analyst,Staff Financial Analyst,"Current Employee, more than 8 years",Pune,"work culture, work life balance, employee perks","none, process stigmatism, mid startup expertise"
BMC Software,5.0,"Nov 2, 2023",BMC Software,Senior Analyst,"Current Employee, more than 1 year","Houston, TX",Fun place to work. The day-to-day is enjoyable because the nature of the work can be complex.,Some out dated process may hold BMC back from competing with other companies.
BMC Software,2.0,"Dec 22, 2023",Yearly layoffs,Sr System Analyst,"Current Employee, more than 3 years",,"competitive package, good office at Pune.",Don't know why a company has to layoff every year. And they do it silently that on one knows in other BU layoff is happening.
BMC Software,4.0,"Dec 31, 2023",nice place,QA Automation Engineer,"Current Employee, more than 1 year","Israel, TX","nice vibes, American company in Israel vibes.",less money in the north site
BMC Software,5.0,"Sep 18, 2023","Great please to earn, learn and have fun",Product Account Manager,"Current Employee, more than 1 year",Frankfurt am Main,"Good products and outstanding clients. Well known company and products, management is fair in his expectations. You are free to make your own decisions. If you ask for help, everybody supports you more than you will expect.","Lots of internal processes are sometimes hindering. Freedom = self discipline is needed, if that’s not how you want to work, you will face challenges."
BMC Software,5.0,"Nov 1, 2023",Awesome,Full Stack Web Developer,"Former Employee, more than 1 year",Chennai,Great place to explore your vision,More work pressure and stress
BMC Software,4.0,"Dec 19, 2023",Excellent,Information Developer,Former Employee,Pune,Employee friendly. Excellent work-life balance. Top-class people to work with.,None actually. Work dynamics can be perceived on a person-person basis.
BMC Software,4.0,"Nov 27, 2023",Good place to Work,Staff Automation Engineer,"Current Employee, more than 5 years",Pune,"Awesome work culture and environment. Many facilities like Medical plans for family, transportation, pantry",Some managers are the worst. They just want to put forward only their favourite one's
BMC Software,5.0,"Oct 24, 2023",Technical Lead,Technical Lead,"Former Employee, more than 8 years",Pune,Good company to learn and grow!,"As of now, I don't think there are any cons"
BMC Software,5.0,"Oct 15, 2023",Great workplace atmosphere,Test Manager,Current Employee,,The company really cares about the employees and all are treated equally regardless gender or ethnicity. Great opportunity for professional growth.,Not the highest salaries in the business.
BMC Software,2.0,"Oct 23, 2023",Not what you think,Product Manager,"Current Employee, more than 1 year","Houston, TX","Talks about all modern capabilities including AI, cloud etc. its purely Marketing, but nothing is eye catchy or worth even to sway competition. They are losing market share to Service Now and others.",The company is a toxic workplace. They make you work like a donkey. Be very cautious before signing on.
BMC Software,2.0,"Dec 20, 2023",Mediocre ,QA Engineer,Former Employee,,Work home balance. Mostly friendly environment,"Ad hoc decisions, lacking technical enovation."
BMC Software,4.0,"Sep 23, 2023",Great place to work!,Senior Solutions Engineer,"Current Employee, more than 1 year",,"1- Inspiring company culture and values, 2- Active and inspiring leadership, approachable management 3- Extremely helpful and warm colleagues (AMAZING!) 4- Autonomy in your work, 5- Some great mentors and genuine people 6- Ethical way of working (my personal best) You might foster relationships which will hopefully last lifetime!","1- Irregular performance review and compensation is dependent on the management. 2- Might have a significant pay gap compared to the market. 3- Depending upon location, the team size, people and culture might seem a bit disconnected from company values and culture in other regions 4- Less efforts and investment in team building and culture building activities"
BMC Software,5.0,"Oct 27, 2023",Good Company,Product Developer,Current Employee,,A good work environment with good benefits.,None as of now .
BMC Software,3.0,"Dec 12, 2023","Decent pay, overly tenured people",IT Assurance Staff,"Former Employee, more than 1 year","Houston, TX",The pay is quite decent.,i havent had the best experience with management
BMC Software,3.0,"Dec 11, 2023",Sales Driven,Consultant,"Current Employee, more than 3 years","Winnersh, England",Good Benefits and bonuses on a quarterly basis,sales driven so you cannot influence your own bonus
BMC Software,3.0,"Oct 27, 2023",BMC,Product Account Manager,"Current Employee, more than 3 years","Texas City, TX",Great people overall that are willing to help,Internal systems are very outdated and there are no processes in place. This leads to your time being spent on figuring out how to get a quote out the door that you have no idea If the pricing is competitive at all.
BMC Software,5.0,"Oct 18, 2023",Recommended !,Data Scientist,"Former Employee, more than 3 years",Tel Aviv-Yafo,"help people with their career, using the latest technology",i think that it's not fully hybrid
BMC Software,4.0,"Dec 4, 2023",Good company to work with,Staff Specialist Product Developer,"Current Employee, more than 1 year",Pune,Everything here are pros.. like management salary work culture and most games,Nothing as such as a cons
BMC Software,3.0,"Dec 11, 2023",comfortable envireonment,Software Engineer,"Current Employee, less than 1 year","Cairo, Cairo Governorate",it is a flexible and comfortable,salaries are less than average
BMC Software,5.0,"Oct 12, 2023",Best place to work with,Platform Systems Administrator,"Former Employee, more than 1 year",Pune,Work environment is healthy. Very good work culture,I dont think of any.
BMC Software,3.0,"Nov 28, 2023",unhappy with mgmt while there 2011,Pre-Sales Consultant,"Former Employee, more than 8 years","Houston, TX",nice atmosphere in early years,mgmt style changed later while there
BMC Software,5.0,"Oct 15, 2023",T,Consultant,Current Employee,,Good company to work for.,No cons to tell. All good.
BMC Software,5.0,"Sep 14, 2023",Good Place to Be,Senior Finance Analyst,"Current Employee, more than 8 years","Houston, TX","Great place, a great culture!! It is an employee-friendly company. Lot of opportunities to grow. Allow inter-department job rotations.",They recently made shift to Hybrid. Some employees are not happy about it.
BMC Software,4.0,"Dec 1, 2023",Good place to work,Marketing Manager,"Current Employee, more than 5 years",,"Good management, workplace and alot of opportunities of growth",Vision change every year .
BMC Software,4.0,"Nov 28, 2023",Working at BMC,Staff Financial Analyst,"Current Employee, more than 1 year","Austin, TX",Company is great to network within,"There is no written way. All is created or word of mouth,"
BMC Software,5.0,"Aug 31, 2023",An excellent company to work for,Consultant,"Former Employee, more than 3 years",Bengaluru,Work-life balance High pay Good management Friendly environment,"BMC should market itself more aggressively. They have an excellent product rang, but I feel the where they are lacking is marketing and placing them correctly not just as an ITSM vendor but as a Software Development platform"
BMC Software,5.0,"May 4, 2023",Wonderful Company to Work For,Marketing Program Specialist,"Former Employee, more than 3 years","Santa Clara, CA","Company has been around for 40+ years and continues to release excellent IT products for the enterprise space The company seems to really care for their employees (as much as a corporation can), treats their people well Room for career growth and movement within the company Great people to work with, constantly surrounded by intelligent and kind people Excellent work/life balance","Reputation as a legacy company, although they are working hard to move past that. Some of the service management products need improvement Some of the executive/senior management does not understand or believe in the influence of marketing"
BMC Software,4.0,"Nov 7, 2023",Employee frendly organization,Senior Consultant,"Current Employee, more than 5 years",Bangalore Rural,You will get all the benifits which make a company perfect for long term relationship with employee,"because of same benefits, it sometime become hard to take decision of moving out"
BMC Software,5.0,"Sep 14, 2023",Best company to work,Sr. Software Engineer,"Former Employee, more than 1 year",Pune,Good salary and work environment,Selection process getting worst as non Assembler developer also got recruited which add load on current developer
BMC Software,4.0,"Nov 20, 2023",Software Developer,Staff Product Engineer,"Former Employee, more than 1 year",Pune,"great work culture, helpful seniors, good bonuses and hikes.",no wfh option even for new moms
BMC Software,5.0,"Aug 1, 2023",Fantastic place to start a career,BDR,"Current Employee, more than 1 year","Dublin, Dublin","Managers very supportive and flexible around work/life balance, opportunity to progress, market leading product makes, great culture in Dublin (and BMC as a whole), you can pick up the phone to any one no matter how senior they are and ask for help. Great earning potential for a starting role",Very process driven can sometimes hamper innovation
BMC Software,4.0,"Nov 21, 2023",Good place to work,Staff Accountant,"Former Employee, more than 1 year",Pune,"Good place to work, can join",Nothing as such to say
BMC Software,5.0,"Aug 8, 2023",Perfect atmosphere and a lot of trust,Machine Learning Engineer,"Current Employee, more than 1 year",Tel Aviv-Yafo,"Great culture and work-life balance. As opposed to other Israeli companies and management, they respect private life and time and allow great flexibility. They put any responsibility you would like, and allow me to work on a feature from research to production which I love.",Can't think of any really.
BMC Software,5.0,"Sep 22, 2023",Best place to work,Team Lead,"Former Employee, more than 3 years",Pune,Amazing place to work. Culture,"No cons to share, allgood"
BMC Software,4.0,"Nov 9, 2023",Good Company,Staff Specialist Product Developer,"Current Employee, more than 3 years",Pune,Good culture Outstanding insurance policies Work life balance,Quality of work can be improved
BMC Software,5.0,"Sep 12, 2023",Overall Good company,Security Engineer,Current Employee,,"Overall good, benefits, culture, learning","Overall good, benefits, salary, work-life balance"
