Company Name,Overall Rating,Review Date,Review Title,Job Title,Job Details,Location,Pros,Cons
Zoom Video Communications,1.0,"Dec 18, 2023","Zoom is lying about layoffs by doing aggressive and false PIPs rather than saying ""layoff""",Senior Account Executive,"Current Employee, more than 3 years",,Zoom used to be the absolute best. Sad...,"Zoom used to be the greatest company to work for. Zoom even won multiple ""Best Places to Work"" and ""Best CEO"" awards in the past. 
Now, Zoom honestly doesn't seem to care about any of its 
employees.

Eric Yuan doesn't even seem happy anymore. His All-Hands meetings seem robotic and required, rather than energetic and emotional. 

Sales is an absolute mess. 
You have new Sales Managers who come in and blatantly lie to their reps, and encourage them to quit whenever they hit at any concerns or voice issues. They are more concerned about loyalties to their managers and careers than caring even slightly about their team or doing the right thing. 

You have Small Business AE's who sell Major's size accounts that are wildly out of segment, and then that rep gets praise and President's Club, while other reps who have had their territories 3 times in a year are told they don't work hard enough. 
When brought up to leadership, they tell you to stop complaining.

They continue to tell us we won't be doing more layoffs, but then secretly, what you hear instead is that many people are being put on incredibly aggressive and unattainable PIPs so that they can justify firing people for ""bad performance"" rather than saying they are doing more layoffs. 
When asked about this during company all-hands or meetings, they brush it off or ignore the question altogether. 

Zoom used to be a rocket ship but leadership (the remaining ones as the good ones seem to all be leaving or have already left) is making this rocket fall not just back to earth, but into the deep ocean."
Zoom Video Communications,4.0,"Dec 13, 2023",Good pay,Revenue Accountant,Former Employee,"San Jose, CA","Young team mostly ex-Big 4, great benefits and allowances, stock options",Business practices contradicts company brand “keep employees happy”
Zoom Video Communications,3.0,"Jan 11, 2024",A little frantic,Senior Product Manager,"Current Employee, more than 1 year","San Francisco, CA","Great product, a lot of autonomy",Lots of pressure to deliver on very tight timelines right now. A little frenetic and stressful.
Zoom Video Communications,5.0,"Dec 12, 2023",Great,Sales Leader,Former Employee,"Iowa City, IA",Good people and the best product on the market. Great leadership.,Getting bigger and with that comes less autonomy
Zoom Video Communications,2.0,"Jan 18, 2024",OK,Account Executive,"Former Employee, more than 3 years","Raleigh, NC","When I was hired, it was a great culture.",2 years into the job and culture and leadership changes weren't positive
Zoom Video Communications,4.0,"Dec 17, 2023",balance,Software Engineer,Former Employee,"Denver, CO",The MTO and pay is great,Not organized. Needs better project management
Zoom Video Communications,2.0,"Nov 9, 2023",Run away!,Human Resources,"Former Employee, more than 3 years",,Your long-suffering co-workers are amazing and are genuinely interested in working for a great company that appreciates them and rewards them for their contributions.,"Sadly, this is not that company. Morale is low due to wage freezes and loss of the #1 benefit. The leadership team is eroding and the decisions coming from the CEO seem increasingly delusional."
Zoom Video Communications,2.0,"Oct 27, 2023","Not great, not flexible enough",Product PR,"Current Employee, less than 1 year","San Jose, CA","The pay is pretty good. Job doesn't require a lot of work, which is also nice.","I started at Zoom just last month and the experience is just okay. I'm already not feeling welcome to take as much PTO as I want. They need to understand that travel is my LIFE! I will be taking multiple international trips this upcoming 6 months and that's just what's going to happen.  The PR team also doesn't show as much respect for my previous career as a news anchor. They should honestly be coming to me asking how to solve problems, not the other way around. I think sometimes they feel threatened by me."
Zoom Video Communications,3.0,"Aug 3, 2023","""Delivering Happiness..."" Only sometimes these days",Senior Product Designer,"Current Employee, more than 1 year","Seattle, WA","Autonomy, lots of opportunities to make an impact, incredibly friendly and helpful coworkers, interesting problems to solve.","Benefits have been slashed. Morale is very low since recent layoffs and executives are not showing any sign of turning things around. In fact, they're doubling down. Zoom frequently prioritizes speed over quality in our products. Process is usually more waterfall. Scope is frequently cut to make unreasonable deadlines, and user research is constantly overlooked. Coordination between US and China teams is difficult. Expect plenty of late meetings."
Zoom Video Communications,4.0,"Dec 2, 2023",was a solid experience,-Senior SWE,"Current Employee, less than 1 year",,ppl were great to work with. I find it to be team specific though.,hours were bad at times depending on necessary team interactions
Zoom Video Communications,4.0,"Dec 8, 2023",Great company,Enterprise Sales Associate,"Current Employee, more than 3 years","Denver, CO","Good culture, smart people and good pay",Leadership makes rash decisions at times and can flip flop fairly frequently.
Zoom Video Communications,4.0,"Sep 13, 2023","To some Chinese employees, pls stop trashtalking your coworders in Chinese",Anonymous Employee,"Current Employee, more than 3 years",,nice and talented coworkers in my department,"i just want to point out that, some employees in San Jose office talk trash about their coworkers in Chinese in public (during lunch time for example), and it really bothers me as i understand the language and suffer from the negativity. It is ok to speak Chinese in the office, though i never heard any Spanish or Hindi, but pls dont trash talk your coworkers. It is just too shady."
Zoom Video Communications,5.0,"Dec 4, 2023",Great,Account Executive,Current Employee,"Denver, CO",Zoom is a great place,No help from the channel team
Zoom Video Communications,4.0,"Dec 3, 2023",Great starting point,Business Development Representative (BDR),"Former Employee, more than 1 year","San Jose, CA",Very nice teammates but aggressive Sales targets,High demands team with very aggressive targets
Zoom Video Communications,5.0,"Oct 26, 2023",Happiness is Working at Zoom!,Anonymous Employee,Current Employee,,"I have been with Zoom for almost 4 years now and it is a great place to work! I love my team, my managers and our CEO. I feel valued and happy everyday!",Zoom is still a growing company so there are still some growing pains but they navigate through the changes well!
Zoom Video Communications,3.0,"Jun 27, 2023","Used to be great, declining fast, hope they right the ship",Anonymous Employee,Current Employee,,Leadership/CEO seems to genuinely care and want to constantly improve. Remote and hybrid work style is wonderful. Great healthcare benefits. Book reimbursement. Compensation is good but stagnant. Some very cool tech to learn and play with. Work/life balance is good.,"Equity issues exacerbated by zero salary transparency, zero pay scale transparency, inaccurate job descriptions, workloads being increased after recent layoffs with no audit and correction of job roles, no paths for promotion, no annual cost of living adjustments, no HR support without going through your manager (so good luck if your manager is what you need HR support about), and no truly anonymous surveys. Leadership is very out of touch right now with what their employees want from a workplace and the internal communication has become tone-deaf. DEI has been drastically cut back the past year."
Zoom Video Communications,3.0,"Jan 3, 2024",it was great until....,Account Executive,"Former Employee, more than 5 years","San Jose, CA","unlimited PTO
catered food
endless swag","rookie managers
morale
career advancements"
Zoom Video Communications,4.0,"Nov 30, 2023",Love the company and direction,Account Executive,"Current Employee, more than 1 year","Houston, TX","Best products, Best people. PERIOD.",Channel community program needs improvement
Zoom Video Communications,5.0,"Nov 13, 2023",Great place to work for someone who is self motivated,Devops Engineer,"Current Employee, more than 3 years",,There is not a lot of micro management,Sometimes goals can change quickly and seem to be lacking long term commitment or vision
Zoom Video Communications,5.0,"Nov 28, 2023",Great!,Assistant Manager,Current Employee,,They are awesome thanks for sharing,None none none none none
Zoom Video Communications,3.0,"Jan 6, 2024",Management,Software Development Engineer,"Current Employee, more than 1 year","San Jose, CA","WLB is good, there's a lot of cross team collaboration",the company is all Chinese
Zoom Video Communications,5.0,"Nov 10, 2023",Great benefits and people,Business Development Representative (BDR),"Current Employee, less than 1 year","Los Angeles, CA",I enjoyed working here. I only don’t now because of layoffs. The culture and people are great,constant changes in the bdr org
Zoom Video Communications,2.0,"Dec 28, 2023",Zoom Video communication salary review,TPM Manager,Current Employee,"San Jose, CA",Fast paced and Good team,Other than developers and product managers not much value to other roles
Zoom Video Communications,4.0,"Nov 15, 2023",Great company!,Account Executive,"Current Employee, more than 1 year","California, MD",Amazing product! Flexible / good work-life balance. Good earning potential,I don't have any at this moment
Zoom Video Communications,2.0,"May 17, 2023",Fearful Work Environment w/Bullying,Product Manager,"Former Employee, more than 1 year","Los Angeles, CA",- Good pay & benefits - Great colleagues - Big name on my resume - Learned how to release features = new skill sets,"- Terrible executive leadership with zero company strategy & treat their employees like crap (Oded & Aparna) - Company ran like a dictatorship meaning there is no collaboration bc of fear to look dumb or get publicly yelled at by leadership - Very siloed work environment makes it a tough place to create good features - Bullies get rewarded for decent work, yet mean behaviors (I spoke to 3 lawyers & unfortunately it’s tough to have a case against workplace bullying unless there is physical violence) - I had a terrible manager who completely ignored me & didn’t engage with me at all. Whenever I’d reach out to ask for work, he’d tell me to chill out, so I’d ask around my team to look for work & eventually I’d find it. - Closed work culture - Overall, bad leadership at all levels, fearful work environment & HR protects the company, not people"
Zoom Video Communications,1.0,"Nov 30, 2023","Utter chaos, disrespectful CEO",Product Marketing Manager,"Current Employee, more than 1 year",,"People that work there are very nice, not always the smartest, but nice.","- The CEO does not like feedback, does his own thing, considers employees replaceable and has said it to their faces during townhalls.
- Zero processes internally, very unorganized
- Obsessed with competitors, and only want to ""beat them"" to the next big product release, whether its properly tested or not."
Zoom Video Communications,1.0,"Dec 22, 2023",Worst place to work at,Software Engineer,"Current Employee, more than 3 years","San Jose, CA",Zoom is a brand for meetings,"management knows nothing about tech, and company is removed from index. The the CTO office are polluted with esp. bad management in the top level, half baked features, and many engineers seem to be busy but on wrong things!"
Zoom Video Communications,2.0,"Apr 7, 2023",Used to be a great place to work,Account Executive,"Former Employee, more than 1 year","Denver, CO",- loved the team we were working with - Eric Yuan was a fun and compassionate leader - Decent benefits,"- New leaders that joined in a year ago really made the place feel toxic - Our segment hadn't hit a single quarter since we had new leadership. This may have something to do with the market or something with the new leadership (maybe just an sad coincidence) - alignment of the books was unfair for most and favorable for few. Several people provided feedback to management, but they always got the cold shoulder. They would always say to control what you can control. Many top performers were selling to out of segment (way out of segment) - right after they did layoffs, they were hiring for the similar positions - the last year was the worst for employee morale - they went from such a great culture to not so great - no transparency in promotions - no specific path to help people get promoted - the new management wanted everyone to go to a 'yes, I will do that' mentality"
Zoom Video Communications,1.0,"Jan 3, 2024",Eric and C-Suite Need to Go,Operations,"Current Employee, more than 3 years",,- Good work life balance,- CEO makes decisions on his own that are not productive for the company
Zoom Video Communications,4.0,"Oct 11, 2023",Good experience overall,Anonymous Employee,Current Employee,,- benefits - fair pay - flexible time off,- turnover at high positions - can be very busy for months at a time - sometimes lack of resources
Zoom Video Communications,5.0,"Oct 27, 2023",Great Company!,Account Executive,"Current Employee, more than 3 years",,Zoom cares for their employees!,Working hybrid for a video conferencing company
Zoom Video Communications,2.0,"Aug 13, 2023",Chaos & hypocrisy,Account Executive,Current Employee,,"Good health & mental health benefits, 401k match, unlimited PTO","RTO mandated at video 1st platform, ruining family time/child care plans & making people miserable de accelerators for commission No raises (except forexecs who got 20% raises) International promos are known for being not worth while. Constant disruptive change /chaos Post riff - not enough resources & a big loss in knowledge Everyone is burnt out & quota’s continue to climb despite the macroeconomic climate and low attainment last half. Culture is toxic from top down leadership Feedback averse managers & leadership. Current approach seems tone deaf & desperate"
Zoom Video Communications,4.0,"Oct 16, 2023",Little Room to grow,Account Executive,"Current Employee, more than 3 years","Miami, FL",somewhat healthy work/life balance and supportive managers,Extremely minimal room to grow. Zoom doesn't hire from within
Zoom Video Communications,4.0,"Aug 8, 2023",Zoom used to be great,Site Reliability Engineer,Former Employee,"Denver, CO","Pays well, and the benefits package I received was good.","Unfortunately they're getting rid of all the things that made Zoom a good place to work, so it's turning into just another corporate job."
Zoom Video Communications,3.0,"Sep 26, 2023",Big but small - multiple meanings for both!,Anonymous Employee,"Current Employee, more than 3 years","San Jose, CA","Great ESPP My experience - caring team,",resources are available but office politics come into play to get them some processes you expect that a 5000+ employee company would have are not there - leading to inefficiency and extra work Week - to - week anxiety of getting laid off regardless of performance/role
Zoom Video Communications,3.0,"Jul 5, 2023","One whole family, until we weren't...",Sales Manager,Former Employee,"San Jose, CA","- Great environment to learn, challenge, and develop your skillsets - Brilliant people within the org, leading the charge on the next solution to further that customer exp & journey - If you do it right, crush your quota consistently, commissions are very lucrative","- We lost that family ""caring"" feel when more external leadership and management came in - Everything became more rigid and focused on hitting x-targets vs. caring about the person"
Zoom Video Communications,4.0,"Jun 8, 2023",Lipstick on a Hustle Culture Pig,Anonymous Employee,"Former Employee, more than 1 year","Denver, CO","- Decent pay and outstanding benefits - Friendly, fun, engaging culture & coworkers - High morale, lots of free Zoom swag, sense of community - Daily morning meetings, always starting your day on a great note! - Supportive, friendly, relatable, and accessible managers - Good structure, orderliness, and clear chain of command and resources for how to continually improve at your job/workflow - Fair vacation time policy - Clear path and encouragement to ascend up the ranks in your career - Great incentives (for commission-earning positions)","- Borderline unrealistically high expectations (for the Sales department) that, while all within legal compliance of ethics (which are methodically taught to new employees through mandatory online courses and quizzes to ensure written record of our understanding of legal boundaries for Sales efforts), are right up on that line of ethics with respect to how we prospect, book meetings, and close deals. There are oftentimes small or department-wide competitions to keep everyone constantly squeezing for more, and the prizes are seductive, incentivizing, and effective at their goal. Nothing inherently wrong with this, just that what gets sacrificed in all the sales reps (from the bottom tier to the top) vying for infinitely increasing accounts being onboarded is the prospects, the taste Zoom leaves in their mouths, and ultimately our brand image (in the eyes of those who've been on the receiving end of a prospecting campaign). - Another ""con"" is that Zoom is taken in with the woke ideology and seems to be vying for that ESG money (if they aren't receiving it already). Diversity hires are abundant, and the bi-weekly company-wide virtual meetings spend a significant portion of the meeting either highlighting the latest woke advocacy group that Zoom donated boatloads of money to, or reading employee-submitted Q&A questions, most of which relates to DEI, be it internal company matters, or sometimes public current events that Zoom had some ancillary role in. (This was especially relevant during the COVID lockdowns and the 2020 election season.) The money pits veneered with chartable optics seems to evade Zoom's upper management / executive board, or they simply don't care what the money is going toward (i.e., BLM) so long as the PR the company receives is good. And don't forget that ESG score. I personally didn't like that I was part of an organization that panders to the superficial games of grievance politics. If they were truly colorblind / genderblind / equal opportunity in their dealings, there would be no mention, let alone promotion, of these various grievance groups."
Zoom Video Communications,3.0,"Mar 21, 2023",It's fine.,Anonymous Employee,"Former Employee, more than 5 years","Denver, CO","The great managers are GREAT. The product has become a ""need to have"" in most industries, so you don't have to explain to people what Zoom does or how they could use it. The product innovation is unlike anywhere else I've worked. New features and products are released at lightening speed and for the most part, they are working well and successful from the get-go. The CEO, Eric Yuan, continues to be a great leader through challenging times.","Like a lot of companies, the managers and department leaders are hit or miss, and your experience can be night and day depending on which leader you have. Leaders don't have a formal evaluation process, so bad ones can sit in their role for a while and it's next to impossible to change teams unless you get a promotion to a new segment. Lay-offs in February 2023 were just the start of a lot of organization and compensation changes and cuts. You have to work a lot harder to make less. Also, Microsoft and Google have put on a lot of pressure and Zoom is fighting to stay competitive."
Zoom Video Communications,2.0,"Jul 24, 2023",Used to be great and now we’re here,Project Manager,"Current Employee, more than 1 year",,"My salary is fair, work from home option, RSU","The benefits that led me to chose Zoom are now gone including raises, bonuses, monthly stipend for things like internet. Upper management has no idea what the are doing and give no directive. Little to no collaboration cross functionally due to internal politics. Fear is used to drive long hours with no reward. Disorganized and poor use of tools. Poor transfer of knowledge internally."
Zoom Video Communications,5.0,"Sep 28, 2023",Great Company,Customer Success Manager,"Current Employee, more than 3 years","New York, NY","Nice people, easy to have work life balance.","You are one of 10k people, so org impact is minimal."
Zoom Video Communications,4.0,"May 9, 2023",Meh,Staff Site Reliability Engineer,Former Employee,"Denver, CO","Benefits used to be pretty good, but they've been slowly moving away from a policy of ""employee caring"" and more into that same corporate mindset. That said: Health Vision Dental 401k RSUs ""Unlimited"" PTO Career Guidance","The technical side is mostly run by a singular demographic that minimizes the opportunity for input if you aren't of said demographic. There's frequent (daily) language barriers due to this that make cooperation and authorization a black hole of uncertainty. I frequently found myself asking someone to translate a request, waiting almost a week, and then getting a flat ""we don't do that"" without explanation or reasoning. Makes doing your job difficult."
Zoom Video Communications,4.0,"Mar 9, 2023",From Rocket Ship to Lost at Sea,Account Executive,"Former Employee, more than 5 years","San Jose, CA","My experience at Zoom was very rewarding. It provided great benefits to my family, my career growth and also a great work/life balance. I was fortunate and lucky to be part of such a great company during its time. For majority of my experience at Zoom, the right leadership team was present to ensure our growth success. The vibe and energy was great and it made getting to work very fun.","As Zoom started to expanded into the cloud PBX and contact center market, it became more convoluted more difficult to navigate as a sales rep. Being accountable for oneself it the sales rep priority, but the team communication started to drop off. New leaders came aboard and shook up the whole vibe, in a negative way."
Zoom Video Communications,1.0,"Dec 19, 2023",cds,Software Engineer,Current Employee,San Jose,Happy while working at zoom,Not good culture at the company very asian
Zoom Video Communications,2.0,"Nov 9, 2023",A shell of its former self,Anonymous Employee,"Current Employee, more than 3 years",,"The people. For the most part, the people here are amazing!","No leadership, direction or strategy. Every week brings more chaos."
Zoom Video Communications,5.0,"Sep 27, 2023",zoom,Customer Service Representative,"Current Employee, less than 1 year","Omaha, NE",good compnay to wrok fro,bad employee relationsjps but good supervisors
