Company Name,Overall Rating,Review Date,Review Title,Job Title,Job Details,Location,Pros,Cons
Akamai,2.0,"Aug 9, 2023",Would not recommend it,Anonymous Employee,"Current Employee, more than 5 years","Cambridge, MA",Many talented employees who really care about the company The compensation and benefits are great,"Management employees can’t get along. In some areas of the company, there is little respect among the management rank."
Akamai,4.0,"Aug 10, 2023",Good - Could be better,Senior Marketing Manager,Current Employee,,"Benefits, flex base approach when it comes to remote work, strong leadership now in place, focus on diversity and inclusion",Decisions made by group so things take forever to get down. Out dated process that halt agility.
Akamai,4.0,"Sep 17, 2023",-,Software Engineer Coop,Current Employee,"Boston, MA",Nice Company to work for.,There's not much negative I found
Akamai,5.0,"Jul 3, 2023",Akamai,Sr. Software Engineer,"Current Employee, more than 5 years","Santa Clara, CA",Great benefits Work life balance,Currently I do not have any
Akamai,5.0,"Jun 11, 2023",Competitive Salary,"Platform Engineer,  Lead","Former Employee, more than 1 year","Reston, VA","A great workplace culture that emphasizes cooperation, people, outcomes.","The culture, operational structure, and great people are not the standard everywhere."
Akamai,5.0,"Jun 12, 2023",Culture,Senior Solutions Engineer,"Current Employee, more than 1 year",,"Flexible work-life balance, great colleague interaction, team environment",No cons at this time
Akamai,2.0,"Aug 30, 2023",ok,Sales,"Former Employee, more than 1 year","Los Angeles, CA",good people and good team culture,problematic products that are hard to sell
Akamai,4.0,"Jul 6, 2023","Good tech, ambitious plans, too much big-company overhead",Senior Principal Software Engineer,"Current Employee, more than 10 years","Cambridge, MA","Lots of interesting projects, moving into cloud is a big plus and a lot of fun. Company has high, world-wide impact.","Too much corporate big-company stuff has moved into everything. ""Developer productivity"" is a pain point for engineering."
Akamai,5.0,"Feb 2, 2023",Great culture but lacks compensation fairness,Anonymous Employee,"Current Employee, more than 8 years",,Culture and values Diversity Technology Work/life balance/PTO Benefits/healthcare/etc,Career opportunities Compensation fairness Constant re-orgs
Akamai,2.0,"Aug 8, 2023",Difficult to deal with middle management,Director,Current Employee,,Great leadership team on top,Difficult to deal with middle management
Akamai,5.0,"May 30, 2023",Good place to work,Solutions Architect II,Current Employee,"Cambridge, MA",No micro management and flexible work environment.,- The culture is not the most exciting - Salary
Akamai,5.0,"May 2, 2023",Never a dull moment!,Sr Site Reliability Engineer,Current Employee,"Cambridge, MA",- PTO is great - Well compensated - Helpful people - Always something cool to work on!,"The bureaucracy gets to me sometimes, and it can take a while to get approvals for things."
Akamai,5.0,"Apr 27, 2023",Great Company all around,Manager,Current Employee,"Austin, TX",Flexible work / life balance Leader in security Leadership tenure speaks to stability Strong financial position Diversity and Inclusion culture,Some groups can feel cliquish
Akamai,4.0,"Jul 11, 2023",Akamai has work life balance except for few days,Senior Software Development Engineer In Test,"Current Employee, more than 1 year","Denver, CO",I really enjoy working at Akamai. Wellness holidays are good for now where we get 5 extra holidays. Akamai provides 500$ for health and wellness every year.,Only 50% of the bonus was given this year.
Akamai,1.0,"May 15, 2023",Rudderless,Director,"Current Employee, more than 5 years","Cambridge, MA",- talented people on the ground - salary and benefits are solid,"- strategy dramatically shifts every 6 months - marketing leadership is inept at best, at worst they’re self aggrandizing, back stabbing, and HR time bombs - the culture in marketing is toxic where independent work is incentivized and employees are encouraged to battle each other - it’s all about the shiny red ball of the moment with no long-term strategy. It makes no sense that this company can’t focus on more than one product at a time. - your capacity and work boundaries don’t matter"
Akamai,4.0,"May 15, 2023",great company and hopefully remaining so,Senior Software Engineer II,"Current Employee, more than 8 years","Cambridge, MA",At the forefront of network and security tech. Multiple organizations and opportunities to grow within one company. Most roles allowed to be fully remote. Excellent benefits. Ask about wellness days.,A lot of technical debt and essential knowledge buried in the heads of the longest serving employees. Newly emerging pattern of annual layoffs even after revenue growth to fine tune each year's business spending.
Akamai,4.0,"Jul 12, 2023",Mostly good things overall,Engineering Manager,"Current Employee, more than 3 years","Chicago, IL",Great work-life balance and perks are not bad,Hard to attract good talent due to the small budgets in the US
Akamai,4.0,"Jul 29, 2023",Decent Place to Work,Senior Software Engineer,"Former Employee, more than 5 years","Cambridge, MA",Good benefits Smart people relaxed work environment,A lot of old code stuck in ways of doing thing
Akamai,5.0,"Apr 10, 2023",Data Driven Engineering Culture,Senior Director Marketing,Current Employee,,"Strong values, smart people, high impact",Better content/yearly planning would produce less churn for the folks on the ground; parts of the culture seem antiquated; user-centered-design principles/practices are not as well integrated as they could be
Akamai,5.0,"Apr 27, 2023",Akamai: Great Company!,Marketing Programs Associate,"Current Employee, more than 3 years","Cambridge, MA",Akamai has a great company Culture,Akamai is a large company and sometimes bureaucratic. Different teams and departments can operate very differently though.
Akamai,5.0,"Apr 25, 2023",Great company with a ton of benefits,Sr. Solutions Engineer,"Current Employee, more than 5 years","Austin, TX","work life balance, wellness days, benefits, company vision","Crowded management, hard to grow into various leadership roles."
Akamai,5.0,"Apr 18, 2023",Great place to work,Sales Manager,"Current Employee, more than 5 years","Atlanta, GA",A lot of great people and ways to contribute,I can’t think of any cons at this point
Akamai,5.0,"Apr 15, 2023",great company with great people,Executive,"Current Employee, more than 10 years",,"great co-workers and culture, strong technology, growth mindset and opportunity to grow",challenging macroeconomic environment but this applies to all companies in the sector
Akamai,5.0,"Apr 6, 2023",best place to work,Senior Product Architect,"Former Employee, more than 3 years","Santa Clara, CA",role and responsibility work env,- discrete controls and unnecessary BUs providing no control or governance to delivery of solution
Akamai,5.0,"Apr 24, 2023",Great Company,Senior Software Development Engineer In Test (SDET),"Current Employee, less than 1 year","Dallas, TX","Good Work Life Balance, Given Updates by Leaders in a timely manner.",Dont have help when needed.
Akamai,2.0,"Jun 9, 2023",Management needs a serious makeover,Anonymous Employee,"Current Employee, more than 8 years",,Remote work is a big plus,"Management policies need a revisit, feel like it's heavily bureaucratic, heavy handed, autocratic, threatening and numb."
Akamai,3.0,"Jun 27, 2023",Good company overall,Software Engineer In Test - II,"Current Employee, more than 5 years","Cambridge, MA","Great people, work culture and benefits",Upper management needs improvement and listen to people not just numbers.
Akamai,5.0,"Apr 10, 2023",Best Work Life Balance,Security Incident Responder,"Current Employee, more than 1 year","Fort Lauderdale, FL",Extremely flexible with time off Fair compensation Internal growth encourage and fostered,Standardized documentation could be improved
