Company Name,Overall Rating,Review Date,Review Title,Job Title,Job Details,Location,Pros,Cons
Optimum Solutions,3.0,"Jun 10, 2023",Normal environment to work but no career growth,Consultant,"Former Employee, more than 1 year",Singapore,Good for fresher or consider newly landing to Singapore. Can have more clients to work with and having decent medical insurance.,Contract No attractive salary No bouns
Optimum Solutions,4.0,"May 24, 2023","Excellent Place to Learn, Supportive Staff and Management, Great Work Culture",QA Lead,"Current Employee, less than 1 year",Hyderābād,1) Supportive Staff & work culture 2) Great Place to learn 3) Good Place to work 4) Its a Nice company to work for 5) very flexible,"No cons seen till now,"
Optimum Solutions,5.0,"Jun 23, 2023",Happy To Be The Part of Organization...,Senior Consultant,"Current Employee, more than 1 year",Bengaluru,"Work Environment, Recognition, Appreciation, Management, Timely Response",Nothing to point out as of now.
Optimum Solutions,5.0,"Jun 18, 2023",Best place to work,HR Business Partner,"Current Employee, more than 1 year",Bengaluru,"Friendly environment, learning, growth opportunities, team building activities.",Need to organize team outing frequently.
Optimum Solutions,2.0,"Jun 27, 2023",Optimum,Talent Acquisition Specialist,"Former Employee, less than 1 year",Pune,Nothing. Good work life balance,No growth. Not opportunity. Not stable management
Optimum Solutions,5.0,"May 29, 2023",Best place to work,Software Developer,"Current Employee, more than 3 years",Chennai,1. Accessibility to leadership team 2. Employee experience at its best 3. Scope for training and development,"With the experience in the organization, nothing so far."
Optimum Solutions,5.0,"May 23, 2023",Good place to work,Senior Consultant,"Current Employee, less than 1 year",Hyderābād,"Friendly environment, supportive management, you can have professional and personal life banalance.","When the company needs you may have to work late,but that is balanced with the ability to work from home."
Optimum Solutions,3.0,"Jun 13, 2023",depends on the customers,Software Developer,"Current Employee, more than 1 year",Singapore,My insurance is well covered.,only 12 days leave a year
Optimum Solutions,5.0,"May 23, 2023",Nice work place,Consultant,"Current Employee, less than 1 year",Hyderābād,Good place to work Supportive management,When company needs you may have to work extended hours but you have work from home opportunity to over come that
Optimum Solutions,5.0,"May 24, 2023",overall best place to work,Anonymous Employee,"Current Employee, more than 10 years",Hyderābād,"very great place to work, organized and supportive environment with friendly atmosphere.",no challenges faced as of now
Optimum Solutions,4.0,"Jun 10, 2023",Good operation team but job insecurity,Recruiter,"Former Employee, less than 1 year",Bengaluru,Good HR Operation Good client,"Job insecurity, easily laid off"
Optimum Solutions,5.0,"May 29, 2023",Good Work Culture,Human Resources Business Partner HRBP,"Current Employee, less than 1 year",Bengaluru,Lot of learning opportunities Professional work environment Supportive team members Amazing logos!!,None so far - it has been positive.
Optimum Solutions,5.0,"May 23, 2023",Good place to work,Consultant,"Current Employee, less than 1 year",Hyderābād,Good Work life balance Supportive management,When the company needs have to work late but that is balanced with the ability to work from home
Optimum Solutions,5.0,"May 23, 2023",Friendly environment,Consultant,"Current Employee, less than 1 year",Hyderābād,"Nice company to work, Supportive management...","When the company needs you may have to work late,but that is balanced with the ability to work from home..."
Optimum Solutions,3.0,"May 25, 2023",Good company,Senior Software Engineer,"Former Employee, more than 8 years",Singapore,good salary good clients good health insurance,Bad management hire and fire policy if client is not assigned you wont get salary
Optimum Solutions,5.0,"May 23, 2023","M working for Hyderabad location with Good experience, management is helpful .",Senior Software Engineer,Current Employee,,"Friendly Management, Excellent work experience","Nothing as of now, everything is perfect"
Optimum Solutions,1.0,"Jun 9, 2023",just care about the commission from employee salaries,Applications Developer,"Former Employee, more than 8 years",Singapore,"Nothing as such, Just a consultancy once you get a job they'll only care about their commission.","No Progress, no good clients, you will be treated like slaves by the clients. Company doesn't care at all."
Optimum Solutions,4.0,"May 23, 2023",Goal orientated with senior manager people and placing the candidates with best organization.,Functional Testing,"Current Employee, less than 1 year",Hyderābād,Good management with friendly nature people,Nothing regarding disadvantages of this organization
