Company Name,Overall Rating,Review Date,Review Title,Job Title,Job Details,Location,Pros,Cons
Unity,5.0,"Jul 6, 2023",Great Company,Customer Success Manager,Former Employee,"San Francisco, CA",Great Company to work for.,I have nothing bad to say.
Unity,3.0,"Mar 8, 2023",Great Product and Culture Marred by Mismanagement,Anonymous Employee,"Current Employee, more than 3 years","San Francisco, CA","- Less political than companies of comparable size - ""No jerks"" policy applies more often than not - Good benefits / PTO, though this is starting to change due to management - Awesome product","- A couple major acquisitions were seriously fumbled, resulting in unnecessary expenditures - Multiple rounds of layoffs in the past year due to said fumbles - Subpar guidance from senior leadership"
Unity,1.0,"Aug 21, 2023",nice,Project Manager,Current Employee,"Austin, TX",nice place to work for,bad managers and bad culture
Unity,1.0,"Jul 14, 2023",It was a beautiful company. Now it is lame.,Anonymous Employee,Current Employee,,Product and some terrific peers.,Utter constant chaos Trend following rather than trend setting  No care for employees. No longer have a wellness benefit
Unity,3.0,"Jun 10, 2023","Good WLB, products struggling to get off the ground",Senior Software Engineer,"Current Employee, more than 5 years","Bellevue, WA",Good WLB 99% nice coworkers fun to work with,talent is just okay lots of new products just failing to get off the ground pay is not competitive
Unity,1.0,"May 15, 2023",Value-less company completely out of touch,Anonymous Employee,Former Employee,,"Unity once was great, so the reputation may be around a bit longer.","Unity has abandoned all values and is a sinking ship. Upper management has no idea what kind of work most of the employees do, and cannot fathom the hardships and struggles the employee base deal with. As a product they have abandoned teams doing meaningful work on new features and tech. It is now just an ad delivery company for mobile games."
Unity,4.0,"Jun 21, 2023",good company with a lot of potential,Tech Lead,Current Employee,"San Francisco, CA",* good business potential * interesting technologies,"hard to say, i've been there for only a few months"
Unity,5.0,"Jan 15, 2023",A company with a great culture and engaging work,Sr. Product Designer,"Current Employee, more than 1 year","Bellevue, WA",I have been with the company for several years and have really been impressed with the caliber of the talent and work/ life balance of the company. The work is really fun and is something I get excited to do every day with my team,The only cons come from the challenges of covid and working through remote development that affects all companies.
