Company Name,Overall Rating,Review Date,Review Title,Job Title,Job Details,Location,Pros,Cons
Splunk,5.0,"Feb 23, 2024",Great,Regional Sales Manager,"Current Employee, more than 3 years","Plano, TX",Best job I’ve ever had,Territories can be tough for some. If you have a good territory you’re set.
Splunk,2.0,"Dec 21, 2023",Coasting until the acquisition,Anonymous Employee,"Current Employee, more than 3 years",,Splunk has amazing benefits. The best health plans and perks I have ever encountered in my career. A handful of good eggs across several orgs make it bearable. Decent work life balance but the writing is on the wall as layoffs continue and the survivors are left having to do several jobs instead of one.,"Where do I begin? This is not a place for careee growth, it’s where you can get by and coast until retirement (the average age at this org is up there). If you are part of the inner circle, you are set for life. No amount of trying to fix the limitless red tape and poor process will get you anywhere. It is impossible to do your job with slow or broken tools. People who have never done your job are in charge of how it gets done. Why? I have spent two years here and no one can tell me how to get promoted. I have had four bosses in the same time and same BS. 

The inclusion delusion here is wild. Splunk likes to go on and on about its inclusivity yet you sit on call after call where you’re the only woman, only POC, or both. 

They cut 7% of jobs and then celebrate a “successful quarter”. 

The only way to stay sane here is to find stuff outside of work that makes the groundhog’s day of a job here worth it. For your manager it’s buying a boat or something."
Splunk,2.0,"Feb 3, 2024",It’s becoming a joke,Regional Sales Manager,Current Employee,,Work life balance and benefits,"No career growth at all. They will promote who they want, no matter how good or bad they are at their job.

Leadership rarely knows how to run a sales cycle. They just get on a call and say give me the p.o but don’t know how to do any of the background jobs 

Everyone is leaving after this Cisco acquisition. People are going to make so much money on the stock so they are coasting.

Product is getting passed up and the company doesn’t want to admit it.

If you want to work here, make sure you’re at a majors or enterprise account or higher. Leadership started this commercial growth segment and not 1 person hit quota in America. Average quota attainment was probably around 25-30% for reps but the directors were around 60-80%. Bigger account reps dominated."
Splunk,3.0,"Feb 9, 2024",Not the Splunk it used to be,Regional Sales Manager,"Former Employee, more than 1 year",,"Pay, Benefits, unlimited PTO, very nice and smart co workers",I have never seen so much great and intelligent talent to leave the company. Commercial Growth segment was a joke. No one hit the quota and they laid them all off. They also wanted RSMs to sell through partners which only complicated the process even more since not all of the partners even know what Splunk does. Competition is bitting them for sure. They are trying to sell premium product to small and medium businesses and they failed miserably. Upper leadership doesn't know what they are doing ( they don't even know how to sell the solution). Since Garry joined the company the culture is getting worse and worse.
Splunk,1.0,"Feb 22, 2024",Much worse than a year ago and very toxic now,Anonymous Employee,"Current Employee, more than 3 years",,You can do your own thing at all times and tee up a ton of stuff.,No vision. New executive leadership is inexperienced and faking it while they destroy everything they touch. Nothing ever gets shipped and everything is now top down. If you ask clarifying questions or idea share you will be pulled aside and called insubordinate. Team meetings now consist of exec talking about how smart they are and everyone else is around just to be seen so they keep their job. Its every man for themselves now with 0 career growth opportunities. Best way to describe it is - toxic and on the verge of becoming a career killing organization.
Splunk,3.0,"Feb 21, 2024",They treat you like you're still in college,Business Development Representative (BDR),"Current Employee, more than 1 year","Dallas, TX","-Easy to meet quota when I worked there
-Collaborative environment 
-Fun culture (at times)","The dynamic is so similar to that of being in college. Leadership will require you to complete homework like assignments and congratulate those that kiss a** rather than those that consistently meet quota. Extra points if you create a slide deck on a random process that really doesn't require documentation. When you're doing well they'll ""promote"" you laterally with no pay increase."
Splunk,4.0,"Mar 7, 2024",Great,Digital Marketing Manager,Former Employee,"San Francisco, CA",great place to work for parent,not enough room for opportuniy to grow career
Splunk,4.0,"Jan 29, 2024",Great job until you have significant personal life events or hardship,Technical Support Account Manager,"Former Employee, more than 1 year","Austin, TX","- High degree of independence and role empowerment
- Great benefits
- Opportunity to work with brilliant people, cutting-edge technology","- Frequent emerging product issues and incidents due to significant product and corp structure complexity/distributed responsibilities = high pressure environment
- Frequent, significant change (organizational and product direction). Managers are hit or miss and depending on your role you may be passed around to different bosses more frequently.
- Some managers are more or less understanding about work/life balance, personal life issues and significant life events. I returned from paternity leave, was assigned to a new manager (both new to me and new to his role) who was not a good match and caused me a lot of undue stress
- Big company = big layoffs"
Splunk,4.0,"Mar 9, 2024",Company Compensation,Engineering Director,"Former Employee, more than 5 years","San Francisco, CA","Great engineering talents, culture and fun","Talents leaving, engineering leadership and executive teamm"
Splunk,4.0,"Mar 7, 2024",Learned a lot,RSM,"Current Employee, more than 1 year","Oklahoma City, OK",There are a lot of resources,difficult unless you have a good install base
Splunk,4.0,"Mar 4, 2024",Nice balance but must be a self-learner,Curriculum Developer,"Current Employee, more than 3 years","Dallas, TX",Work life balance is truly amazing but training/onboarding is almost non-existent. You really have to be proactive.,Training/onboarding is non-existent for the most part
Splunk,4.0,"Mar 7, 2024",Splunk SDET,Software Development Engineer In Test (SDET),Former Employee,"San Jose, CA","good , people are nice, supportive",They move tech team to other countries
Splunk,4.0,"Mar 3, 2024",Great culture but too much change,Principal Program Manager,Current Employee,,Great culture & benefits along with decent pay,Too much constant change and leadership turnover makes everyone uncertain about their job
Splunk,5.0,"Mar 5, 2024",good,Business Development Representative (BDR),"Former Employee, more than 1 year","New York, NY","great people, flexible, good product",political and kiss assy type environment sometimes but nothing crazy
Splunk,2.0,"Feb 12, 2024",Eh,Engineer,"Current Employee, more than 3 years",,"Friendly co-workers, remote, decent pay",-No job stability. There are constant layoffs and everyone who is halfway paying attention to the plot realizes that Cisco is going to wipe 20% of Splunk off the board. ELT is also actively avoiding difficult questions. They pack the weekly townhalls with meaningless nonsense and leave maybe 2 minutes for questions - this is clearly deliberate.
Splunk,2.0,"Feb 1, 2024",Its getting a little top heavy.,Principal Engineer,"Former Employee, more than 10 years","San Francisco, CA","Core technology is still strong, amazing, and ready to handle more. 
Passionate, intelligent, and very approachable employees, although the ones who truly grasp the deep technology that makes Splunk work are unfortunately being replaced by the directed ""just know enough"" approach,","Culture has shifted from the ""Go above and beyond for Splunk"" to the ""Just check the boxes"" approach, which stifles work enjoyment and limits innovation. 
Product direction is continuously changing and negatively impacting delivered quality and substance."
Splunk,2.0,"Jan 27, 2024",Steady Decline,Regional Sales Manager,"Current Employee, more than 5 years",,Was a great company. Technology has gotten “long in the tooth” with little to no innovation. Benefits are great. Sort of a “semi-retirement” kinda vibe.,"As Cribl stated “some companies choose to innovate and others choose to litigate”. Splunk has had a steady, slow decline. Competition has blown by them. Upper management is weak, mostly due to all the talent leaving over the past 5 years so the leftovers are now at the top. Splunk is more concerned with image versus reality….sad to witness."
Splunk,5.0,"Mar 3, 2024",Great place to work,Splunk Professional Services Consultant,Current Employee,"Miami, FL",Lots of freebie snacks in the office,Just acquired. Unknown future moving forward
Splunk,5.0,"Feb 20, 2024",Wonderful place to work,Senior Solutions Engineer,"Current Employee, more than 5 years","Houston, TX","Great pay, great work/life balance. World class products.",Many account decisions are made my upper leadership without consulting the account team. It has lead to disjointed relationships and loss of trust with customers.
Splunk,2.0,"Nov 29, 2023",Employees No Longer Matter,Senior Manager,"Current Employee, more than 1 year",,Good benefits and smart employees.,"Splunk is not the same place it was before Gary Steele joined, the culture has gone out the door and employees are now just a number, overworked, and undervalued. The number of steps to complete anything are over-processed, want to sneeze - you need 5 approvals and 10 steps to make sure you sneeze right - and as a result nothing is ever completed on time and employees don't feel trusted to do their best work because they are told constantly it isn't good enough. In all my years and companies, never seen so many smart people undervalued and a power hungry leadership who thinks they only know the answers."
Splunk,4.0,"Feb 28, 2024",Great run for the company,Customer Support Representative,"Former Employee, more than 5 years","San Francisco, CA","Great product and market leader
Great culture",Just gotten to big too fast and lots of changes including pending acquisition
Splunk,4.0,"Mar 3, 2024",Good pay ,Senior Software Developer,Former Employee,"San Jose, CA","good pay, standard benefits package",not the greatest fertility benefits
Splunk,4.0,"Feb 28, 2024",Great place to work at,Software Engineer,"Former Employee, more than 3 years","San Francisco, CA","Relaxed culture, especially in the earlier days. You're able to switch teams.","Really scaled in number of employees, stock sunk"
Splunk,4.0,"Feb 28, 2024",Fair Pay,Manager,"Current Employee, more than 8 years","Plano, TX",The pay is fair for this position.,Upper managerment is out of touch with the lower workforce.
Splunk,3.0,"Feb 22, 2024",Overall good with some uncertainity,Technical Success Engineer,"Current Employee, more than 1 year","Raleigh, NC","Pays well, good medical benefits, good line management in my department",Uncertainty pending Cisco acquisition. Sometimes there is a lack of clarity in roles and where the company is going.
Splunk,4.0,"Feb 26, 2024",Frustrating,Anonymous Employee,Former Employee,,"Product had valuable capabilities, good pay","Strange management, Unfocused at times"
Splunk,4.0,"Jan 23, 2024",Splunk is still here.,Regional Sales Manager,"Current Employee, more than 3 years","Santa Clara, CA",- Great managers - Best-in-breed technologies - Great benefits and compensations. Very open transparent leadership. All virtual but great to work with talented coworkers.,No job security with the acquisition of Cisco in Mid '24. Everyone is very nervous and focus is very hard for some folks. Almost impossible to get approvals to spend any money for travel to clients.
Splunk,5.0,"Feb 19, 2024",Good culture ,Senior Product Manager,Former Employee,"San Francisco, CA","Good culture and technology 
Good work life balance","Poor leadership direction 
CEO lacks visions"
Splunk,1.0,"Jan 1, 2024",Mis-Managed and political new Leadership,Principal Software Engineer,"Current Employee, more than 3 years","San Jose, CA","Splunk Brand, Legacy Culture and Team of people to support for growths.","This was the place in bay area which had terrific Team culture. And great Management (immediate Leaders and ELT)

But after the exit of its great CEOs the culture had deteriorated and new ELT and leadership just want to save their positions and visibility leading into politics and mismanagement and little to no growth environment.

Its full of favoritism and no ideal place now what it used to be.

This is my honest review."
Splunk,5.0,"Feb 22, 2024",Great company,Global Certification Program Specialist,Current Employee,"Atlanta, GA",Great work/life balance and good pay,Have a hard time back-filling roles
Splunk,2.0,"Jan 3, 2024",Honest review on diversity,Sales,"Current Employee, more than 5 years","Chicago, IL","Good brand name, onboarding is great, teammates, clients are good references.","Diversity programs are not private 
Constant turnover in sales due to lack of diversity and treatment of employees who request help from their managers and are punished and ignored for their reporting 
Not a good place for women and LinkedIn can show the lack of diversity and inclusion 

They Hire younger people and fire or layoff workers who are mostly over paid and over 50 years of age 
HR is not your friend and will hide or ignore any information that you report and their follow up will never be shared with senior management 
Management is micromanaging at very senior levels that does not allow for strategic vision from the sales reps- weekly reporting of every single task is required in slack and this is from a specific group of managers 
Limited customer support for serious needs and you are required as a sales rep to do the job of sales engineers, services and other employees jobs. It is almost impossible for a sales person to focus on strategy when there are other jobs they have to perform. 
Customers are very unhappy with so many changes and management decisions for the long term may be difficult but the lack of planning with the customers affected sales performance 
Your personal data is not protected by HR labor laws 
If you leave the company and apply at other employers the same people at the company will speak about an employee negatively and do not follow up on a single complaint. I have witnessed the derogatory comments about other employees to potential employers this should be stopped immediately as it is highly against the law. 
Layoffs and terminations focused on older women 
Sales commissions are at the discretion of HR and not labor laws 
Reporting any type of sexual misconduct is ignored by HR and they do not follow up - do not report any misconduct or you will be fired 
Several people on medical leave were fired upon return and these were mostly women 
Some of these firings took place within days of their full vesting after 4 years of hard work 
Senior management promotion of women are limited and this is a good ol boys club 
Require daily or weekly updates in slack to micromanage your team weekly work - this is a practice for a very junior team not those that have worked in their careers for many years. 
Customers are exhausted from the constant changes that don’t seem to reflect their needs first 
Requests for meetings to resolve serious disputes are ignored and blocked by HR
HR decides if you are paid on your commission and ignore the law that requires commission to be paid in full
HR uses derogatory language during layoffs and termination and violates employee confidentiality and privacy 
Stock is used as a retaliation against any employee who does not adhere to their mid level manager and threatens those who want to report harassment wjth being fired 
Managers will ask you to lie about deals and there is a problem with lack of diversity 
The discrimination is very common and this was happening for many years. 
Requests to speak to senior management is blocked or you are fired- note thst this is not widespread and only a handful of staff members are promoting this type of workplace neglect 
Stock is not worth the time because they will find any reason to lay off workers to avoid paying their options and earned salaries 
Managers are not experts or experienced managers and favors men vs women.
If you are over 40 years of age you are definitely not a good fit"
Splunk,3.0,"Jan 17, 2024",Inbound to Cisco integration,Marketing Manager,"Former Employee, less than 1 year","San Francisco, CA",A great brand with many loyal customers and a stellar reputation as an employer committed to preserving a progressive work culture,"Loss of talent to competitors, reduced budget , headcount and company focus areas trends nicely for integration into Cisco by mid 2024 but is a very slippery slope for employees and job seekers"
Splunk,5.0,"Feb 8, 2024",Great place to work,Technical Writer,"Current Employee, more than 1 year","San Francisco, CA",Great teams the people and teamwork,Management can't seem to provide leadership that is make a decision. Takes months to Directors and above to make a decision.
Splunk,4.0,"Feb 7, 2024",Product and Culture,Principal Software Engineer,Former Employee,,"- Great products
- Big community supporting the products
- Salary above market","- Company roadmap constantly changing for at least the past 2 years
- Slowing down in innovation and the competition is catching up fast
- Lot of tech debts"
Splunk,3.0,"Feb 5, 2024",Regional sales manager ,Regional Sales Manager,"Former Employee, more than 1 year","Los Angeles, CA","Technology, experience and knowledge of long term employees.",Too many changes in a short time.
Splunk,3.0,"Jan 16, 2024",Overall it was fine,Sales,"Former Employee, more than 3 years","San Francisco, CA","Solid client base
Enablement
Place for women to grow","Many employees supporting sales are great technically but early in careers to solve strategic solutionssiv
Seemed if you were not in the ""in"" crowd and had any new ideas you could not fit in - dated sales process"
Splunk,4.0,"Nov 8, 2023","Great Pay, Bonuses, and Culture",Software Developer,"Former Employee, more than 5 years","Boulder, CO","Great benefits, from RSUs to ESPP to family planning, etc etc. They will reimburse up to $500 a quarter for nearly anything (I used it on vet bills.) Get a quarterly ""Global Rest Day"" off, and a lot of holiday time in the winter. Fully remote (if that's a plus for you) Direct management genuinely cares about career growth, treating employees fairly.","C-level and upper management seem out of touch at times. Had several incidents, like cutting bonuses after a positive investor call, where they seemed blindsided by the blowback. Large amounts of turnover on all levels make it difficult to make connections and care about people outside my immediate team."
Splunk,4.0,"Feb 14, 2024","Overall good company, has some issues",Senior Software Engineer,"Former Employee, more than 3 years","San Francisco, CA","Nice people, laid back culture","Slow moving, lots of red tape"
Splunk,4.0,"Jan 8, 2024",What can I say,Technical Support Engineer,"Current Employee, more than 3 years","Plano, TX","Good company culture, flexible and human benefit, really care about employees mental and physic health","Not that much grow for the position, rather hire outside than giving opportunity to taking care of the senior employees. Just my personal experience"
Splunk,5.0,"Feb 6, 2024",Great company to work for,Principal Software Engineer,"Former Employee, more than 5 years","San Jose, CA","Good and solid products
Culture
Great compensation and benefits
Leadership transparency
Flexible work model (remote or hybrid)","Sometimes ""not so"" challenging or interesting projects to work
Layoffs (twice an year, avg)"
Splunk,2.0,"Jul 20, 2023","If you want to enjoy being a Splunker, join a Splunk partner",Professional Services Consultant,"Current Employee, more than 3 years","New Orleans, LA","Good technology and a good platform, a talented dev team. New CEO seems like his head’s in the right place.","They are actively cutting benefits like equity, bonuses, etc. to cut costs at the behest of new investors and - for the first time in 20 years - actually be a profitable business. You will have to CYA to a maniacal degree to protect yourself from your co-workers. Despite an overcompensating degree of ERGs, DEI measures, etc., it’s a toxic environment. Everyone knows the party’s over, but they’re just trying to stay in for as long as they can - and they do that by trying to throw each other under the bus. A comical overabundance of middle management, with many rookie managers who really just make everyone miserable and everything worse and more complicated. They rose into leadership to fill gaps after a large number of people left in 2020 and 2021."
Splunk,4.0,"Feb 6, 2024","Open door policy , great support from management",Sr Process and Transformation Lead,Former Employee,,"great support from management, lots of areas for growth",After the Cisco aquisition was announced its going downhill
Splunk,4.0,"Feb 14, 2024",Income ,Sales,Former Employee,"San Francisco, CA","Good technology, good team, great tshirts",Internal operations and support challenges
Splunk,4.0,"Feb 6, 2024",Overall a great place to work at,Software Engineer,"Current Employee, more than 3 years","New York, NY",Good working culture and work life balance,Inconsistency in transparency from management level as well as frequent re-org
Splunk,5.0,"Feb 8, 2024",Awesome Company to work for,Senior Sales Engineer,Current Employee,"San Diego, CA",Awesome benefits and people who work there,Very intense training schedule and many products
Splunk,5.0,"Feb 5, 2024",BDR,Business Development Representative (BDR),Current Employee,"Denver, CO",the pay is pretty good since i started out of college,There has been alot of changes going on
Splunk,5.0,"Jan 16, 2024",Awesome company,Senior Sales Engineer,"Current Employee, more than 3 years","San Jose, CA","Truly one of the greatest places I’ve ever worked. Culture is top notch, coworkers are very professional and knowledgeable. Organization structure lends itself well to advancement but also doesn’t punish those that would prefer to stay in the role they are but grow technically.",Technology landscape is shifting and products need to continue to adapt.
Splunk,4.0,"Feb 2, 2024",Great Place to Work,Business Analyst,"Current Employee, more than 1 year",,"awesome culture, great team, remote, friendly and accomodating",now going through a rough patch with acquisition and layoffs
Splunk,5.0,"Feb 1, 2024",Great company to work for,Anonymous Employee,"Current Employee, more than 3 years","Denver, CO","- inclusive, good benefits, pay is good, people care",recent management changes have made it hard to focus
Splunk,5.0,"Jan 28, 2024","Great culture, benefits, and pay",Product Manager,"Current Employee, more than 1 year","San Francisco, CA","Great culture, benefits, and pay","Make sure you are interested in the field of data processing, observability and security, and products the company is building."
Splunk,5.0,"Jan 29, 2024",Highly Recommend,Finance Manager,Current Employee,,Great company and leadership. Good opportunities to get expose to senior leadership,It is being acquired by Cisco so some uncertainty around what happens next.
Splunk,4.0,"Jan 31, 2024",splunk,CS  Manager,"Former Employee, more than 1 year","San Jose, CA",The company offers nice perks with a focus on health and wellness.,Too many management changes + everchanging operating models
Splunk,3.0,"Jan 22, 2024",Good Company,Inside Sales Representative,Current Employee,"Tampa, FL","Great work life balance, pay is good. Benefits are also high level. Internal processes are confusing. Training is a google doc.",Difficult internal systems to check boxes and less direction towards goals.
Splunk,5.0,"Jan 28, 2024",yeslaw,BDR,"Current Employee, less than 1 year","McLean, VA","pay, compensation, growth, partnership, collaboration","not a remote job, hybrid at best"
Splunk,5.0,"Jan 3, 2024","Great Company, Great People",Regional Sales Manager,"Current Employee, more than 1 year","Raleigh, NC","It's a great company to work at with great culture. Very good work life balance, with plenty of holidays and global rest days to rest. Great pay!",Layoffs due to Cisco acquisition
Splunk,4.0,"Jan 24, 2024",Salary,"Director, Customer Success","Former Employee, more than 1 year","Dallas, TX",Great Place to work and good work life balance,None that come to my miind
Splunk,4.0,"Nov 2, 2023",Wish I could manage my disabilities better to stay,Business Development Executive,"Former Employee, less than 1 year","Tampa, FL","$500 stipend every quarter, tons of vacation time, pretty cool managers, free company swag, genuine interest in helping you promote in the company if you want","I would say there’s not enough education on individuals with disabilities, there’s resources but it’s a passion to try to navigate, I experienced microaggression (as most corporate companies)"
Splunk,5.0,"Jan 21, 2024",Great culture,Engineering Manager,"Current Employee, more than 1 year","Atlanta, GA","Great benefits
Challenging work, but rewarding 
Great people
Diverse","Silos and not as much cross functional team work, which is being rectified"
