Company Name,Overall Rating,Review Date,Review Title,Job Title,Job Details,Location,Pros,Cons
Skyscanner,5.0,"Jul 23, 2023",Good work life balance,Comercial Manager,"Current Employee, more than 1 year","Miami, FL",Great place to work before the pandemic,No mobility if you working in the US
Skyscanner,2.0,"Sep 18, 2023",Not good for neurodivergent people,Partner Services Executive,"Former Employee, less than 1 year","Miami, FL",Everyone is very nice and engaged in interpersonal relationships.,"Being told to reveal a diagnosis to someone with whom I did not feel comfortable sharing with, multiple times by HR and my skip level manager, who I told specifically because I don't work closely with either and their knowledge wouldn't affect my day-to-day working. Salaries are low, backend systems are quite wobbly. Naming conventions for teams are totally random and unrelated to the team's work, and in most slack channels you will not find clues as to what that team handles. Makes it very difficult to find a rhythm."
Skyscanner,4.0,"Sep 28, 2022",Great culture,Senior Growth Manager,Current Employee,,The most empathetic people in a very human environment. Incredible work-life balance.,Hard to feel like you’re making an impact
Skyscanner,5.0,"Jul 12, 2022",Great company,Anonymous Employee,Former Employee,,Great company to work for. The team is wonderful,Since the company is very big sometimes there was a misalignment of information.
Skyscanner,4.0,"Jul 18, 2022",Good,Marketing and Branding Specialist,"Current Employee, more than 1 year","Richmond, VA",A good place to work.,Sometimes they can be a bad place to work.
Skyscanner,5.0,"Aug 12, 2014","Work environment that breeds creativity, collaboration and success!",Anonymous Employee,Current Employee,,"Employee empowerment is key. Not only does Skyscanner focus on continued learning, but they encourage their associates to speak their minds and problem solve. They create a culture where its okay to try something new and not simply fit into the mold. They provide flexible work hours, regular feedback, charity days to connect to the community, an abundance of vacation, inter-office bonding events, and an amazing community of free-thinkers I am happy to be a part of.",I got an error message asking that I put cons in. I'm sure I'm not the first Skyscanner employee to attempt to skip this section and end up seeing that red box. It's for a reason.
Skyscanner,5.0,"Jan 6, 2014","Fun, relaxed yet fast paced work atmosphere.",Engineer,"Current Employee, less than 1 year",,"Skyscanner has a great company culture, and great people. The traditional ""corporate"" bureaucracy is almost non-existent. The reinforces collaboration through teamwork while acknowledging and rewarding individual accomplishments. They provide ample opportunity for career development and make on-going training a priority. Flexible working takes into consideration ""real"" life and doesn't keep me tied to a desk 9-5.",Sink or Swim. Skyscanner is a very fast paced work environment where collaboration and individual drive is key. With a complex product it is at times challenging to understand the ever changing technologies that the company is based on.
Skyscanner,5.0,"Dec 12, 2016",A Truly Exceptional Company,Anonymous Employee,"Former Employee, more than 1 year","Miami, FL","Skyscanner is a company with humble beginnings founded by the most humble and down to earth CEO you will ever meet. The company's transparency and trust in the hired staff is what truly makes it a special place to be in. Great benefits, fantastic people to work with and I always found room for growth. I learned a ton every day and I see a bright future ahead for the company.","There could often be too many meetings and being in the smaller offices, one could feel pressured to attend although it wasn't relevant. There could also be difficulty with communication between the different offices around the world."
Skyscanner,5.0,"Jan 23, 2020","Unique Culture, great people, amazing technology and product.",Principal Engineer,"Current Employee, more than 3 years",,"This is the best company I've worked in my career, the culture is extremely good, everyone lives and breathe the values. It's the only company I know that really put the customer first at the heart of decisions, even if the decision could hurt profit, it's all about the traveler experience.  Lot of great technology and big scale systems, which is a dream for Engineers.  Genuine opportunity to make an impact in the world via changing Travel. Great offices. Fail forward culture. I keep learning like the first day and that is priceless for me, a lot of smart people to learn from. Strong people focus.","I can't see any, I guess that is very fast paced, but it is an Industry characteristic."
Skyscanner,4.0,"Apr 3, 2018",With great benefits come great bureaucracy,Anonymous Employee,"Current Employee, more than 3 years",,"- Great health insurance at no cost to the employee. Family members added means you pay a little but nothing outrageous.
- Fully vested 401k the moment you start. And contributions up to 5% matched by the company.
-Brilliant people that really are a joy to work with in all of our offices.","-Creativity has been stifled at the cost of velocity.
-Autonomy feels like an illusion in terms of creation.
-Takes a long time to get most anything agreed upon when it comes to higherups."
Skyscanner,5.0,"Jan 20, 2020",Doing it right!,Senior Talent Executive,"Current Employee, more than 8 years",,Skyscanner is a rare gem for it's product scale! We are proud to have a culture that is aligned both externally and internally and trying to serve our society and internal team in the best way possible. It's a dream to be part of this team and exciting to be part of a company that seeks to transform the travel industry pioneering what's already embedded deeply in our mindset: to be sustainable and traveller first!,"Managing change and growth is always a challenge, but it's the good type of problem."
Skyscanner,5.0,"Jan 3, 2014",Absolutely incredible place to work!,"Sales Manager Hotels, Americas","Current Employee, less than 1 year","Miami, FL","This company has a similar culture as some of the coolest, most fun and innovative companies in the world. It's one of the best companies to work for in the world. I am so lucky and happy to be working here.  

- Relaxed, fun and motivating atmosphere 
- Flexibility & work/life balance
- Bright, creative, quirky and awesome people/colleagues
- Flat organization structure
- Benefits/perks
- Growth opportunity","Benefits (healthcare cost), but this will be improving as company grows and we hire more employees."
Skyscanner,2.0,"Feb 4, 2018","Management is not good, Not a good place for career growth",Anonymous Employee,"Former Employee, less than 1 year","Miami, FL","Co workers are friendly. Make you feel welcome. The US office is more of a start up, so always get new responsibilities and can learn new things.","Not a good place for career growth. Main issue is with management. One of the few who was really good and talented left the company. Management mostly imported form UK and look biased.Don't lead by example. Seems quite a bit of nepotist culture as well. One of the leads had a spouse working in the office and always seem to favor him, helping the him get extra credit in-spite of the fact that he was totally incompetent."
Skyscanner,4.0,"May 31, 2016",Great Company to work for,Anonymous Employee,Former Employee,,"One of the best company's I've worked for, overall!
- People 
- Culture
- Autonomy
- Fun and Collaborative Working Environment","When I worked there, the America's region was just being launched so this part of the organization was running like a start-up, there were many challenges as expected, minimal training, not enough resources, etc."
Skyscanner,2.0,"Aug 4, 2019",Not great if you aren't at HQ,Product Manager,"Current Employee, more than 1 year",,I guess they are a big deal in Europe?  So notoriety?,"-  Employees are motivated to write blogs about things they've done, rather than actually doing work.  If you don't have a paper trail or a Confluence page pointing to what you've done, you don't exist.
-  Benefits (particularly for acquired companies and/or non-HQ offices) are below market.  

-  Gym benefit is $150 LIFETIME.  In California, you can use this to take a handful of yoga classes and/or go to budget gym for a year."
Skyscanner,4.0,"Feb 17, 2016",Process could be quicker,Anonymous Employee,Current Employee,,Very friendly recruiters who are willing to work with your schedule.,Longer process than usual. HR team is a little unorganized it seems.
Skyscanner,4.0,"Apr 26, 2016",Fun company,Anonymous Employee,Former Employee,,"The company culture is fun and friendly with lots of events throughout the year, the offices are a nice place to work and the company employs lots of interesting people",You can find yourself very busy with work due to the growth of the company
Skyscanner,5.0,"Jun 25, 2015",It's an Honour to work for such a great company!,Anonymous Employee,Current Employee,"Miami, FL",Absolutely brilliant place to work and I am confident it will continue to be so. Higher management is fantastic.,Sometimes communication can be tough between global offices.
Skyscanner,5.0,"May 7, 2021",Great company to work for with many opportunities to grow.,Growth Executive,"Former Employee, more than 3 years",,"Great work environment, with strong benefits, and good work-life balance.",Company tends to give more preference and attention to UK offices.
Skyscanner,4.0,"Jan 12, 2018",Great company to work for,Anonymous Employee,Current Employee,,"Great company to work for, for the most part. Good benefits, awesome people and a great environment.",No clear career plan in place.
Skyscanner,5.0,"Jan 21, 2021",Best company,Strategic Growth Manager,Current Employee,,Great culture and great team,None that I would say
Skyscanner,2.0,"Nov 7, 2019",Very bad culture,Software Engineer,"Current Employee, more than 1 year",,Pretty good work life balance.,"Lack of onboarding process, very bad culture, pushing and not letting you bring ideas and lead new things. 
Not willing to accept and work with other time zones.
Benefits are really bad, i.e. once in a life time gym reimbursement of $150."
Skyscanner,1.0,"Sep 19, 2017",Skyscammer better describes this place......,Sales,"Former Employee, less than 1 year","Miami, FL",Most of the people are nice.,Sales Management extremely passive aggressive. Too late to the market is US. Who needs another travel site that just tries to copy the others? Managers treat salespeople as disposable. Very clicky. Import their upper management team from UK/ Scotland where Skyscanner is successful. They do not know what they are doing in US market. Crazy amounts of internal meetings make it hard to do job. Encourage co workers to narc you out.
Skyscanner,1.0,"Mar 17, 2020",Terrible situation in some squads,Software Engineer,"Former Employee, less than 1 year",,"People have lots of potential.
Work from home.
Decent comps and benefits.","Squads are tiny dreadful feuds ruled with an iron fist by manipulative masters and their minions.

Lying and bulling is the norm. 

Colleagues are thrown one against the other by means of lies and false promises.

Working in some of them is unbearable."
Skyscanner,2.0,"Apr 7, 2021",Org Restructuring Needed,Anonymous Employee,"Former Employee, more than 1 year",,"Lots of benefits, especially in the travel space",Constant reorgs and very flat line management. Really hard to get things done.
Skyscanner,5.0,"Jan 30, 2024",Great place to work,Talent Acquisition Manager,"Current Employee, more than 3 years","Glasgow, Scotland","Working at Skyscanner has been an incredible experience for me. One of the most standout aspects is the amazing people I get to work with daily. The team here are not only talented and knowledgeable but also incredibly supportive and friendly, creating a vibrant and collaborative work environment.

The company culture is exceptional. It strikes the perfect balance between professionalism and a relaxed, welcoming atmosphere. This balance fosters creativity and innovation, making it a place where ideas are encouraged and valued.

Another thing that I deeply appreciate is the commitment to employee development. There are abundant opportunities for learning and career growth. 

Most importantly, Skyscanner genuinely cares about its employees. The company goes to great lengths to ensure we're not only satisfied with our work but also thriving in all aspects. From flexible working arrangements to mental health support and regular feedback sessions, it's clear that employee well-being is a top priority.","Honestly, it's hard to point out any significant downsides. Like any fast-growing company, there are occasional challenges with scaling and adapting, but these are normally met with proactive strategies and clear communication."
Skyscanner,5.0,"Mar 11, 2024",A company to work for.,Principal Product Manager,"Current Employee, more than 3 years",Barcelona,"Culture, cool products, clear vision.",Can be political and process heavy.
Skyscanner,4.0,"Feb 29, 2024","Great company culture, organic growth",Principal Growth Manager,Former Employee,Singapore,"Great company culture, data driven approach, organic long term investments, learning and development of employees","Average salaries, lack of innovative ground breaking initiatives"
Skyscanner,5.0,"Feb 23, 2024",Great company to work for,Engineering Manager,"Current Employee, more than 5 years","Glasgow, Scotland","Great freedom, support and growth opportunities. Smart people work here.","Mileage may vary depending on your manager but plenty of opportunities to change that if needed, talent team is very supportive and understanding."
Skyscanner,4.0,"Feb 23, 2024",Great Experience,Business Analyst,"Current Employee, more than 1 year",Pune,Good condition and good opportunity,Working hour long but can manageable
Skyscanner,5.0,"Jan 30, 2024",The best job I've ever had,System Engineer,"Current Employee, less than 1 year","Edinburgh, Scotland","Great people, Good work life balance, great career growth opportunities. Nice benefits",you have to work in the office for some days a week
Skyscanner,5.0,"Feb 10, 2024",Nice people and ,Senior Product Manager,"Former Employee, more than 1 year","Edinburgh, Scotland",Nice people and good work,Mid level leadership are poor in certain areas.
Skyscanner,3.0,"Feb 22, 2024",Good WLB bad comp,Graduate Software Engineer,"Current Employee, less than 1 year","Edinburgh, Scotland",Good work-life balance and company culture,Bad compensation compared with industry average
Skyscanner,5.0,"Jan 22, 2024",Great place to work in,Software Engineer,"Current Employee, more than 1 year","London, England","Amazing culture, great surroundings, challenging environment",The pay and benefits could be better (except the holidays policy which is great)
Skyscanner,2.0,"Jan 6, 2024","A company with a good culture, but now in stagnation",Anonymous Employee,"Former Employee, more than 3 years","London, England","· People are nice. Colleagues are respectful, polite and genuinely nice. That and good work-life balance are the reasons why people say Skyscanner has a good culture.

· Good work-life balance. There’s a lot of respect for personal boundaries and work-life balance. If you need time off for your physical health, mental health, or family reasons, everyone understands and encourages you to prioritise yourself and your family.

· Traveller-first approach. People care about the users, and put their needs above the needs of the business. It's a rare and admirable cultural trait for a company that big. 

· Mature product development process. Roadmaps, product hypotheses, success metrics, cross-functional collaboration and stakeholder management.","· People choose to be nice instead of being honest. That's the flip side of the company culture of niceness. People don’t give “negative” feedback and often avoid any type of confrontation. That gets in the way of getting honest work critique, improving product quality and trying to get career development feedback.

· Career progression is almost impossible. It's a bureaucratic, document-heavy, and unclear process. It takes years and almost impossible to do by the book. To get a promotion people focus not on delivering the work, but on visibility and building relationships to be in favour with the right people from the leadership.

· No vision. There is no ambition, no big bets, no ideas for what's next in travel tech. The leadership presents a few design concepts once a year, but they never get built. There are endless conversations to align on ideas and plans, and no one ever takes the responsibility for a decision.

· Hard to be proud of the product. Product across desktop website, mobile website, and mobile apps looks and works incoherently. Since the beginning of COVID many features were shut down, and never turned back on. In the last years very few new features were launched. If you compare Skyscanner's product with competitors, it's severely behind in quality and convenience.

Overall, Skyscanner is a great place to work if you value work-life balance, nice colleagues, and a good salary and benefits. However, if you are ambitious and want to do your best work, grow, and learn, it's not the best fit for you."
Skyscanner,5.0,"Jan 19, 2024",Great place ,Analyst,"Former Employee, less than 1 year","London, England",Nice people and everyone is very smart,There are none it’s all good
Skyscanner,4.0,"Jan 11, 2024",Open Culture and Good Guidance,Product Manager,"Current Employee, more than 3 years","London, England",Projects and products are open to your interpretation of how you want to operate.,Job rotations are difficult to get
Skyscanner,5.0,"Jan 13, 2024",Good place to work,Senior Software Engineer,"Current Employee, more than 1 year","London, England",Well-organised process and great culture,You may keep changing the team now and then
Skyscanner,3.0,"Feb 12, 2024",Stale,Engineering Director,Current Employee,,"Nice people, perks, product and location",Not to answer at this point
Skyscanner,4.0,"Dec 20, 2023",Nice,Ui\Ux Designer,"Current Employee, more than 1 year",Mumbai,"Good Job, good work environment",not enough monitoring motivation provided to employees
Skyscanner,4.0,"Sep 6, 2023",Good company - horrible promotion system,Anonymous Employee,"Current Employee, more than 3 years",,"- Work-life balance - Culture, the company is truly committed to maintain a positive and supportive environment - Product, Skyscanner has a strong brand equity and it operates in a business with a lot of growth potential - People in Skyscanner are generally good person, helpful and smart","The Promotion System doesn't work. It frustrates a lot of people, it is lengthy, highly subjective and susceptible to biases. You might be stuck forever at the same level if you work in the wrong team/area"
Skyscanner,5.0,"Dec 8, 2023",Great environment!!,Personal Assistant,"Current Employee, less than 1 year",Cannes,"Well paid job, excellent environment",Nothing at all. Everything was excellent
Skyscanner,4.0,"Nov 2, 2023",Great level of structure and idea of positive culture,Anonymous Employee,Former Employee,,"Great managers, benefits, allowances, and incentives. Company has significantly better level of organization than most.",Head of local office can be a little biased towards teams from other departments.
Skyscanner,2.0,"Jan 2, 2024",Mediocre Company,Software Engineer,"Current Employee, more than 1 year","Edinburgh, Scotland","- if you want to work in the travel industry and learn flight pricing etc
- work/life balance","- low engineering standards
- low average talent level
- little room for growth"
Skyscanner,4.0,"Nov 29, 2023",Great culture and learning oppurtunities,Anonymous Employee,"Current Employee, more than 1 year","Edinburgh, Scotland","Great culture
Vast learning opportunities",Working on small parts of big project
Skyscanner,4.0,"May 29, 2023","Great place to work, has its ups and downs",Senior Software Engineer,"Current Employee, more than 8 years","Edinburgh, Scotland","- Good benefits - like take 3 , take 5 as part of 3 , 5 year service - Team building activities are amazing . - Good life work balance - Great culture. You can be flexible and take time needed as long as you are sensible and cover the times/ hours back - Intelligent colleagues to work with","- Project ideas get recycled a lot - Technologies get shifted . Once you were focussed in backend now you look at front end for example. There is an increasing need for Web in Skyscanner so distributed systems problems are not many lately . - Young management means you get to work with people who have unrealistic views of timelines and this can be dangerous . - Increased mentoring means you spend quite a bit of time bridging the gap between junior and senior level engineers - This applies for many companies however after senior engineer, your options are more limited and"
Skyscanner,4.0,"Nov 5, 2023",Engineer - London,Engineer,"Former Employee, more than 3 years","London, England",Organisation grounded in engineering excellence,Too much focus on executive leadership
Skyscanner,5.0,"Nov 3, 2023",very nice company,Software Engineer II,"Current Employee, more than 1 year","London, England",Good work-life balance and flexibility,Very little salary gross and not competitive
Skyscanner,4.0,"Oct 27, 2023",positive,Internal Growth Manager,Current Employee,"London, England","nice people, culture, office environment","business does not clearly prioritise, hard to get promoted"
Skyscanner,5.0,"Aug 21, 2023",Great place to work!,Software Engineer,"Current Employee, less than 1 year",,"Since day 1, Skyscanner has repeatedly shown that it lives up to the company values. It gives great flexibility for a work/life balance, challenging tasks and the benefits are great.",There isn't much to say here. I'm not living in the country where my family lives so would be nice to increase the amount of days per year where one can work from another country.
Skyscanner,4.0,"Oct 17, 2023",Software engineer,Software Engineer,"Current Employee, more than 1 year","London, England","Great people, good tech and interesting work",High expectation for the level of pay
Skyscanner,4.0,"Oct 4, 2023",Great culture,Software Engineer,"Current Employee, more than 1 year","London, England","Supportive team, great benefits, excellent work life balance","More competitive pay, need a bigger office space"
Skyscanner,4.0,"Jan 20, 2023",A brilliant place to learn and grow,Software Engineer II,"Current Employee, more than 3 years","London, England","- Skyscanner is a great place to learn and grow. Every colleague I've ever met is incredibly eager to go the extra mile to share their wisdom. - Post COVID, management have been consistently making sensible decisions on pointing the business in the right direction for us to outgrow our competitors. - If you outgrow your role, promotions and rotations are encouraged albeit somewhat difficult to set in motion.","- Wage stagnation is a big problem. If you get promoted you will be stuck at the bottom of the band below market average for a LONG time. Trying to address this is not simple and feels like a losing battle. - Some projects can take a while to get off the ground due to having to align so many people, however, this has been improving significantly with new alignment frameworks in place."
Skyscanner,5.0,"Jul 20, 2023",Great company to work for,Senior Software Engineer,"Former Employee, more than 3 years","London, England",- look after employees - great tech and smart colleagues - really nice office in Central London - a great product that people love to use,"- the promotion process is over complicated and can be difficult and lengthy, putting people off the process entirely - they could be making bigger and riskier bets with the development of the website and app"
Skyscanner,5.0,"Aug 7, 2023","Great people, great aspirations",Anonymous Employee,"Former Employee, more than 5 years","Edinburgh, Scotland",- Smart people who care - Good benefits,- Some management need to more deeply understand the business
Skyscanner,5.0,"Sep 20, 2022","Great People, Culture and Opportunities to Learn",Anonymous Employee,Current Employee,,"- The people really care about each other. They are welcoming and helpful and low-ego. If you need support your team is going to be there for you. It's a great place to learn on the job.
 - You feel connected and part of the strategy regardless of the department you are in. We get a lot of updates about progress to the goals in Townhalls and there is a Daily revenue KPI email that keeps people informed of how we are doing as a business. I've never see that level of transparency anywhere else.
- We are very Traveler focused and there is a lot of work being done to make sure the product is accessible to everyone.
- Managers have access to a lot of training and there are specific programs to help people who want to get in to management the opportunity to do that with a support network.
- Incredible Annual Leave benefits, including an additional 5 week holiday on top of your usual leave that you get after 5 years service.",- Nowhere is perfect but I can't think of anything that needs to be fixed that isn't already in the plan to improve.
