Company Name,Overall Rating,Review Date,Review Title,Job Title,Job Details,Location,Pros,Cons
Zoom Video Communications,5.0,"Mar 10, 2024",Actionable leadership,Senior Engineering Manager,"Current Employee, more than 1 year",,Actionable leadership and talented engineers,Not that I could think of.
Zoom Video Communications,2.0,"Feb 19, 2024",A Great Ship with a Lost Captain and Crew,Anon,"Current Employee, more than 1 year",,"Pros would be the culture before the layoffs, the ability for the company to create products quickly and masterfully.","Leadership. I believe this came from the pandemic elevating people who had no business being in senior roles being called to higher places of responsibilty due to the situation with the COVID boom. 

The emperor wears no clothes is another issue with the company. Eric needs people to tell him like it is and to assist in the growth of the company instead of a bunch of yes-men. 

Ironically communication, given it is a communication company. There needs to be more cross-pollentation of ideas amongst leadership. In person mandates for the drones isnt necessary and is in point of fact antithetical to the entire MO of the company, It is about leadership meeting and talking, for they decide the course of the whole operation, that needs to be done in person.

This company has potential to be great, but it is rotting from the inside due to leadership."
Zoom Video Communications,4.0,"Jan 31, 2024",Was great while it lasted,Security Engineer,"Former Employee, more than 3 years","San Jose, CA","Excellent compensation and benefits, unlimited (untracked) PTO, reimbursement for books and newspapers, some of the smartest people I've ever worked with, excellent CISO, opportunities to explore what interests you most and define your work.","Just as people were starting feel comfortable that the company was on a good trajectory, another round of layoffs hit, following recent assurances from CEO, Eric Yuan, that there would be no ""company-wide layoffs"" in the future. Not sure how widespread this recent round really is, but it comes out sounding like he was mincing words to hide the truth. Since growth has massively declined and the first large round of layoffs in early 2023, resources have been tight, making it hard to get work done. The focus has shifted from security being a top priority, to just building new features at maximum speed. While this is a hard balance to strike, it has made the job of security teams more difficult."
Zoom Video Communications,5.0,"Jan 14, 2024","Recognized Excellence, Family-Oriented Culture",Service Engineer,"Current Employee, more than 3 years",,"[Disclaimer, Zoom didn't pay me or influence me to write this review]
Zoom is an ideal workplace for those who are driven and appreciate recognition and rewards. My time here has been marked by multiple recognitions and promotions. Contrary to some other reviews, I find Zoom to be a company with top-notch employees, leadership—including Eric, Velchamy, and Mu—and exceptional products/services. Despite often working late and being on-call in my role, I'm still able to enjoy quality time with my family. The parental leave benefit has been a major plus for me, and I've utilized it twice. Remarkably, during my first parental leave, CEO Eric personally called to express his gratitude for my contributions, a gesture not commonly seen in other companies. My exposure to various technologies here has significantly enhanced my career growth. To me, Zoom feels like family, and I am deeply invested in its success.",I don't have any cons.
Zoom Video Communications,2.0,"Feb 29, 2024",Hit and Miss,Engineer,"Current Employee, more than 3 years","San Jose, CA","Good compensation, good company vision, great product. Stated culture is great.","Nearly impossible to climb to higher position. Very little support for new engineers. Lots of tacit engineering knowledge. Your job is to find out who knows what, because it is very likely not documented. If you go out of your way to help customers or improve yourself, you will likely be met with criticism that another part of your work was not completed. I enjoyed Zoom when I started, but it is no longer a fun or happy place to work. The culture is no longer there. It feels like endless work with no break."
Zoom Video Communications,1.0,"Jan 29, 2024",Avoid Unless You Want To Be On [Sick] Leave,Senior Product Marketing Manager,"Current Employee, more than 3 years","Seattle, WA","Good company name for future opportunities

Smita, CPO. She knows what she's doing, but no one else does ;(","I have never worked at a company where so many people are on stress/anxiety leave. Avoid this place like the plague. 

Its a fight at the top primarily among typical tech bros with any exceptions ""fired"" or ""part of a silent layoff"".  Its basically an Eric + bro ego culture with status quo prediction on all. Zoom employees that have been there a while, or new employees that represent the Eric +bro ego profile for management. 

Management has no strategic direction, and no confidence to speak peace of mind to CEO and/or PM/ENG run company"
Zoom Video Communications,5.0,"Feb 7, 2024",Greatest SE Job Ever! - 2024 (3yr tenor),Solution Engineer,"Current Employee, more than 3 years",,"Zoom isn't perfect like every other tech company however, the leadership / culture has a genuine interest in listening to feedback and seeking to make improvements in the spirit of employee AND customer happiness. Work life balance is amazing. Comradery is some of the best I've experienced in a nearly 20yr SE carrer given, Zoom is undergoing constant growth and innovation. Grateful for this opportunity.",Fast paced. Speed of innovation can create challenges with staying on top of an expanding portfolio. Overlays help offset/augment some of those challenges.
Zoom Video Communications,2.0,"Feb 8, 2024","Poor Leaders in Charge of ""Leading"" Evolution of Zoom",Anonymous Employee,"Former Employee, more than 3 years",,"Compensation, challenging work, lots of areas to improve, product that people recognize","Leadership, lack of unified strategy that stretches across orgs/departments, lack of care for employees as people, misdirection from the CEO down on stating promises but doing the opposite."
Zoom Video Communications,4.0,"Feb 26, 2024","Growing Pains, but fun!",Account Executive,"Former Employee, more than 5 years","Nashville, TN","Fast paced, great CEO and best platform in its category.",Grew very fast and priorities within the company can sometimes be poorly communicated and rolled out.
Zoom Video Communications,4.0,"Feb 15, 2024","Great people, poor vision/leadership",Senior Sales Ops Analyst,"Former Employee, more than 1 year","Seattle, WA",There are many outstanding people to work with. Great benefits and pay.,"Seemingly always struggling for a clear vision of how to get to main goals. It's mostly just putting out fires, albeit strategically, but never ending."
Zoom Video Communications,2.0,"Mar 3, 2024",Crumbling Culture – Lost Its Way,Product Designer,Current Employee,,"Good pay and benefits, generally","The company is a mess right now. A clear lack of direction, panic, and layoffs every week. It's hard to feel stable at this company."
Zoom Video Communications,5.0,"Feb 20, 2024","Remote work, flexible work, delivering happiness",Senior Manager,"Current Employee, more than 1 year","Washington, DC","Remote work, flexible work, strong culture of care and an intentional drive to deliver happiness",Chaos in the tech industry hits Zoom as hard as anyone
Zoom Video Communications,5.0,"Feb 26, 2024",Very good company,IOS Software Developer,Former Employee,,Very happy to work for zoom.,Very sad to leave zoom by layoff.
Zoom Video Communications,4.0,"Feb 23, 2024",Great Company!,Director of Sales Operations,"Former Employee, more than 3 years","Dallas, TX","culture, benefits, work life balance, time off policy","Internal communication is contradictory at times, Certain organizations can be exclusive to outsiders (remote or not from Cisco)."
Zoom Video Communications,2.0,"Dec 4, 2023","Great product, poorly run company",Anonymous Employee,"Current Employee, more than 1 year","San Jose, CA","- Product is best in class - easy to use, reliable
- People are generally nice","- Inexperienced leaders - favor people who agree with them, bad behaviour is unadressed while strong performers are expected to pick up the slack 
- Reactive environment - no strategy, planning or prioritization, last minute decisions, constant chaos
- Speed over quality - pushed to deliver quickly instead of correctly 
- Poor work/life balance - meetings scheduled all hours of the day, chat heavy culture - responses expected immediately, constant fire drills 
- Below market compensation - salaries and benefits not competitive, increases frozen, benefits and company bonus slashed 
- Return to office - forced to go into office even though Zoom’s product is based on connecting remotely, only two weeks notice to comply, no consideration for financial or personal burden 
- Struggling culture - no budget for team building, a lot of surveying but no action taken on feedback"
Zoom Video Communications,2.0,"Sep 5, 2023",Misguided and Misaligned,Anonymous Employee,"Current Employee, more than 1 year","San Francisco, CA",The product is still great and continues to get better. Especially as an internal tool for employees.,"The company culture is terrible. People generally don’t seem to like giving or receiving it in a mature manner. Everyone is very adverse to any feedback (especially if critical). People also generally don’t understand their roles or the roles of others, which makes for really tense cross-functional partnerships. There is a lot of ego clashing. DEI is non-existent especially if you’re a person of color. A lot of micro and macro aggressions. They completely got rid of the head of DEI role and downsized that team, I’m not even sure if they have any influence at the company. Return to office policy roll out was a mess and absolutely impacted employee morale. The messaging of it also fell flat and felt disconnected from what the products do for people and what the company should stand for. Trust is at a low, but I haven’t exactly felt that since joining. Infrastructure is lacking internally, the systems and operations change often regardless of what you’re working on which makes the internal organization really haphazard. For a company that emphasizes care, they’ve been truly careless."
Zoom Video Communications,5.0,"Feb 21, 2024",Love it here!,Anonymous Employee,"Current Employee, more than 5 years","San Jose, CA",love the culture and leadership,sometimes we don't have a clear process or vision
Zoom Video Communications,1.0,"Jan 27, 2024","Worst Job I've Had, in the Worst Company I've Worked For",Anonymous Employee,Current Employee,,"Pay and benefits are competitive, despite benefits and perks being chipped away over the past couple of years","The company is run like a dictatorship, with everyone running scared of Eric, including the ""yes men (and women)"" that Eric has surrounded himself with. Many companies put profits before their people, but Zoom does so at the same time it claims to ""care"" for its employees. It is a toxic culture. Zoom was once a great place to work, but not anymore, at least not for those in support roles. Don't believe the positive press you might read about working at Zoom - the company does a masterful job of controlling the narrative outside its walls. It's an awful place to work and it seems to be getting worse."
Zoom Video Communications,5.0,"Feb 19, 2024",Great place to work,Anonymous Employee,Current Employee,,I enjoy the flexibility and culture,Things change often and very quickly
Zoom Video Communications,3.0,"Mar 4, 2024",Meh,Cloud Operations Engineer,"Former Employee, less than 1 year","Raleigh, NC","Cool people, cool product. Company perks were nice while they lasted",So extremely disorganized as a company. People were put into roles they were not hired for
Zoom Video Communications,5.0,"Feb 21, 2024",Data Analyst,Data Analyst,Former Employee,,Friendly environment and work-from-home setup.,Time difference and online spacing.
Zoom Video Communications,5.0,"Feb 13, 2024",Great Company,Sales Representative,"Current Employee, more than 3 years","New York, NY","Very fair, employee and customer focused, innovative is off the charts",Still working through some growing pains
Zoom Video Communications,3.0,"Feb 17, 2024",CCP-style leadership,Anonymous Employee,Current Employee,,"It paid reasonably well, while it lasted.","This is a Chinese company and its management style reflects the fact that in China, every big company is run in an oppressive way and under the supervision of the CCP, with most demanding ""996"" i.e. 9 am to 9pm, 6 days per week. CCP culture is imposed on Chinese companies including Zoom and is manifested in the (mis)management style."
Zoom Video Communications,3.0,"Feb 16, 2024","not sure where the company is heading, wasted potential",Machine Learning Engineer,"Former Employee, more than 1 year","San Jose, CA","- you get paid, there's work to be done
- decent WLB, but that also depends on your team","- hypocritical management and CEO
- tries to copy everything microsoft does with very poor execution
- throws AI at everything without a clear mission
- salary increments and bonus cuts in the last few years despite large amounts of cash in the bank"
Zoom Video Communications,3.0,"Mar 1, 2024",Big tech,Designer,Former Employee,,"Smart co-workers, great people to work with","Long hours, stressful, unrealistic expectations"
Zoom Video Communications,4.0,"Feb 7, 2024",Fantastic place to work,Anonymous Employee,Former Employee,,"Great place, great people, lot of talent to learn from","no work life balance, no growth"
Zoom Video Communications,4.0,"Jan 22, 2024",Really great place to work,Account Executive,"Former Employee, less than 1 year","Atlanta, GA","Great benefits, unlimited PTO, pretty easy product to sell","you are just a number, they did layoffs when I was there and essentially my whole team got laid off. Hard to keep up with all of products being released"
Zoom Video Communications,3.0,"Jan 29, 2024",Many Redundant Senior Managers increases the operation cost,Anonymous Employee,"Current Employee, more than 3 years","San Jose, CA","Good product, try to do transformation to AI fields",Zoom hires new more senior managers and Heads for showing determination of AI transformation but cover those incompetent management under them. Those redundant management hires are costing Zoom a lot of money without making much contribution due to their previous failures but CEO won't let go of them. That's probably one of the reasons why Zoom's layoff reflects almost nothing on the stock.
Zoom Video Communications,2.0,"Oct 2, 2023",Genuinely The Worst Company I've Ever Worked For,Enterprise Account Executive,"Current Employee, more than 1 year",,My individual team was great. Misery loves company and we kept each other going during so many horrible times. The company was so clueless that a lot of times we just got to laugh together.,"As the title suggests, in my entire career, Zoom was without a doubt the single worst company I have ever worked for. The C-suite leadership clearly has no idea what they are doing. The company was never going to amount to much as of late 2021, but obviously the pandemic boom made it a household name where it never deserved to be as such. The market then expected growth to continue so leadership scrambled to create new products that are absolutely laughable compared to what's best in class in that segment. Webinar, chat, ZoomIQ (LOL), and anything outside of core meetings is a half-asses attempt at minimally viable product. Good luck if you're in sales and expected to put your own reputation and professional clout on the line representing these pathetic products out in the market."
Zoom Video Communications,5.0,"Feb 3, 2024",Good ,Software Engineer,Former Employee,"Washington, DC",Good not a bad company to work with,Partial not a bad company
Zoom Video Communications,1.0,"Jan 30, 2024",Titanic circling the drain....,Anonymous Employee,"Current Employee, more than 3 years",,Decent salaries/stock options (when they actually had a nice stock price),"Dictator CEO that pretends to care, but only wants people to say ""yes"" to whatever he wants - any disagreements get you pushed out
No strategy/vision - CEO only responds to whatever the wind blows in his ear that day/minute/etc. - it's constantly changing so who even knows what his grand plan is supposed to be
Terrible, horrible, no good managers that have NEVER led teams and NEVER worked in corporate environments and they favor those that remain silent and/or agree with them at all times
COO is a complete moron and only cares about how she looks on social media and her money - no clue how she was promoted to the level she's at, but she is incompetent and a liar about anything/everything she says - do not trust her or the CEO
Pretend culture of care, but then telling people to RTO or leave and then trying to back peddle on All Hands - let's make a product that is specifically designed for remote work and then not use it - yes, that makes tons of sense
None of the departments work together well so people are all over the place without any clear understanding of why they are doing the busy work they have been tasked with doing
Bloated in many areas but short-staffed in others - they actually cut the marketing team because the CEO believes he understand branding and marketing - check out that horrible playoff commercial if you need proof of his bad decision making in that area
Benefits have been completely stripped or wiped to the bare minimum so the only real thing they have is the salary and stock options, but I don't think that's holding most employees over as much as they think
So many lies from the leadership team and then they claim to have said something else when called out by the entire company - again, don't believe or trust any of them as they are self-centered and not self-aware"
Zoom Video Communications,2.0,"Feb 27, 2024",No,Sales Representative,Former Employee,,Great ramp period for reps,Alot of managers but not enough leaders
Zoom Video Communications,4.0,"Feb 1, 2024",Too much overwork,Senior Java Developer,Current Employee,,"Good culture
A lot of benefits
Nice CEO","Too much overwork
Product renew is not clear"
Zoom Video Communications,5.0,"Jan 16, 2024",Huge potential,Sr. Software Engineer,"Current Employee, more than 10 years","San Jose, CA",You can have the best experience at the worldwide No. 1 company,Busier than ever. This may be an advantage or a disadvantage.
Zoom Video Communications,2.0,"Feb 23, 2024",A lot of grinding,Product Marketing Manager,"Current Employee, more than 3 years","San Jose, CA",100% remote work; flexible pto,Difficult to nearly imposible to keep up with expectations
Zoom Video Communications,4.0,"Jan 29, 2024",Interesting place ,Software Engineer,Former Employee,"San Jose, CA",Ok salary ok benefits and nice team,Don’t see a lot of career growth
Zoom Video Communications,5.0,"Jan 29, 2024",Zoom,Software Development Engineer,Current Employee,"San Jose, CA","Flexible, friendly people, great team, benefits","Long work hours, hectic at times"
Zoom Video Communications,5.0,"Jan 23, 2024",Good,Software Engineer,"Current Employee, more than 1 year","Seattle, WA","Team, co-worker, management are all good",work life balance needs to be improved
Zoom Video Communications,4.0,"Jan 19, 2024",Good,Anonymous Employee,"Former Employee, more than 3 years",,Good company- good culture for tech company,Too many middle level managers who don’t do anything
Zoom Video Communications,4.0,"Jan 17, 2024",Good Salary,Senior TPM,Current Employee,"San Jose, CA",Good salary for engineers fast moving company,"Leadership think management layer is not needed, that will a problem is future"
Zoom Video Communications,5.0,"Jan 16, 2024","Great company, excellent benefits",Technical Project Manager,Former Employee,"Austin, TX","Remote work, work life balance, good benefits",Remote can be a challenge for some.
Zoom Video Communications,1.0,"Feb 13, 2024",Not a good time to join,Customer Success Manager,"Current Employee, more than 3 years","Los Angeles, CA",There are some good people (outside of leadership) here and lots to learn.,Leadership is terrible and don't trust them further than I can throw them.
Zoom Video Communications,5.0,"Jan 3, 2024",Great Place to Work,Account Executive,"Current Employee, less than 1 year","Charlotte, NC",We use the technology and its unmatched,Nothing I can think of in the past year
Zoom Video Communications,3.0,"Feb 11, 2024",Okay place to work,Analyst,Former Employee,"New York, NY",Inclusive culture and nice people,Very chaotic organizational structure and no clear career growth structure
Zoom Video Communications,5.0,"Jan 9, 2024",Good company,Sales Analyst,"Current Employee, more than 1 year","San Jose, CA",Cutlure great and the people are nice,No cons really. I don’t like rto
Zoom Video Communications,4.0,"Jan 9, 2024",Mid Market,Account Executive,"Former Employee, more than 1 year","San Jose, CA","Good benefits, no real growth",Very difficult to transition - stock is not the best
Zoom Video Communications,4.0,"Jan 9, 2024",Great Culture,Sales Associate,"Current Employee, more than 3 years","Denver, CO","Stock options, flexible work, great leadership",Wokeness of a typical Silicon Valley tech company
Zoom Video Communications,4.0,"Dec 10, 2023",Good Company and good products,Solution Engineer,"Current Employee, less than 1 year","Portland, OR","Good products and internal systems. IT, HR is all very organized and benefits are good.","Very chaotic, leaders do not give clear ideas of what teams do what, high performers are heavily used while poor performers are allowed to hide."
Zoom Video Communications,1.0,"Feb 21, 2024",They have no money...run,Sr Deal Desk Analyst,"Former Employee, less than 1 year","Atlanta, GA","Unlimited PTO, book reimbursement, and the people are nice.",They are in way over their heads.
Zoom Video Communications,4.0,"Jul 12, 2023","great company, growing pains",Account Executive,"Former Employee, more than 3 years","Denver, CO","If you do well, you have the chance to have a great work life balance. Benefits (healthcare, UTO, and maternity/paternity leave) are the best I've experienced yet, and you'll get to work with and learn from a lot of experienced and kind people. My 4 stars are mostly stemming from the people I've worked with, and my first 3 years at the company. This score is not fully reflective on how things are now.","They are experiencing a lot of growing pains and there were a handful of recent changes made in the past year that were hard to agree with. This includes: letting go of 1,300 people, micro managing around KPI's, removing AE's ability to create their own email sequences in outreach, removing ability to discount or give free months (when our biggest competitor is free), taking away phone specialists (and turning them into AE's), and a disconnection between teams (CSMs, Support & sales engineers)."
Zoom Video Communications,5.0,"Jan 3, 2024",Work at Zoom,Sr. Technical Program Manager,"Current Employee, more than 1 year","Fort Lauderdale, FL","Company Culture, Pay Structure, Stock RSUS",Zoom has over hired and is trying to align headcount
Zoom Video Communications,5.0,"Jan 5, 2024",Amazing Culture,Account Executive,"Former Employee, more than 3 years","Denver, CO",Eric Yuan truly cares for his employees.,Low salary and commission structure
Zoom Video Communications,5.0,"Dec 27, 2023",Great Place to work,Product Portfolio Manager,"Current Employee, more than 5 years",,fast paced technical environment. Great place to work,Remote work means you are not always near a large group of employees.
Zoom Video Communications,5.0,"Dec 5, 2023",Fantastic Company,Technical Account Manager,"Current Employee, more than 5 years","Overland Park, KS",Zoom has a good work/life balance and an employee focused culture. Overall it's a good working environment.,There have been some shifts in the work culture focusing more on the shareholder value than on employee satisfaction
Zoom Video Communications,5.0,"Dec 21, 2023",Great company,Software Engineer,"Current Employee, more than 5 years","San Jose, CA",Product is superior and there will only need 2 days in the office.,Stock price was flat last year.
