Company Name,Overall Rating,Review Date,Review Title,Job Title,Job Details,Location,Pros,Cons
Unity,4.0,"Jul 25, 2023","Amazing benefits, serious organizational challenges","Manager, Business Development",Former Employee,,-Incredible benefits and work culture -Excellent pay -Exciting industry and solutions -Amazing people,"-a LOT of instability: your job function and expectations are probably going to change a lot. They went through 3 major restructures in 2 years. -They grew too much too quickly; this causes a lot of redundancies, confusion, siloed teams, complexity, and greater potential for layoffs. -Extremely complex team structure/support (i.e. probably 6 different marketing teams and functions, same with HR) -It is not your typical sales motions or expectations. It's a very unusual sales org. Not many people were achieving quota."
Unity,2.0,"May 4, 2023",Impactful career in the games industry combined with disconnected CEO and Leadership,Anonymous Employee,"Current Employee, more than 1 year",,A great place to create big impacts in the video game industry. Lots of very talented and smart people to learn all aspect of creating interactive experiences. Variety of projects means you don't get bored solving the same problems every time.,"Since I've joined, they have cut many of the benefits that have made this job great. Initial layoff wave came with cut wellness benefits. Third layoff wave was the biggest layoff in the history of the company, coming at a time with the highest record profit in the history of the company. Additionally, they are now trying to force a Return To Work policy along with several rash unpopular decisions."
Unity,3.0,"Oct 23, 2023",Ok company,Data Enginner JR,"Current Employee, less than 1 year","San Francisco, CA",Career growth if in a good team; Not too difficult to get pass the interview rounds;,Management not really good; Pay not good enough
Unity,1.0,"Jul 6, 2023",Toxic and untrustworthy (zero stars),Anonymous,"Current Employee, more than 1 year",,"There are definitely a lot of kind and very smart folks at Unity, unfortunately they are rarely in positions of power in which they could right the ship. Though, many of the good ones have quit or been cut through layoffs (this has created huge knowledge gaps that directly impact the business).","Very untrustworthy leadership - 3 rounds of layoffs, constant reorgs, no stability and no accountability on their part. The vision coming down from up high changes frequently, disrupting teams who do actual work. Most troubling is a serious communication and trust problem coming from the top down - different teams have conflicting information (or no information) about the directive du jour. It’s a toxic, clique-y company to work for and employees learn to trust no one, and is is truly not a healthy work environment."
Unity,4.0,"Oct 23, 2023",Good company with great worklife balance,Software Engineer,Current Employee,"Bellevue, WA",awesome work life balance interesting work,low stock value mgmt change
Unity,5.0,"Oct 10, 2023",Great company,Senior Engineering Manager,Current Employee,"San Francisco, CA",Empowerment Great environment Ability to make impact,Some late events has caused some moral issues due to leadership but all solvable.
Unity,4.0,"Oct 4, 2023",Leadership unsure where to go with company,Software Engineer,"Former Employee, more than 1 year","Bellevue, WA",- Great teammates - Passionate employees all around about the product,- Leadership unsure which direction to take with product once it doesn't show immediate revenue
Unity,5.0,"Sep 14, 2023","Great place, but still maturing",Sr Communications Manager,Current Employee,,"Benefits, people, leadership (mixed), company values.","Culture needs work: bullying over slack in public forums by lower and mid-level employees, WAY too much churn on conversation and not enough focus on great work, employee entitlement, communication gaps between levels."
Unity,3.0,"Mar 24, 2023",Man this place is a dumpster fire,Senior Marketing Manager,"Former Employee, more than 1 year",,"There are some really good people at Unity who are really passionate and strive to do the right thing. The core product, the Unity Engine, has an enviable place in the gaming world (for now). There is a lot of goodwill that goes along with it.","The company continues to be at war with itself. Is it a gaming company? Is it a mobile company? Is it a US company? Is it an enterprise company? The management has no idea. They talk a big game, but the reality is little transparency, constant reorgs and blindingly foolish decisions. So many people are out of touch with the core game developers. They make plans and give presentations to think they are making the right decisions, but it's all for show."
Unity,3.0,"Oct 6, 2023",Upper management has issues,QA Manager,Current Employee,"Orlando, FL","Great at the lower level team, strong collaboration community.",Upper management stifles growth and the circle around the CEO
Unity,3.0,"Jul 13, 2023","Great Team, Poor Executive Leadership",Senior Software Engineer,"Former Employee, more than 1 year","Austin, TX","Great WLB, promising tech, it was super cool to work and see early stuff and feel like you have an impact on tech choices","Constant reorganizations, we had 3 in 10 months, the company can’t properly commit to a vision and will constantly thrash."
Unity,4.0,"May 20, 2023","Still a good company, but not the company it was",Senior Product Manager,"Current Employee, more than 8 years","San Francisco, CA","The company has a good culture and a decently strong moral core. Lots of smart, friendly people to work with. Lots of exciting, interesting projects.","Has replaced not enough process with too much process. Hard to get things done. Much of this is being addressed on the engineering side, but it's a significant problem on the business side. It's become very difficult for the company to innovate and then successfully productize those innovations."
Unity,1.0,"May 8, 2023",Things keep getting worse and worse.,Anonymous Employee,"Current Employee, more than 1 year",,Used to have good work life balance and culture. Office has catered lunches (for now.),"Just a complete mess. Executives have no idea what they are doing, speak in buzzwords with no coherent vision. Nothing is ever done properly at unity, they couldn’t even get us our tax slips in a reasonable amount of time. Three rounds of mass layoffs in a year, share price that keeps tanking and there’s no accountability for the executives. Benefits have been slashed, remote work limited and unexplained delays to the compensation cycle. The execs make horrible company-ruining financial decisions and just collect millions of dollars while laying people off, taking away our benefits and running the company into the ground. The CEO is completely out of touch and can barely string together coherent sentences. It’s almost hard to believe someone could be so incompetent. Communication is utterly horrendous. The Rumor mill is insane and the worst rumours always end up being true."
Unity,1.0,"Nov 1, 2023",Changed,Executive Assistant,Former Employee,"San Francisco, CA",good benefits and great people to work with,not a lot of growth opportunities
Unity,4.0,"Sep 20, 2023",Good,"Sr, Growth Partnership Manager",Current Employee,,"Good peer culture, competitive benefits","Half of the management and decisions are made remotely from US, and the culture has a learning curve"
Unity,5.0,"Sep 20, 2023",Great workplace for parents,Team Leader,"Current Employee, more than 3 years","Israel, TX","amazing people, place to grow and involve your career and work on great challenges.",Can't find something too negative.
Unity,4.0,"Jun 24, 2023","Talented coworkers, questionable leadership",Senior Software Engineer,"Current Employee, more than 3 years","Los Angeles, CA",Coworkers are first class and dedicated Lots of different projects to work on Good career growth,"Management will cut any project that doesn’t make money (along with the staff). No investment in infrastructure, only in profitable services. Employee morale and belief in the company’s future is currently low."
Unity,3.0,"May 15, 2023",They told me not to comment on glassdoor,Doesnt Matter,Former Employee,,I want you to know that my separation papers included a promise not to say anything negative about them including on Glassdoor. Glassdoor you need to know this is happening .,See pros this is really not good.
Unity,3.0,"Sep 17, 2023",Going in the wrong direction,Software Engineer,Current Employee,"Houston, TX",Culture is good and teams are nice,Disorganization throughout entire company. Feels bad
Unity,5.0,"Jan 24, 2023",Getting Started at Unity,Professional Training Manager,"Current Employee, less than 1 year","Austin, TX",- Onboarding provided just the right amount of info and meetings - Different events and resources are shared to encourage you to meet others - Very kind and supportive colleagues - very approachable - Amazing products that inspire you with endless applications and possibilities - Manager tools and resources shared with me during first week - Conscious effort to improve employee experience even during difficult times - Good focus on wellbeing and respect for life outside of work - Clear roles and responsibilities balanced with flexibility to define your career,- Remote and hybrid working means you don't see many people in the office but hopefully this continues to change and becomes more balanced - especially important during onboarding when you're trying to establish yourself in a new company
Unity,4.0,"May 15, 2023","The people are amazing, the community is amazing, just no one wants to organize anything and they hire to many",PubOps,"Former Employee, more than 1 year",,Amazing work-life balance Amazing benefits Amazing community Amazing resources,So many documents are so outdated that they present to customers They lied about no more lay-offs. They say they wish they did not have to lay off 2000+ employees in 10 months when they said they would not be doing this again.
Unity,3.0,"May 31, 2023",It was a roller coaster ride,Technical Writer,"Former Employee, more than 3 years","San Francisco, CA","The company had outstanding benefits, gorgeous offices with all the extras, fantastic technology, and super coworkers. Unity truly walks the walk on diversity EXCEPT see my advice to management. Unity had many Employee Resource groups and seemed to truly care about issues for LGBTQ+ , about inclusion. And I saw some great promotions happen to folk from diverse groups.","Career growth can be stunted, arbitrary, and controlled by gatekeepers. Your chance of getting promoted is directly linked your luck in who happens to be your manager. It's very hard to get out of a bad manager situation and get into a new role or group with a new manager. Also they downgraded salaries if you went remote. The salary I am listing is from San Francisco."
Unity,4.0,"Sep 7, 2023","Great job, no vision",Product Manager,"Former Employee, more than 1 year","San Francisco, CA","Work life bonus, exposure, lots of opportunities","changing priorities, lack of clarity, no focus"
Unity,2.0,"Jan 21, 2023","Used to have a values-based culture, but C Suite is not upholding these anymore",Senior Software Engineer,"Current Employee, more than 5 years","San Francisco, CA","Opportunity to work on a game engine in the gaming industry. Probably less competition internally than some companies, which can be good to get some experience in areas you want to grow.","Like a lot of companies, as we've scaled out our company, senior leadership has not been able to retain strong values but rather continually breaks trust with employees and seems very disconnected from caring about folks. Lots of fluffy word that seem insincere. Non-competitive salaries They just cut our wellness benefit, two days after a layoff and after we started the year and made financial commitments assuming we'd have it. Sending big impact news via emails instead of having a meeting with the employees. Executives encouraging everyone to RTO, but they are not actually showing up to the office"
Unity,5.0,"Jul 5, 2023",Great experience during entire hiring process,Senior Product Manager,"Current Employee, less than 1 year","Austin, TX",Unity is a great company with really smart people and good benefits. The entire hiring process was smooth and transparent. Recruiter with whom I worked was super supportive and responsive throughout the process. Everyone on the team really wanted to know about me.,None. Payscale is slightly lesser than FAANG companies but overall it’s competitive.
Unity,1.0,"May 4, 2023","Messy, disorganized, and ambiguous",Anonymous Employee,"Former Employee, less than 1 year",,"Large company, so you would think it’s stable. Compensation is fair for the work done, but most of it is stocks. Work life balance is also generous as well depending on which teams you work for and where they’re located. In general all my colleagues have been very motivated and engaged and generally want the best for the product and the company.","Layoffs after layoffs in the last six months I’ve been here. Inconsistent as well, some layoffs have rehoming which means they were well thought out, but some didn’t. Inefficient decisions: I know of at least one position removed due to redundancy and then rehired. Internally there’s no real processes so efficiency was low."
Unity,3.0,"Aug 27, 2023","Good work life balanbe, clueless leadership",Software Engineer,"Current Employee, less than 1 year","Bellevue, WA","Good Work life balance, Great culture","Leadership at the top is clueless, Low compensaition"
Unity,3.0,"Jul 27, 2023",Not a great place,Marketing Specialist,"Current Employee, more than 1 year","Bellevue, WA",Layoffs for impact driving people. Management is scattered and doesn’t care about employees. Stock is too volatile.,Refer to the pros to see the cons. No pros here.
Unity,4.0,"Aug 29, 2023",Good place to work,Accountant,Current Employee,"Bellevue, WA",Good CEO. RSU is nice.,Could avoid layoffs to keep morale higher
Unity,5.0,"Dec 21, 2022","I’d give it a solid 9/10, but no half star option",Senior Technical Recruiter,"Current Employee, more than 1 year",,"A true sense of team on my recruiting team. Compensation and benefits are very good, imo; there is a heavy weight on equity but I’m happy with my base salary. PTO is solid. First recruitment org where I feel the overall theme is highly-collaborative. This company is a dream compared to my last recruiting agency (low ego; good people and great recruitment management). Minimal meetings/micromanagement; I’m trusted to own my own book of business which feels good.","Restructuring this year; ambiguity on headcount. Some may struggle with this, but be ready to recruit for *anything* (you’ll support whatever the business needs at that time); need to be okay with being pushed to source/recruit on new profiles constantly; some learning curves Internal cross-functional processes could be improved between HR/finance/recruitment."
Unity,5.0,"Feb 23, 2023",Love working at Unity!,Senior Partner Engineer,"Current Employee, less than 1 year","Carmichael, CA","Very helpful people, easy access to just about anyone in the company, fun culture, very diverse and accepting, zero micro managing, everything I do feels very fulfilling and feel there is tons of way I can grow in this position.",I would say be ready to be overwhelmed by lots of information. It is just the nature of the beast! The company is massive with tons of products. I wouldn't really call this a con but just something to be aware of. Over time you will become more familiar with it all but at first it will be a tad bit frustrating.
Unity,1.0,"May 4, 2023",Run the other way - you can do better elsewhere,Anonymous Employee,Current Employee,,Beautiful offices. Really good mental health benefits.,"Antiquated out of touch thinking from Leadership. C Suite has run this company into the ground worshipping on the altar of quarterly earnings. Third round of layoffs in a year with no impact on the bottom line. Layoffs were automated through emails. If an affected employee wanted to talk with a human being, they have to fill out a request form. Severance was pitiful from what I’ve been told. The “values” are a joke particularly the oft cited “in it together” which should be reframed to “in it for myself”. Benefits are cut, RTO is being forced starting September, offices closed."
Unity,1.0,"Jun 12, 2023",Going public sent company down a different path.,Senior Software Engineer,Former Employee,"San Francisco, CA",Some of the employees and engineers are amazing. Some of the incredible talent that made Unity what it is are still there.,"As a long long time Unity user, nearly since version 1 of Unity, I was super excited to work at Unity. Unity always stood out as a company for the indie devs, your ally, your partner, to help you get past all the barriers in the industry that small players face. But I think ever since it went public it has gradually eroded into a pure profit growth driven business. Leadership cares about nothing more than what will get stock to go up in the short term. They've hired so many people from other Big Tech Corporations trying to essentially colonize original Unity culture with Big Tech Corporate process and culture, and they are winning. Many Unity originals, Engineers that have been there since the beginning have left. They pushed out Joachim, the original CTO, the last Unity original and real engineer on C-Suite, so literally Unity leadership has been entirely usurped by non-engineer business types. The only places still managing to do anything good are those places with very high level engineers that still have substantial political weight to throw around and happen to be in a stream that can be argued to make the stock price to go up short term. But increasingly they must fight against pure business side that greatly outnumbers them with free time to play the bureaucracy game. If the narrative about their effort affecting stop price changes, they will be rug-pulled fast. Being an engineer that can do anything of value is like sitting in a middle of a circus. They are cycling through managers and product people just trying to find anyway to milk any more cash from anything in the short term. They have even in the past year started to cannibalize some of their own customers. Unity isn't even a good company to partner with anymore, the relationship will be predatory and extorting, tuned for short term stock inflation however possible. It's a sad thing but I think its just the fate of any successful tech company. The engineers build something of value. Gradually the company hires more and more business people until they overtake the company, then a company once driven by engineers and engineering innovation is now driven by excel spreadsheets trying to get the stock price to go up however it possibly can to let the current round of business people to get a decent cash out on their stock options before jumping companies again every 3-ish years or so. Even worse, in recent months in response to sweeping corporate policy changes, they've actually taken to firing people on the spot who disagree with leadership. A few of these got out in the news, but there have been dozens of them. They were not all justified. Internal slack and communication has become much more shut down compared to what used to be a very open and communicative company. Increasingly it is only ""Yes Men"" saying anything out in the open. The business crowd that's usurped all controls of the company are playing a hard ball game of thrones with power. A bunch of engineering illiterate suits super super paranoid that people will figure out what they are and call them out on it are now sitting at the top terrified, trying to milk whatever nonsense they can for another stock payout or bit of nonsensical media attention."
Unity,1.0,"Sep 22, 2023",Crashing,Product Manager,Current Employee,"San Francisco, CA",good product team structure and product leadership,current changes and chaotic merge happening
Unity,2.0,"Apr 7, 2023",Bad,Software Engineer,Former Employee,,"Don’t know, food? Company name?","Very chaotic environment, no leadership, no direction. All work planned can get no where since the core is not strong. Distracted due to greediness — try to expand to area where it is not good at. Just focus on game please, focus on the engine. Stop all the crap nonsense. Hiring a team to nail the work that has no market proof. Another wrong example of using software can achieve things without very low cost —greediness. Lack of leaders. There are a lot of engineers of course, but no tech lead in general. Do not expect much training/learning."
Unity,5.0,"Jul 22, 2023","Great established company, little bit of start up culture",Software Engineer,Current Employee,"San Francisco, CA",Ability to grow in my role,mandatory back to office is killing the vibe
Unity,2.0,"Feb 28, 2023","Great at first, terrible in the end",Senior Business Systems Analyst,"Former Employee, more than 1 year",,"Good benefits, free! Connect days (free days off chosen by management). 3 weeks vacation and 1 floating holiday week. Free $$$ towards health. Lots of regular holidays.","Terrible leadership, specifically in IT. No real plan for the future. Leadership on the IT side does a poor job of management and it shows as you go down the ladder. The people who understood the company and its people were pushed out by the new CIO. More work with less people and less pay. That's how IT is right now."
Unity,5.0,"Jul 23, 2023",Loved working at Unity,Executive Assistant,Former Employee,"Florida City, FL",Flexibility to work from home. Built great relationships with amazing people.,Did not have any negative experience
Unity,2.0,"Jul 20, 2023",Constant change,Sales Representative,"Current Employee, more than 3 years","Denver, CO",Great potential and interesting tech,"Upper management doesn't seem to have a clear vision. Constant reorgs, no stability, no vision or cohesion. Very political."
Unity,4.0,"Jul 27, 2023",Good company,Technical Recruiter,Current Employee,,Great environment and team culture,Return to office and confusion around policies
Unity,2.0,"Jul 26, 2023",Unity Ad Sales AE,Account Executive,"Former Employee, less than 1 year","San Francisco, CA",Some of the best products around.,Hitting goal does not matter; it is a numbers game.
Unity,1.0,"May 11, 2023","Terrible leadership. The titanic, avoid at all costs.",Software Engineer,"Former Employee, more than 1 year","San Francisco, CA","At Unity, it really depends on your manager when it comes to work-life balance. Some managers are really good about it, while others... not so much.","- The company's leadership team has demonstrated consistently poor communication skills, resulting in a lack of direction and confusion among employees. - Benefits have been frequently removed, making it difficult for employees to rely on them. - Employees have even experienced pay decreases in the form of lost monetary benefits and pushed back promotion cycles - The culture promoted by Unity's leadership feels disingenuous and is only prioritized when it aligns with their agenda. - Unity lacks a clear company direction and has shown a lack of focus, jumping from one thing to another. - High-level management has been ineffective and detrimental (calling people f**** idiots) in engaging with the public and making decisions in good faith. - Team siloing is a persistent issue, creating a lack of collaboration and communication among departments. - Instead of dealing with the issues causing siloing and duplication of work, leadership just cuts the duplicates and continues to let the reason why the problem happened unaddressed. - The company has undergone constant restructuring, which damages productivity and established relationships among employees. - Unity has laid off individuals with years of experience, resulting in a loss of deeply knowledgeable employees with institutional knowledge. - Unity has shown a persistent dismissal of valid concerns and a tone-deaf approach to messaging. - Unity consistently prioritizes punishing people for how they criticize things. Instead of being concerned that frustration has reached a boiling point, they are easily distracted and emotional with how things are conveyed. They fixate on how a message is delivered and don't focus on the content of the message. - They frequently operate around feelings and emotional trends, and not data. - With trends company has a demonstrated history of chasing trends, for example, the metaverse and now AI"
Unity,2.0,"Mar 27, 2023",So much squandered potential,Sr Manager Software Engineering,Current Employee,,Smart execs. Smart engineers. Strong vision for the future.,"Middle management (GMs, Directors) is complete chaos. <<< this is the problem area Worldwide company that seems to have payroll and tax issues in most jurisdictions outside the US at least from time to time. The supporting systems are just a mess. Constant reorgs. Over reliance on business segments like ads and multiplayer hosting that until recently have obscured poor performance in most other segments in the company."
Unity,4.0,"Jul 18, 2023",Good pay,Global Leader,"Former Employee, more than 3 years","San Francisco, CA","Great Company, People, and my Leader",Not with the company anymore.
Unity,5.0,"May 22, 2023",Sales of real-time tools. The world is a better place with more creators in it.,Sr. Client Partner,"Current Employee, more than 1 year","Burbank, CA",Great people. Good Salary. Great Benefits.,Moving from Expansion and Growth to Profitability causes some growing pains.
