Company Name,Overall Rating,Review Date,Review Title,Job Title,Job Details,Location,Pros,Cons
Optimum Solutions,5.0,"Sep 25, 2023",Great,Administrative,Former Employee,"New York, NY",Very great please to work,I would like for it to be remote
Optimum Solutions,4.0,"Oct 9, 2023",Nice company,SAP Consultant,Former Employee,"Bethpage, NY",Laid back environment. People are nice,WFH option restricted but People over there are helpful
Optimum Solutions,4.0,"Dec 28, 2022","Responsible candidate for work which requires more professionalism, communication,",Oil Engineer,Current Employee,,This company supplies internet service. That was my temporary job while I was looking for a much better job.,"Needs to pay attention for employee’s education, experience, skills and abilities."
Optimum Solutions,5.0,"Jan 12, 2023",Salary,Business Analyst,Current Employee,"Philadelphia, PA",Optimum is an excellent place to work. Management is very supportive,It's hard to grow with small companies as one isn't fully utilized to It's full potential
Optimum Solutions,4.0,"Aug 26, 2022",Great company overall,Anonymous Employee,"Former Employee, more than 1 year",,"welcoming culture, friendly people, good growth opportunities","a bit bureacturic, things can go slow"
Optimum Solutions,3.0,"Jun 8, 2022",There’s a click present!,Licensed Vocational Nurse (LVN),"Former Employee, more than 1 year","Springtown, TX","Residents, Pay, Available Education, Therapy team","Management, Benefits, Administrator/HR, Micromanaging, Unorganized"
Optimum Solutions,5.0,"Apr 28, 2022",good,Anonymous Employee,"Current Employee, more than 5 years",,good to say about it,not bad to say about it
Optimum Solutions,5.0,"Jan 8, 2014",Financial Analyst,Anonymous Employee,"Current Employee, more than 5 years",,Federal Contractor with assignment at GSA for the last 7 years at NCR Washington DC,"it was good, but my assignment always were at General Service Administration GSA"
Optimum Solutions,4.0,"Dec 18, 2016",Virtual Dispatch Operator,Anonymous Employee,Current Employee,"Bronx, NY",Job is consistent and repetitive so it is easy to do.  Job is very technical.,Things keep changing and the is not a bad thing because everything changes.  But when everyone is not on the same page that causes confusion.
Optimum Solutions,3.0,"Jul 11, 2017",Good benefits,Anonymous Employee,Former Employee,,"There are good benefits, discounts at many locations, free internet, tv and phone service ,  competitive pay and alot of overtime available",Your schedule would change every 6 months
Optimum Solutions,4.0,"Apr 21, 2016",Account Executive,Anonymous Employee,Former Employee,,"Excellent Team, great to work for",Leads need to be shared fairly. Favorites are obvious
Optimum Solutions,3.0,"Apr 2, 2020",Great company,Administrative Assistant,"Current Employee, less than 1 year",,"Higher than usual rate salary, very professional staff","I can't think of any downside, purely positive feedback"
Optimum Solutions,2.0,"May 23, 2021",Great Company,General Manager,"Former Employee, more than 1 year","Ocala, FL","Great Company , Great Benefits , Room for advancement","None great company, They treat you well"
Optimum Solutions,2.0,"Mar 10, 2024",Before joining as recruitment team?,Talent Acquisition Manager,"Current Employee, less than 1 year",Bengaluru,Quite ok ok with Apac team,Some office within company be careful
Optimum Solutions,4.0,"Mar 4, 2024",Good place to work,Senior Applications Consultant,"Current Employee, more than 1 year",Singapore,"reachable to hr persons 
good salary",there is no big difference even though they they provide a perm role.
Optimum Solutions,1.0,"Jan 6, 2024","Bad company, does not treat it's employees with respect",Developer,"Former Employee, less than 1 year",Singapore,Only good thing was the monthly pay,"Was approached to join the company with the promise that the position is a permanent role with a minimum 1 year with the client. Was also told that they have many clients to move us around to should contract end with clients.

All lies as was terminated within a week of joining when client and Optimum could not agree to extend the contract (contract with client was not in fact a year as promised when joining). 

Company did not bother to look for other clients for the team to join and just terminated us and wanted us to finish the project in the 1 month notice.

Was not treated fairly or with any respect throughout the whole thing.

No bonus, below average annual leaves, basic insurance for employees."
Optimum Solutions,3.0,"Feb 26, 2024",Ok,Software Developer,Current Employee,Singapore,"Salary
Salary 
Salary
Salary
Salary",They will say one thing and do one thing
Optimum Solutions,4.0,"Feb 21, 2024",Good but not great,Senior Java Developer,"Current Employee, more than 1 year",Chennai,Pay might be as per standard,No job security. No transparency.
Optimum Solutions,3.0,"Feb 22, 2024",Good,Test Engineer,Current Employee,Chennai,Employee friendly and its Environment in Good,No concern for me in this organisation
Optimum Solutions,4.0,"Feb 16, 2024",Good experience,Senior Consultant,"Current Employee, more than 1 year",Mumbai,"It was a great experience working with Optimum, professional and cooperative employees.",Not sure if you will get something once your contract is over.
Optimum Solutions,4.0,"Feb 18, 2024",great,Consultant,Current Employee,Singapore,good benefits and compensation package,hr took to long to reply
Optimum Solutions,1.0,"Feb 25, 2024",Worst management,Mobile Developer,"Former Employee, more than 1 year",Singapore,Dont expect any pros from this consultancy,They dont care about employees well being. There will be no proper response from HR.
Optimum Solutions,5.0,"Feb 6, 2024",Great,Trainee-Data Analyst,"Current Employee, less than 1 year",Bengaluru,All Employees are cooperative and positive work environment,there is no cons nothing
Optimum Solutions,5.0,"Jan 18, 2024",good,Engineer,"Former Employee, more than 1 year",Singapore,"slightly Good, depends on the client.",work life balance depends on the client.
Optimum Solutions,3.0,"Jan 19, 2024",Good,Test Engineer,"Current Employee, more than 1 year",Chennai,Friendly HRM monitor and help when we are with clients,very little hike and no new projects
Optimum Solutions,5.0,"Jan 13, 2024",Good,Principal Consultant,Current Employee,Singapore,Paying for medical leaves and annual leaves,No much interaction with the employees
Optimum Solutions,4.0,"Jan 11, 2024",review for optimum,Lead Consultant,Current Employee,Bengaluru,good company and good projects,no project in Mumbai/ Pune. low pay-scales
Optimum Solutions,3.0,"Jan 8, 2024",Join only not having any option,Consultant,"Current Employee, less than 1 year",Mumbai,Average pay depend on client working for,No yearly appraisal and hikes
Optimum Solutions,3.0,"Jan 12, 2024",Ok Ok,Software Engineer,Current Employee,Chennai,Good Learning potential for candiates,Need improvement for the employees
Optimum Solutions,4.0,"Jan 6, 2024",Good,Talent Acquisition Specialist,Current Employee,Pune,"Work life balance, Good culture and friendly environment",Good for career start and professional growth
Optimum Solutions,5.0,"Nov 8, 2023",Full Stack Software Development & Delivery Department,Lead Consultant,"Current Employee, less than 1 year",Chennai,"I am working with Optimum Solutions (S) Pte. Ltd for more than 3 months as a Lead Consultant, This is the wonderful organization and excellent to gain business knowledge. Very nice stability high growth opportunity to explore various domains. Work with client directly get clear requirement and view with the operational management. It makes me to work onshore activity with quality and on time software deliverable. Peaceful Corporate work environment and good onboarding process for new recruitment.",N o n e .
Optimum Solutions,5.0,"Jun 19, 2023",A Testament to Exceptional Company Quality - Joined Back Again!,Senior Consultant,"Current Employee, more than 3 years",,"1 ) Optimum Solutions consistently fosters growth, development, and strong relationships among employees. 2 ) The company greets returning employees with open arms, making them feel valued and providing a genuine sense of belonging. 3 ) The HR team ensures a smooth transition and offers necessary resources for effective reintegration. 4 ) Optimum Solutions prioritizes maintaining strong connections with employees, ensuring their well-being and happiness. 5 ) The company's culture promotes teamwork, collaboration, and innovation, creating a positive work environment. 6 ) The open-door policy and approachability of the management team enhance employee empowerment and a sense of being heard. 7 ) Optimum Solutions invests in employees through continuous learning, training programs, and career advancement prospects. 8 ) The company's dedication to fostering talent inspires creativity and productivity among employees.","1 ) The rapid pace at Optimum Solutions may require high adaptability and multitasking skills. 2 ) While growth and development opportunities are available, they may be more accessible in certain departments or roles. 3 ) Achieving a healthy work-life balance may require proactive self-management due to occasional demands for extra hours or tight deadlines. 4 ) Like any organization, occasional communication gaps or misunderstandings among team members may arise."
Optimum Solutions,5.0,"Jan 3, 2024",Good benefits,IT Analyst,"Current Employee, more than 3 years",Singapore,Good benefits for its employees,Not much of the cons
Optimum Solutions,4.0,"Dec 23, 2023",Review on Optimum Solutions,Senior Software Engineer,"Current Employee, less than 1 year",Singapore,A good consultancy company in Singapore,You have to sign a bond for a certain time of period
Optimum Solutions,3.0,"Dec 27, 2023",Good,Backend Developer,Former Employee,Lagos,Good place to work and connect,A bit lacking in human resource
Optimum Solutions,4.0,"Dec 15, 2023",Company review,Applications Developer,Current Employee,Singapore,Reliable and good company with correct salary range,"Outsource, no yearly bonus and allowance"
Optimum Solutions,4.0,"Nov 26, 2023",Good management and employee friendly,Senior Consultant,"Current Employee, less than 1 year",,They offer good salaries and have employee friendly policies,Only con is there don’t provide training sessions and learning platforms internally
Optimum Solutions,4.0,"Nov 3, 2023",Good company,Sr Consultant,"Current Employee, more than 1 year",Singapore,Better salary if can negotiate,"Very difficult to reach out to HR, once email is sent they will reply only after 2, 3 days."
Optimum Solutions,1.0,"Dec 23, 2023",Good,Senior Software Engineer,"Current Employee, more than 1 year",Chennai,"Good to work, environment good",Please ask them how much the project duration
Optimum Solutions,4.0,"Nov 23, 2023",Best Company to Work,Technical Lead,"Current Employee, less than 1 year",Hyderābād,"Good Working Environment , employee having opportunity to achieve new skills",No Cons As of Now
Optimum Solutions,4.0,"Sep 5, 2023",Working as an Architect,Technical Architect,"Current Employee, less than 1 year",Bengaluru,Inclusive work environment. Compensation is based on industry standards. The cab facility is good. The timing is flexible and a complete balance between personal and professional life.,No growth depends on the project. Lack of communication between the client and the optimum management. No training and certification facilities. The leave policy is not good and is based on Singapore policy. Work quality in terms of experience is not good but it depends upon the project. No learning.
Optimum Solutions,5.0,"Nov 21, 2023",One of the best HR consultancy,Consultant,"Former Employee, more than 3 years",Kuala Lumpur,"Company benefits
Appraisals
Competitive salary","Poor leave structure
No other cons"
Optimum Solutions,3.0,"Nov 22, 2023",Good to work,Senior Consultant,"Current Employee, more than 1 year",Chennai,"No Stress
Work Life balance",We cannot expect Career level growth
Optimum Solutions,1.0,"Aug 14, 2023",Worst Management in Hyderabad,Human Resources,"Former Employee, more than 1 year",Hyderābād,New Ceo got hired and he hired new manager in Hyderabad and previous Account Manager who was handing the clients good was moved to other client and then he resigned. Because of the new manager lot of employees working in clients place resigned and because of his decisions everybody got affected and then he suddenly promoted one employee to HRBP with out any valid reason. Former Talent Acquisition were layoff and new employees were hired and they are also being layoff. The New Manager & HRBP also resigned.,Nothing very bad management by new CEO and hiring new employees in Talent Acquisition and in Higher management roles without any clarity.
Optimum Solutions,4.0,"Oct 12, 2023",Great place to work and learn,Technical Lead,"Former Employee, more than 1 year",Mumbai,Company respect IT employees concern Good Opportunity to work from client location and helpful team Flexible work hour if you are working for client Lots of new initiative has been taken,HR benefits are less but they are improving Office in Mumbai will be helpful
Optimum Solutions,2.0,"Nov 12, 2023",Ok,Anonymous Employee,"Current Employee, more than 1 year",,Good pay Nice env ironment,Job security Pay day is first working day of the month
Optimum Solutions,5.0,"Nov 3, 2023",Great,Consultant,"Former Employee, more than 1 year",,Best place to work and learn new things with well experienced leaders.,I have no cons to express
Optimum Solutions,4.0,"Oct 12, 2023",good emp friendly and work life balance,Senior Consultant,"Current Employee, more than 5 years",,strong clients work life balance friendly environment chances of getting onsite is high,fixed hybrid model need to come tuesday to thursday cant be any 3 days that s difficult to mainain
Optimum Solutions,4.0,"May 26, 2023",Work experience with Optimum Solutions,Senior Consultant,"Current Employee, less than 1 year",Bengaluru,"I have a total 7 plus years of experience in the service based companies in coding and development activities. It has been 9 months since I have joined with optimum solutions. Throughout this 7 months what I find the best comparing to the other service based companies are 1) Direct interaction with the client as we are part of the client team directly working remote from India which reduces the management layers improvising the quality of work, visibility and communication. 2) Interaction with the leadership team/group knowing how the company heightening, strategies to manage the clients which helps in growth of my career.",The feedback from the client which are shared between the client and the company can be shared as a feedback for respective employees which will be helpful in developing the individual. HRBP is taking care of it in recent days which I see more helpful.
Optimum Solutions,5.0,"Oct 24, 2023",Good consultant to work,Consultant,"Current Employee, more than 1 year",Bengaluru,Good company to work Mostly client place work,No cons Based on client location
Optimum Solutions,5.0,"Oct 23, 2023",I recommended optimum,Talent Acquisition Specialist,"Current Employee, less than 1 year",Bengaluru,Top management is really cooperative and understanding,As of now No Cons(Dislikes)
Optimum Solutions,3.0,"Oct 23, 2023",Na,Senior Consultant,Current Employee,Bengaluru,Good company to explore other opportunities as consultant,Not so good benefits compared to pears
Optimum Solutions,4.0,"Sep 5, 2023",Good work environment,Senior Consultant,"Current Employee, less than 1 year",Bengaluru,"I have been woking in optimum from past 10 months, I feel good in below. -good shift timings -good colleagues -good work culture",Need improvisation on HR policies Need more HR tools for leave approval process Need more team building activities like team outing and lunch
Optimum Solutions,1.0,"Jul 1, 2023",Very disappointed. No career,Senior Consultant,"Former Employee, more than 1 year",Chennai,The offer letter format I got last year was looking nice. Other than that I am searching what else is good working here,A small body shopping company hiding as a projects company. This company does only people selling to clients. Yes many others and even big compnaies also do that but the motive of this company is to give people on project then when over just fire them. When client gives project end notice then company gives exit notice. They dont prepare us for new skills. They dont try other projects for us. If we ask they say some excuse. How many times I asked my account manager for next project and he said to wait. Then one day I am asked to leave the company. Very very bad experience.
Optimum Solutions,5.0,"Oct 2, 2023",Stable job opportunity,Ui\Ux Designer,"Current Employee, less than 1 year",Singapore,Good insource team. Opportunity to showcase your talent. Hardwork will be recognised.,Should be more open when it comes to salary hikes.
Optimum Solutions,3.0,"Oct 10, 2023",Still new,IT Assistant Manager,Current Employee,,Still new about 1 week now,I only have one week with them
Optimum Solutions,5.0,"Oct 4, 2023",Good place to work,Senior Consultant,Current Employee,Chennai,Good work environment. Good pay.,Nothing specific as of now
Optimum Solutions,5.0,"Sep 8, 2023",Very good company to work.,Cyber Security Consultant,"Current Employee, less than 1 year",,"Managers and colleagues are easily approachable. People are so lovely and friendly here, from the moment you have an interview everyone is so kind and welcoming.",None that i've come across so far.
Optimum Solutions,4.0,"Sep 18, 2023",Technical Developer review,Senior Software Engineer,"Current Employee, more than 5 years",Chennai,* Good work environment * Good client project * Good account manager,* Need to improve the process slightly
Optimum Solutions,5.0,"Jun 16, 2023",Good place to work with great opportunities,HR Analyst,"Current Employee, less than 1 year",Bengaluru,"1. Companies is undergoing a period of transformational change that, as a employee, is exciting to be part of. 2. With transformation happening, company provides the opportunity for its employees to explore and grow in their interests. 3. Company willingness to invests in their people. 4. Great team to work with who are smart, humble and hardworking. 5. Provided with good benefits. 6. People are always ready to support and guide.",The only con I can see for now is that the company can provide with lunch for its employees.
Optimum Solutions,5.0,"May 30, 2023",Review from Employee perspective,Technical Lead,"Current Employee, less than 1 year",Bengaluru,"1) Work life balance depends on the client project you are working on. 2) Frequent interaction with the leadership team/group knowing how the company heightening, strategies to manage the clients which helps in growth of my career. 3) No variable pay helps to get more in-hand salary. 4) HR assistance is readily available for any issues which is not seen in other service based organization. 5) Good name in IT services in Singapore.",1) Need to more strengthen Employee portal to avoid more manual work.
Optimum Solutions,5.0,"Sep 3, 2023",Optimum Review,Admin-hr,"Current Employee, more than 1 year",,"Cool workplace, happy to work....",Beach resource don't have job security in optimum no much hike given😕
Optimum Solutions,4.0,"Sep 13, 2023",good,Test Lead,Current Employee,,good good good good good,skills not evaluated thoroughly yes
Optimum Solutions,5.0,"Sep 6, 2023",Excellent working environment,Java Full Stack Developer,"Current Employee, more than 1 year",,"Friendly global team , well recognised company",Nothing to say here seriously
Optimum Solutions,5.0,"Sep 4, 2023",Optimum Review,Associate Consultant PMO,"Current Employee, more than 1 year",Bengaluru,"Motivating, Friendly, professional Management, casual",No negative point to mention here
Optimum Solutions,5.0,"Aug 29, 2023",Salaries in optimum,Senior Software Engineer,"Former Employee, more than 3 years",Chennai,No salary delay considering contract position,No growth Not sustainable No hike
Optimum Solutions,5.0,"Jun 18, 2023",Amazing Place to enhance you skills and abilities for the growth of your career,Senior Consultant,"Current Employee, more than 3 years",Chennai,HR's and Business Development mangers are friendly and provide you lots of support while get you deployed to the client projects. There are many banking projects available. Encouragement and hikes are highly better than any other service based company.,Internal Projects can improve their working environment by provide better work life balance and hikes
Optimum Solutions,5.0,"Apr 27, 2023",Review,UAT Tester,"Current Employee, more than 3 years",Bengaluru,I am happy to work in this company and interested to continue to help here and get the good name for the organisation,"Employees are very helpful,I am happy to be a part of it and I don't feel like I am talking to strangers instead I feel we r like a great bonding with in us. I am really proud of this company as the growth is going good .Seeing the same good progress in coming years and special thanks to all to be a part of this company thank you so much☺️"
Optimum Solutions,5.0,"Jul 24, 2023",Great Mid-sized company to work for,Anonymous Employee,Current Employee,,1. Work Culture 2. Supportive Leadership 3. New Challenges to work and hone skills,None at the moment to speak of !
Optimum Solutions,4.0,"Jun 23, 2023",Beautiful Experience,Consultant-Talent Acquisition,Current Employee,,"I have been associated with this organization since more than 2 years now, all I can say is Optimum is very supportive and management is always ready to answer your queries and have solutions to them. It is fun to work here.",Can't see one a very good place to work
Optimum Solutions,5.0,"Jun 21, 2023",A Dynamic and Supportive Workplace with Tremendous Growth Opportunities,Senior Client Partner,"Current Employee, less than 1 year",Chennai,1) Supportive and Collaborative Environment 2) Ample Growth Opportunities 3) Innovative and Dynamic Projects 4) Excellent Compensation 5) Employee Well-being and Work-Life Balance 6) Strong Leadership and Transparent Communication,"As all the companies have started working from office, Limited Flexibility in Remote Work Options"
Optimum Solutions,2.0,"Jul 20, 2023",Just a staffing company,SQL Developer,"Current Employee, more than 1 year",Singapore,Only pros is that you get your salary on time provided your timesheets is approved.,No job security. No appraisal.
Optimum Solutions,5.0,"Jun 19, 2023",great company to work. And I love my Client project.,O365 Administrator,"Current Employee, less than 1 year",Chennai,Company Culture is awesome. Flexible work hours.,"nothing like that all are helpful enough, i don't think thats a con"
Optimum Solutions,3.0,"Jul 23, 2023",Promotes work life balance,Sales,Former Employee,"Manila, Manila",Work life balance Easy task,None so far to stress about
Optimum Solutions,3.0,"Jul 27, 2023",Average company,Senior Manager,Former Employee,,Average company to work at.,No benefits given to employees
Optimum Solutions,3.0,"Nov 28, 2022",Low salary,Executive,"Former Employee, more than 3 years",,"12 days of AL, with little to almost no benefits. Kept mentioning about being an open organization so that u can feedback to them regarding anything. But when u feedback, they do not care at all. Not sure why they keep prompting this then. Problem also just persist for yrs. Dont expect much for pay increment because they will give u bare minimum at 3% max, with barely any bonus citing company performance due to covid. Lousy manager that does not even bother to what u have to say. Does not know what the team is doing. Any problems u re basically on your own as he will ask u to check with yr team mates instead. Basically, people are there because they cannot get a work pass outside. Exit interview only conducted as a process. They dont really care what u have to say","Management not receptive Low pay, no benefits (dental, flexi), low bonus"
Optimum Solutions,3.0,"Jun 26, 2023",It’s an okay job - pays the bill,Physiotherapist,"Current Employee, more than 3 years","Crawley, West Sussex, South East England, England",Let you get in with it Gave cpd time,Lone working Company politics Quite long days - compressed patient load
Optimum Solutions,5.0,"Jun 23, 2023",your kind of a one,Senior Manager,Current Employee,,Excellent team and very good work environment. work life balance and wonderful team around you. Career growth and your hard work is well deserved.,no such as of now
Optimum Solutions,5.0,"Jun 30, 2023",Great place to work,Sr. Manager IT,"Current Employee, more than 3 years",,"Agility Swiftness Flat Management Great place to learn, have a solid learning curve",Limited On-site opportunity for internal folks. Need stronger platforms and tools.
Optimum Solutions,5.0,"May 23, 2023",Supportive management,Associate Consultant,"Current Employee, more than 1 year",Hyderābād,Excellent work-life balance with top-notch benefits. The management team really seems to care about their employees,"You may have to work late/from home sometimes when the company needs you to, but that is balanced with the ability to work from home when YOU need to; its a fair trade"
Optimum Solutions,3.0,"Jun 24, 2023",Less benefit on time salary,Software Engineer,"Former Employee, less than 1 year",Singapore,Direct on-site opportunity from India.. This company is good for how are looking for onsite opportunity,Work life balance depends on client
Optimum Solutions,5.0,"Jul 6, 2023",Good Environment,Anonymous Employee,"Current Employee, more than 1 year",Pune,The company has a Good Culture,No cons of working in optimum Solutions
