Company Name,Overall Rating,Review Date,Review Title,Job Details,Job Title,Location,Pros,Cons
SAS,1.0,2023-08-25,poor management,current employee more than 1 year,associate software engineer,"Cary, NC",no pros at all be ready to be verbally abused by your manager and do not expect any help at all,management is horrible do not listen when told to voice your opinion because your team and manager will think that you are incompetent they do not stand by the be curious mantra its total bs
Mphasis,2.0,2022-10-05,poor management,current employee more than 10 years,software developer,"New York, NY",wfh good projects flexible gets clients,no 401k does not promote candidates who are like 510 years doing same work less career advancement prospects poor management no good pay performance linked is namesake if they have budget and somebody is crying they will give else they will keep you hanging for life
Hitachi,3.0,2023-01-17,poor management,former employee more than 5 years,engineer,,good place to learn manufacturing and automotive industry,poor management too busy too much work load and not enough staff
Xilinx,2.0,2022-10-18,poor management,former employee more than 3 years,engineer,,good before change in management,was good with management then covid happened and management changed was given extremely difficult tasks outside of my expertise no assistance and then told i didnt have satisfactory performance new management then made repeatedly disparaging comments when they had misused my expertise i hate using the term but it was toxic hopefully it was localized but i heard various other stories so im unsure
Wipro,3.0,2024-02-16,poor management,current employee,network engineer,Pune,good technology learning opportunity,no increment management is bad
Seagate Technology,1.0,2023-09-06,poor management,former employee more than 3 years,technical support engineer,"Oklahoma City, OK",paycheck was always on time,poor management and organizational control
Visa Inc.,1.0,2023-11-29,poor management lick it or kick it,current employee more than 5 years,senior software engineer,"Foster City, CA",nothing much after they are cutting costs on every bit of things,your performance is only reviewed on how much you lick your managers when things doesnt go well your manager will only blame you all old people working and they will never give you a chance to prove you are better for their job securities worst compensation in the tech industry
HubSpot,2.0,2023-11-30,uncomfortable culture poor management,former employee,senior software engineer,"Cambridge, MA",the pay and benefits are competitive and there is opportunity to work remotely for those preferring remote work the office is in an easily accessible walkable location and is well equipped with amenities,the company is very aggressive and heavy handed with its culture which is very political and very far left radical to provide a more welcoming and constructive environment for all of its employees politics should and traditionally were kept out of the office but not so at hubspot regarding team dynamics teams are set up to look good on paper but managers are focused on completing rituals and voicing slogans while being indifferent to the progress and success of employees or else being too afraid of confrontation to actually make expectations clear supervisors have no interest in training new staff on company resources and company paradigms and merely wish to insert staff as cogs in the machine rather than preparing them for excellence and a greater contribution there also appear to be higher management schemes to fish for justification to push employees out of the company as a backdoor approach to layoffs rather than being straightforward
HERE Technologies,2.0,2022-08-10,poor work environment incompetent management,current employee more than 1 year,software engineer,"Chicago, IL",flexible time off policy decent benefits,engineering team is completely overworked often clocking more than 60 hours a week this is not helped by the line managers who refuse to delegate tasks
NCR,1.0,2024-02-12,dishonest and poor management,former employee more than 1 year,customer engineer ii,"Chicago, IL",you are provided with a fleet vehicle almost feels as if youre running your own business with inventory and breakfix calls,dishonest management very disrespectful when you are asking for something as simple as weekends off a specific person on the management team made sexually abusive remarks and was not fired or reprimanded at all management was covering up for this person and nothing ever happened i felt as i was forced to quit i couldnt even listen to the sound of his voice when we called meetings what kind of business are they running
Dell Technologies,2.0,2024-02-07,poor management outdated guidance confused leadership,current employee more than 1 year,software engineer ii,,decent 401k and medical benefits,leadership terrible misguided untrustworthy they back peddled on remote work after consistently saying they support forcing all employees to rto within a month regardless of where nearest office is top many older unknowledgeable managers that dont know anything about engineering engineers dont prioritize retaining customers and fixing customerfacing issues too much emphasis on catch termswords to sell something instead of delivering quality for the use case
Gojek,2.0,2024-01-24,poor management no transparency very frequent layoffs,former employee more than 1 year,senior software engineer,,good engaging work good compensation,constant threat of layoffs too many changes in org structure no transparency from upper management
Wipro,2.0,2024-02-13,poor infrastructure,current employee more than 1 year,software engineer,Chennai,bascially there is no pros while working for wipro,all are cons not even basic infrastructure available water not available in restroom coffee wont come in the coffee vending machine so and soooooo
NetApp,2.0,2023-02-11,poor leadership,former employee more than 5 years,software engineer,"Boulder, CO",i had an amazing team and an amazing manager many smart engineers pay was good too good cant match it easily,quarterly reorgs most didnt affect the workers directly but multiple layoffs have happened in the past several years canned projects the leadership doesnt seem to understand the market and shifts too often wasting valuable resources certain genders and races are less likely to get promotions heavily biased ceo and leadership has no business talking politics and officially espousing political viewpoints ceo has a way of demoralizing the company with every speech he makes no matter how good a quarter or a year was it wasnt good enough diversity has a way of overlooking the best distribution of the employees is skewed relative to local population quality team was mostly laid off quality is built into products not tested in
Marvell Technology,3.0,2023-10-17,team was good upper management was super poor,former employee more than 8 years,senior staff software engineer,Hyder훮b훮d,if your team is good then the workplace can be pretty good but you need to be lucky for that most of the work in some teams are pretty interesting technology wise its really good if youre a lateral hire but if you advance to a position youre probably being significantly underpaid,really poor raises especially you have been there a while erratic upper management does weird things like firing half a team on an extremely profitable project while the company has been making record profits for a year
Zoom Video Communications,3.0,2024-01-06,management,current employee more than 1 year,software development engineer,"San Jose, CA",wlb is good theres a lot of cross team collaboration,the company is all chinese
Shopee,5.0,2019-08-19,good management,former employee less than 1 year,software engineer,,employee base are very young not much office politics good management,as an engineer if you are not super good at what you do theres not much upward mobility
HCLTech,2.0,2024-01-12,management and projects,current employee more than 1 year,software engineer,Lucknow,i wouldnt say any pros i have seen this far but my coworkers are quite supportive,they dont have projects and the upper management is really very slow and the hr team is worst they barely reply me for any of my concern
ByteDance,1.0,2024-01-23,bad management,current employee more than 3 years,software engineer,"San Jose, CA",good salary good work and good perks,bad work life balance avoid if possible
Luxoft,2.0,2024-01-15,crisis management,former employee more than 1 year,software engineer,"Munich, Bavaria",strong brand recognition high quality developers interesting community,classic engineering services firm loaded with long term eastern european managers who are incapable of operating with modern management methods high speed high stress low job security your career follows your project
SS&C,1.0,2024-01-15,bad management,current employee,software engineer,"Mishawaka, IN",remote option is very good,very bad hr management very bad immigration policy
Zebra Technologies,1.0,2024-03-01,unprofessional management,current employee,software engineer,,zebra gem points salary holidays these are the only perks here,work culture team management more frequent firings
ServiceNow,2.0,2024-02-10,good company poor management beware,current employee more than 3 years,tech support engineer,"Dublin, Dublin",good company salary benefits and office,beware of this company dept mgmt is poor they have bully mentality micro mgmt and one manager in particular is very aggressive pay rise is poor even though company doing good overall career opportunities limited
Fujitsu,1.0,2022-07-05,poor,current employee,senior engineer,,a global company more experience,pay so little lack of management skill system outdated
Unity,2.0,2024-02-22,great people poor leadership,current employee more than 5 years,software engineer,"Austin, TX",excellent employees that create an unparalleled working enviroment great offices with great services an opportunity to work on some really fun and cool projects,leadership are quite directionless all the pros of working here are somewhat overshadowed by the constant chaos of layoffs and reorgs as a result of poor investment choices and diversification which ultimately translates into purchasing businesses with no relation to the company
ST Electronics (Singapore),2.0,2021-12-07,poor career prospect,current employee more than 5 years,senior software engineer,Singapore,there are camaraderie among colleagues,1 managers are oblivious to engineers struggles in projects 2 engineers overloaded yet still have to achieve kpi 3 engineers under paid 4 engineers no more bandwidth for upgrading opportunities
Qualtrics,1.0,2023-10-18,terrible leadership and management,current employee more than 5 years,software engineer,,amazing teams and coworkers great pay sometimes you can see the impact products are having on customers and it definitely gives you a feelsgood moment work life balance used to be good before the current economy theres a lot of products that have a clear success path for the company,low pto leadership has no idea what they are doing and the company is being run to the ground they mandated return to office and gave most remote employees an ultimatum to relocate or get laid off on top of the most recent layoffs and other employees simply got told they would be let go in march next year the relocation letters had no compensations other than being told youd be reimbursed no details on dollar amount they did another round of layoffs even after we did one at the start of the year and they told everyone there wasnt going to be another one this year theres no transparency and instead of even offering pay cuts or doing pay cuts across the board including the ceo they would rather just bleed valuable talent from every single team in the company most people i talked to dont see themselves sticking around long term me included maybe if things get better
Cloudflare,2.0,2023-09-07,smart people poor management no career track,former employee more than 3 years,it operations engineer,,you will work with some amazing people,no salary raises paid in stock which raises your tax bill nonsales teams see no career growth managers are outside hires or are the least qualified promotions high turnover toxic workplace dei is nonexistent
Shopify,3.0,2023-10-16,management is a mess,former employee more than 1 year,senior software engineer,,great team members work on large problems that effect millions of people,management will lie to you andor switch your projects around
Z체hlke,1.0,2024-01-25,horrid management,current employee more than 8 years,associate software engineer,,people are great thats it,company is in the red management leaderships are incapable and leading the company towards failure
NCR,4.0,2023-10-05,good values poor compensation,current employee,software engineer ii,,this is a great place to start your career and take charge,they have poor compensation compare to other large cooporations
Workday,3.0,2024-01-10,important company but bad management,current employee more than 3 years,software engineer,"Pleasanton, CA",clean simple benefits and perks nice office average pay,behind in technology and terrible management
Amdocs,4.0,2024-02-16,best project handling management,former employee more than 1 year,software engineer,Pune,best people and management to work with and supporting seniors,work load is more but is fun working
Shopify,1.0,2023-05-14,rudderless management and executive team,former employee more than 1 year,software engineer,,good pay great benefits awesome scale of projects,management is a joke they dont actually solicit any feedback from peers for their feedback cycles so you could get glowing reviews for months straight then suddenly get a bad impact rating out of the blue so much wasted time on things that shouldnt be needed everything is built in house so they have to spend an absurd amount of time doing simple things instead of just using frameworks or tools that have already solved the problem way too much hands on intervention by the ceo it was a running joke that you couldnt get through a product review he was involved in without some product or technical change hed insist on despite not having anywhere near enough product or technical context for it to matter but everyone always did it because it was understood you dont say no made everyone sit through 4 days of meetings after the layoffs in 2022 where the executive team congratulated themselves on how good of a job they did firing 1000 people the level of tone deafness on display was disappointing basically shrugged when lgbtq employees expressed concerns about platforming obvious hate speech organizations would delete any public slack messages posted about it to silence discussion
Citrix,3.0,2023-06-14,left before it got real bad poor management,former employee more than 8 years,noc engineer,"Fort Lauderdale, FL",worked there 10 years overall good company team outings fancy work environment,poor top level management yearly turnovers very stressful
Airbnb,2.0,2023-07-24,incompetent middle management,former employee less than 1 year,l4 software engineer,"San Francisco, CA",friendly and like minded ics to collaborate with additionally perk like heathy catered lunch and dinner were offered the most notable part of the engineering staff is that everyone was always willing to be helpful and talk you through difficult problems,unclear product development owner poor alignment between engineering managers and the org for which you worked for leading to often bad prioritization
Groupon,2.0,2023-12-04,micro management and no strategy,current employee more than 3 years,senior software engineer,"Chicago, IL",there is nothing really good to talk to about in the last 4 years hanging out still as there are some old friends,ridiculous micro management and tracking at 3 hr level even for programmers no positive outlook on business
Tata Consultancy Services,3.0,2024-01-06,worst management ive ever encountered,former employee more than 1 year,software engineer,"Newark, NJ",its fairly easy to pass the interviews,they force you to look for projects that you are hired for like what that should never be an employees concern like you hired me for work i dont know what work your company needs if you dont find a project within one month theyll threaten to fire you so you are frantically having to talk to your regional manager to help you find a project or talk internally to different team managers even if you are hired as a java dev theyll completely disregard it and try to put you on a different project with unrelated experience nobody knows whats going on in management and someone tried to make me go back into the office while i was covidcompromised until it was escalated with other managers they play favors to folks and overwork newer employees to the brim
Grab,1.0,2019-12-22,no consistent culture and terrible management teams,current employee more than 1 year,software engineer,"Seattle, WA",early phase of the company and you have impacts,everything was too random and arbitrary cannot see consistent strategies
Agoda,3.0,2024-01-08,great company in thailand neutral management,current employee less than 1 year,software engineer,Bangkok,good wage compare to other companies in thailand,poor management career path not clear
Nutanix,1.0,2023-11-03,unethical and autocratic management compensation cuts,current employee more than 5 years,software engineer,,as usually the case there is a standard of good people and technology here,unsuspecting candidates are lured into working here under the pretense that benefits are better than industry standards then unceremoniously reduce them and inadequately adjust compensation management then attempts to hide this through censorship removing very popular slack channels and replacing with moderated ones worse is senior management are so out of touch they think employees wont figure this out company has a long way to go to be considered truly enterprise class recent decisions and moves have brought into question their competence to get us there company isnt profitable and management cant figure out why management lack of business acumen taken out on workforce
Seagate Technology,2.0,2023-09-05,management,former employee more than 1 year,senior engineer,"Longmont, CO",people pay and bonuses are pretty good,terrible upper management directors seem to like to build cadre of yes people that do nothing productive
LinkedIn,2.0,2023-10-21,declining engineering culture poor leadership,current employee more than 5 years,staff software engineer,,compensation and benefits are decent good coworkers,the engineering culture is on a steep decline there is forced stack ranking for performance reviews thats naively focused on short term impact engineering leadership vps specifically is terrible and holds no accountability for themselves instead trying to pass down the accountability to others lower in their reporting chain they are unable to push back on product initiatives and instead want ics to be blamed for not pushing back on initiatives we dont believe in terribly inefficient way to do things wlb is declining because of all this and burnout across orgs is on the rise multiple high performers are unhappy and have already left or are in the middle of plans to
Unity,3.0,2023-07-13,great team poor executive leadership,former employee more than 1 year,senior software engineer,"Austin, TX",great wlb promising tech it was super cool to work and see early stuff and feel like you have an impact on tech choices,constant reorganizations we had 3 in 10 months the company cant properly commit to a vision and will constantly thrash
Yahoo,2.0,2024-01-06,politics and lazy management,former employee more than 10 years,sr principal software engineer,"Sunnyvale, CA",compensation is good overall as with other similar companies,everyone in the company is just trying to spend time somehow from 95
NetApp,4.0,2023-05-02,great company bad management,former employee more than 10 years,principal software engineer,"Boulder, CO",the people and culture are what make netapp such a great place to work netapp definitely believes in what they preach as far as being a company that stays up with the current cultural trends and lives by those values the diversity of cultures made it a great place to work,unfortunately there are too many fiefdoms at netapp especially in the manageability groups netapp has always had too many tools in the management tool box which customers complain about yet they would and could not join them together due to the egos of those in charge even though they all work for netapp and should just be working to help make netapp a better company
Groupon,2.0,2024-03-11,great people bad management,former employee,software qa engineer,"Chicago, IL",great people with beautiful minds fun product,higher ups seem out of touch with our target market
Qualtrics,2.0,2023-12-22,management has lost the plot,current employee more than 5 years,senior software engineer,,good work life balance virtually never working >40 hoursweek very competitive total compensation at the team and department level everyone is great,management is focused on cutting costs and offshoring every job possible rather than actually trying to improve the product communication from senior leadership is nonexistant and completely out of touch with employees multiple rounds of layoffs affecting top performers most employees are checked out after the recent private equity purchase and subsequent gutting of the company just announced changes that would vastly reduce the number of promotions for employees even if they are performing well
Works Applications,2.0,2021-09-30,very very bad management,current employee more than 3 years,senior software engineer,Singapore,salary is paid on time some good colleagues to work with,near to zero work life balance sometimes they will knock you at 1 am midnight to resolve some urgent issue which is not urgent at all company is managed from japan side management they cant decide anything properly now they are reducing headcount aggressively business is going down as a result of bad management 95 managers in singapore office are indians they have failed all the products miserably due to their dirty politics
OpenText,2.0,2023-12-23,upper management borderline unethical,former employee,master software engineer,,mostly good and reasonable people,after years at hp hpe microfocus and opentext with nothing but stellar performance reviews and leading cutting edge tech development the back to office policies no exception i believe is what made me a candidate for layoffs with ceo toughting in company meetings that though must be in office 3 days per week i know it does not sound hard however with medical conditions and office remodeling going on which made bathroom facilities unavailable on the same floor this became an issue that was in acceptable health wise furthermore the use of badge in badge out was implemented initially for covid contact tracing now they have turned the reporting into monitoring of office attendance something the old hp way would have never worked out when your role is interfacing with india and europe these positions require remote off hours work as well inflexible management is management simply making a hard job even harder
Tata Consultancy Services,2.0,2024-02-12,work was easy but lack of communication from management,former employee more than 1 year,software engineer,"Santa Clara, CA",work was easy everyone was nice,lack of communication from management
Autodesk,3.0,2024-01-12,great benefits secretive management questionable culture,current employee more than 10 years,software engineer,"Detroit, MI",salary is very good health benefits are amazing many roles may be had as hybrid andor remote culture code sounds good on paper,manager musical chairs managers with a do as i say not as i do managers and leadership expect individual contributors to adhere to a culture code but they do not themselves constructive feedback comes as a surprise at review time once a year rare positive feedback throughout the year no growth path or ways to move laterally you are stuck for years in a role unless the organization changes you to another role people that have no business being managers are made managers but people that express desire to get there are ignored managers are terrible people managers because they are expected to do other things as well and those other things are what give them visibility
Airbnb,1.0,2024-01-08,horrible inexperienced management real bad on wlb,former employee more than 1 year,software engineer,"San Francisco, CA",good to put on resume,managers who have no idea what they are doing and want to just claim credit no care for investing in individual needs
NICE,1.0,2024-02-01,management and leadership,current employee more than 5 years,engineer,Pune,na actually none why please review cons,sudden descision making without any thoughts if that descision yield any results or not pure politics while providing performance rating 0 planning ahead approch leadership lacks vision
