Company Name,Overall Rating,Review Date,Review Title,Job Details,Job Title,Location,Pros,Cons
LinkedIn,1.0,2023-11-13,back stabbing culture with poor leadership,current employee more than 3 years,senior staff software engineer,"Sunnyvale, CA",i see no reason why people would like to join a company in such steep decline not even for great comp i am sure you will regret it in a few months,management is mostly composed of inexperienced engineers that lacked the tech knowledge and thanks to politics were moved to management since there is no vision in leadership projects are changed on a weekly basis and there is nothing of significance achievedmanagers are like headless chickens running around on directors words quality is a second class citizen and this is reflected in oncall benefits have been cut significantly in recent history including free food which of latest is worst quality diversity of teams is poor at best and this promotes back stabbing culture formed during the recent year upward mobility is nonexistent because company has been shrinking rather than growing
Hewlett Packard Enterprise | HPE,2.0,2024-02-05,good worklife poor base salary performance bonus and promotion opportunities,current employee more than 8 years,software engineer,,worklife balance is great paid holidays and overall benefits package is good culture and people is good,the company preaches that you are paid according to the market but in reality only your salary curve may be similar to the market your actual base salary is usually 30 below market salary increases and performance bonuses are poor regardless of how well you perform or even how well the company performs promotions if you really like what you do and are trying to get a promotion within the same role forget about it not going to happen only way to land a promotion is moving internally to a different role but then hr is able to see your current salary and will cap your salary increase to keep you really low within your new salary curve last but not least every 1218month the company goes through reorgs that usually focus on cost saving and translates to work force reductions
Z체hlke,3.0,2024-01-18,not a good time to join until they fix the management issue,current employee more than 3 years,software engineer,Singapore,good colleagues culture and work life balance,seriously management do not listen to their people and clinging to their 50 years old business strategy they are the one refused to adapt they reshuffle on their own under the name of change people adapt and learn but they cant apply because of that strategy quite a number of people pointed out about that but ignored sit at the top of the chain and reject good ideas from the employees yet no responsibility
F5,1.0,2023-04-27,terrible senior management company in decline,current employee more than 5 years,software development engineer,"Seattle, WA",nice office well known company good worklife balance,horrible senior level management who create chaos and disfunction every couple years with reorg after reorg looking at you technology services peoples roles get changed and forced into functions they dont have interest in or qualifications for this is done without their consultation and senior management is open that they dont know the people theyre affecting lower level workers have their managers changed on a whim critical roles overseeing functions which have no redundancy are removed leaving important gaps without any kind of replacement oh and there are layoffs every other quarter if you enjoy stability and steady direction from senior management this is not the place for you
Datadog,3.0,2023-11-01,incompitent management,current employee more than 3 years,software engineering manager,"Seattle, WA",great pay good hours beautiful campus,upper management is really stupid they continuously revoke headcount midway through the hiring process they cant come up with a strategy that will last more than a quarter im honestly surprised they can keep the lights on let alone run a company
Seagate Technology,2.0,2023-09-18,poor vision and leadership,current employee more than 3 years,engineer ii,"Longmont, CO",it is close to my house,the leadership lacks vision staff is underpaid and therefore lacks motivation and creativity bureaucratic soulcrushing
Google,4.0,2024-02-12,a company with a strong engineering culture that is slowly stagnating from management,former employee more than 3 years,software engineer,"Chicago, IL",google has a rich history of engineering excellence and brilliance even many years removed from the height of the companys innovation some of this is still evident through a strongly ingrained engineering culture where things are mostly done in an engineering first mindset engineering excellence is obvious across the organization and the productsinfrastructure built at google are a testament to this work life balance is for the most part extremely good and good work life balance is ingrained in the culture i have never experienced pressure from managers to work more than 40 hours a week and the vacation + holidays are decent though maybe not the absolute best,there is a clear lack of vision from top management as many of googles recent big initiatives seem to be reactive to other tech companies instead of proactive when compared to top executives at similar large companies the current management falls quite short a complicated performancepromotion process exists at google in an effort to measure employees fairly across the large company however this comes at the cost of wasted cycles and the gamification of the system this along with the large variation in teams results in nonuniform opportunities for promotioncareer advancement
NTT DATA,4.0,2023-09-18,services management,former employee more than 5 years,systems engineer,"Plano, TX",this companies services arm stems from perot systems and then dell the take over has been years back now so over time has been changing and evolving there are a few of the originals still around in leader positions,since it has been many years since the take over as time goes on and there is less of the original good leaders in place to keep from making bad deals they are forced into taking shortcuts and getting into bad situations
Gemalto,2.0,2011-10-25,poor pay less chance to progress french promoted easily,current employee,senior software engineer,"Austin, TX",+ technical knowledge of peers good + good global exposure + challenging work,+ low pay + great engineers stay engineers + bad politics with merger + stabbing on the back is very very common
ST Electronics (Singapore),3.0,2022-11-04,management want us to work and dont complain,current employee more than 5 years,senior software engineer,,work life balance family oriented,salary low compare to other it sectors red tapped hr not referring to all will complain to your superiors if you bother them too much
Uber,4.0,2024-02-17,good salary friendly people weak management,current employee more than 1 year,senior software engineer,"Seattle, WA",the salary is top notch even in the tech industry uber in the past has had a reputation for being an incredibly toxic place to work at from what ive understand theyve undergone a transformation with the current ceo dara khosrowshahi ive been here for 2+ years and i have not experienced that at all all the people ive worked with are respectful the work life balance is also quite good i typically do not have to work more than 40h except for oncall or an occasional deadline,uber has started to track diff count and other metrics for worker productivity and it is an input to performance discussions i often see diffs that are committed without testing or unnecessarily broken down just to meet quota requirements it hurts quality without materially improving true productivity in my opinion i also feel like management is quite weak my managers are all just people managers assigning work to engineers and attending meetings i dont see ownership in them to drive culture or engineering efficiency or product strategy that stuff is pushed down to the engineers who are busy in the weeds as a result i see tons of examples of poor engineering design incidents that happen due to lack of testing and so on
Tableau Software,3.0,2023-10-22,great place until upper management changed,former employee more than 5 years,staff software engineer,"San Francisco, CA",i loved my coworkers the original chris christian and the vps below them were great to work for the work was interesting i loved meeting and working with the tableau zen masters,after adam took over things changed by the time salesforce bought them nobody above my manager knew or seemed to care who i was the goalposts toward promotion were constantly moving i absolutely delivered got top ratings in my performance reviews and believe i was well liked by my peers but i never did get the promotion i was after and eventually i allowed myself to be hired away
Synapxe,2.0,2023-10-22,poor work culture,current employee more than 1 year,cyber security engineer,Singapore,work from home alternate weeks,lack of manpower and need at least 2 primary engineer everyday
NCS,3.0,2024-01-12,vendor management,current employee more than 1 year,cyber security engineer,Singapore,perfect for those who enjoy vendor management then technical,the engineer seems to be leaning more towards coordination and project management rather than delving deep into technical aspects your work experience largely depends on the project youre involved in if youre skilled in flexibility and effectively managing vendor relationships you can expect a more positive professional journey
Diebold Nixdorf,1.0,2023-06-20,bad management,former employee,field service engineer,,friendly environment good place to work no rush no pressure,their support its horrible they never answer when they do they want you to fill out paper forms send it to them ten download flight records from machine or 1 touch and still no good advise software team same thing i sincerely believe this company its over staffed i used to have a manager ten they put a managercoworker that supposedly he was going to help on hard to fix machines he doesnt do it and now we have an extra supervisor that its just sitting us financially company its not doing that great they need to clean unnecessary people
Seagate Technology,2.0,2023-03-18,good company with poor leadership,current employee more than 3 years,engineer i,"Longmont, CO",your coworkers will likely be some of the kindest and most welcoming people youll meet the culture is geared towards inclusion with employee resource groups for the lgbt+ community bipoc communities neurodivergent people and others generally laid back work culture as well as long as you get your work done on time most people will leave you alone benefits are good compared to other engineering companies,you will be paid less than your peers at other companies if you ask for more management will give you lipservice about tight budgets and promotions are tied to time spent working at the company rather than the quality or the amount of work you are completing be ready for layoffs which will increase your workload and then a slow hiring process to get those people back once the company recovers coworkers will also be able to offer little support during these times as they will also be overloaded with work most people in upperlevel management roles will be out of touch and egotistical do not depend on anyone but your manager to have your back be ready to keep your head down and say yes sirmaam when they ask something ridiculous of you as any criticism directed up the chain is unacceptable this is also true of any program leads they will have a very holier than thou attitude especially if you need something from them the leadership is constantly makes decisions that make work harder than it needs to be recently these decisions have been mandating 40 hours of training without providing support for employees to find that training employees are expected to complete it on their own time additionally the it infrastructure is so restrictive that you often have to wait 2 days for them to do something on the backend before you can even begin your work very little vertical or horizontal mobility be prepared to work in your position for years without any changes other than to your workload the vast majority of the workforce is near retirement age and the company will do very little to retain new talent expect a very high turnover rate for younger workers at the company
Motional,5.0,2022-09-01,good pay poor team,former employee more than 1 year,iam engineer,,great office benefits and pay opportunities to learn and grow opportunities to visit other offices,the it team was seen as less than wasnt offered equity constant lay offs low diversity for people of color poor dynamics within the team terrible morale lots of finger pointing and poor culture unlimited days off but no room to ever take time off and shunned when you do
CrimsonLogic,4.0,2023-10-03,good middle management,former employee more than 5 years,senior software developer,,good middle management and bosses work life balance in certain teams forward thinking,senior leaders are not in touch with the ground and give unrealistic expectations need to understand employee perspectives
VMware,5.0,2023-08-10,poor acquisition communication affecting morale,current employee less than 1 year,engineer,,people are great my management team is downtoearth supportive and allows their team to provide ideas and drive projects with minimal supervision benefits pay worklife balance and opportunities are also great lots of resources to keep moving in your career and very transparent in many areas,work in some bus can be awfully slow due to the existing processes and bottle necks politics above sr directors is ridiculous at times there is a dysfunctional ecosystem among leadership in different teams the acquisition is affecting morale and the lack of communication down to us is not helping there is no guarantee that we will get to stay and information related to how vmware aligns to broadcoms vision is not clear i am frustrated that finally i got to join a great company recently and now facing an imminent layoff period
Optimum Solutions,5.0,2023-05-23,m working for hyderabad location with good experience management is helpful,current employee,senior software engineer,,friendly management excellent work experience,nothing as of now everything is perfect
NICE,4.0,2024-02-27,good company to work for but higher management does a lot of politics,former employee more than 1 year,senior software engineer,Pune,1 good pay 2 cutting edge tech to work with,managers and architectures make appauling decisions the company cant handle recent success post covid and that has affected the employees lower in the chain of command
UKG,4.0,2024-02-28,great company to work in but it feels that senior management is lacking the vision,current employee more than 10 years,principal software engineer,"Weston, FL",great worklife balance acceptable salaries when compared to other companies in fl good work environment,it sometimes feels that the company leadership lacks vision
SAS,1.0,2023-12-07,low salaries poor senior leadership,current employee more than 10 years,senior software developer,,worklife balance mental health and sick days remote work flexible,compensation is an absolute joke maybe 10 years ago it was competitive but other companies offer leagues beyond what sas offers doesnt matter if the company had a good year or not bonuses seem to be completely unrelated to revenue senior management casts blame at developer when process is the issue yet they offer no solutions other than do better they dodge questions instead of admitting they dont have an answer sas is swimming up a waterfall trying to stay competitive they are far too slow to deliver software and refuse to drop parasitic customers that refuse to upgrade from legacy products too much time is wasted in development keeping outdated code alive and in setting priorities because everything is top priority sas used to be one of the best places to work but the times have drastically changed senior management is shortsighted idealistic and out of touch the company has a lot and i mean a lot of work to do before they can claim to be competitive in the market and as an employer
Citrix,2.0,2023-07-26,lacking direction and poor leadership,current employee more than 1 year,network security engineer,"Fort Lauderdale, FL",access to lots of technologies and always changing,always changing and a severe lack of direction
HERE Technologies,2.0,2022-05-07,lots to learn but management is confused,former employee more than 5 years,engineer,"Berkeley, CA",benefits work life balance great coworkers startup mentality and flexibility to get work done the product that they were making was great but management has no idea of how things work,management ceo growth everyone is underpaid for what they do political takes months to get something approved and future of company and job lots of people leaving and not enough being hired to fill the empty positions
MongoDB,4.0,2024-02-16,good company with great collegaues though management is opaque about their intentions,former employee more than 3 years,software engineer iii,"Copenhagen, Capital Region",incredibly competent colleagues and good perks,lack of transparency from management
Intel Corporation,3.0,2024-02-05,careful with middle management,current employee more than 3 years,soc design engineer,"Hillsboro, OR",nice perks and the sabbatical is a big plus1 month after 4 years 2 months after 7 years + 15 days of vacation,silos are prominent middle management will only get in your way for growth as a lot of manager are there only for their growth and not for the ics under them not all managers are like this but there are enough of them you will get stuck into your role takes a long time to change area even inside the organization and in comparison to other semiconductor companies you get so specialized at something that you are not useful anywhere else old legacy tools organizations are trying to modernize the tools but we are behind about 8 years in easy management is hesitant in spending time on improvements nonmerit promotions most promotions are because of the years that you have been in the company
Citrix,2.0,2023-09-23,citrix toxic management,current employee more than 1 year,technical support engineer,"Raleigh, NC",some good coworkers and good environment,terrible management and team leads
VMware,4.0,2023-12-30,good culture but bad management,current employee more than 3 years,staff engineer 1,"Los Angeles, CA",culture was great as an employee you really felt taken care of with wellness allowances raises and bonuses,often times products and services were unknown to the larger technology industry rather than taking the products to the people the expectation was that the people would come and find the products
Honeywell,3.0,2023-12-12,decent opportunity but negligent management,current employee more than 3 years,systems engineer,,none of my bosses have micromanaged details like hours worked or emails responses good opportunities for lateral movement so many people stay at honeywell for years some of the phoenix area sites have made significant improvements in the last five years with ping pong tables employee events with food provided and many newer employee clubs most engineers are friendly and ive rarely met toxic or egotistical lowerlevel employees,honeywell says innovation is a top priority but somewhere the message gets lost in middle management and therefore many new products still use code written in the 90s and archaic software tools export control processes have gotten draconian and uncollaborative hope you enjoy typing a business justification for virtually every external email many teams have to been told to stop using excels real time coauthoring for anything managers care more about analyzing kpis and cdrs than understanding the work of entrylevel employees that make those kpis and cdrs happen program budgets on civil aviation can be disorganized and chaotic you may work mandatory overtime and then be told to stop working on all customer projects in the same quarter worklife balance depends heavily on the teams sometimes managers barely know what each employee is working on each week but ive also seen teams where weekend meetings were normal direct managers may be remote and can sometimes be too handsoff good luck getting your manager to appropriately address a dysfunctional team when youve never physically met them and only talk once a month
Tech Mahindra,1.0,2023-11-08,internal politics and micro management,current employee more than 1 year,data engineer,"Redmond, WA",at start it will be all good,micromanagement starts after a few months and you have to give hourly updates every day of your work if you dont work overtime you will be threatened of getting fired
Seagate Technology,3.0,2023-06-02,great people awful management,former employee more than 8 years,senior engineer,"Longmont, CO",work life balance was good low level managers and employees made for a good working atmosphere,layoffs every 24 years compensation package lags behind the industry especially if you work in software management cycles through over hiring and layoffs
Xilinx,5.0,2022-04-09,great management and team,former employee more than 3 years,senior staff product engineer,,work life balance is great,work gets boring after a while
IDEMIA,2.0,2023-11-06,horrible management no promotion no rise low pay,former employee more than 5 years,engineer,"New York, NY",pros easy job some flexibility,you will not grow you will not learn anything useful horrible management they dont care about employees no rise no promotion no employee recognition management lies and gives fake promises each year most employees will put you under the bus
Tableau Software,3.0,2022-04-18,great product horrible management,current employee less than 1 year,technical support engineer,"Seattle, WA",the product is great and helps a lot of people as a salesforce company receive great benefits the office is nice and has free snacks,instead of hiring more people they load more work onto the employees little hope of change since upper management doe not listen to employee concerns and suggestions get stuck in a role waiting years for positions to open up to grow up within the company
Infinite Computer Solutions,4.0,2022-06-09,good management look after you,current employee more than 1 year,data engineer,"Rockville, MD",they take care of their employees for the most part being a service provider the clients always think they are right but infinite will back their employees when the client is wrong,long hours sometimes little communication
Teradata,2.0,2023-11-16,competitive salary but lacking in management direction,former employee more than 1 year,solution engineer,"San Diego, CA",compared to other similar roles in the industry the salary was above market value,lack of leadership in the competitive cloud market management is not being held accountable for a tough market onboarding when i first started was atrocious at best still felt that there was so much i wasnt taught when i left
OpenText,5.0,2024-03-05,top tier management and technical staff in zixappriver division,former employee more than 3 years,software developer,"Addison, TX",agile in spirit and execution,heavy traffic during commute time
Xilinx,1.0,2009-04-27,the greed and averous of the executive management is disgusting,current employee,senior staff engineer,"Longmont, CO",xilinx still has many exceptionally talented people working here for now the work ethic and integrity of most individual contributors is exceptional despite the ridiculous burden of work placed upon them due to layoffs,the apparent greed and averous of the executive management is disgusting they have shown monumental short sightedness in most of their recent business decisions they have been completely reactionary to the competition and have been outmaneuvered at every point since taking over in 08 xilinx presently has over 30 vps or higher and more than 180 directors or higher showing that the ratio of senior management to individual contributors is skewed to a nonsensical extreme xilinx is acting like a start up in askingpushing employees to put in very long hours to make up for the reduction in staff after two sizable layoffs this might be reasonable if employees believed management had some intelligent plan for the future but no such plan has been communicated there is little prospect of reward for the extra effort being demanded when the economy improves i predict a mass exodus from xilinx us and europe this is probably what moshe is wanting so he can move more jobs to india and singapore
Samsung SDS,2.0,2024-01-09,low pay and limited direction from management,current employee,sr engineer,"Ridgefield Park, NJ",decent work life balance global brand,pay is exceptionally low for tech roles and across the company management is hampered by hq in korea long term strategy gets nixed every few years due to reorg no career growth annual reviews are graded on a curve so be prepared to hear you did amazing year after year but that your manager can only give a limited number of good reviews so your bonus pay is nil poor benefits to comparable companies nonnative koreans are treated poorly
DocuSign,5.0,2024-01-06,great company to work with good management,current employee more than 3 years,sr technical support engineer,"San Francisco, CA",worklife balance is great good management team to lead and respect the workers,project planning can be improve
